jcoglan,2011-11-09 23:08:56,https://api.github.com/repos/faye/faye/git/commits/47511648ce62bce558b3c7a3befbf1fc014008d1,47511648ce62bce558b3c7a3befbf1fc014008d1,Documentation typo.
jcoglan,2011-11-09 23:07:39,https://api.github.com/repos/faye/faye/git/commits/b002646bf4c5d8e8778f39b9e0f6c957e2b8525c,b002646bf4c5d8e8778f39b9e0f6c957e2b8525c,Document callbacks for publication.
jcoglan,2011-11-09 22:44:44,https://api.github.com/repos/faye/faye/git/commits/89d3a00f20b7ae8e275ab87591c1fb5fc89ade45,89d3a00f20b7ae8e275ab87591c1fb5fc89ade45,Close WebSocket without ack when EventMachine reports an unbind.
jcoglan,2011-11-09 22:43:31,https://api.github.com/repos/faye/faye/git/commits/5c319db1ac0de88c8bb55053e5390d3d5513b7f6,5c319db1ac0de88c8bb55053e5390d3d5513b7f6,Close WebSockets without requiring an ack when the TCP connection drops.
jcoglan,2011-11-09 22:43:00,https://api.github.com/repos/faye/faye/git/commits/c5a828e4430c2afad30d5d0f72104f152a6cf94f,c5a828e4430c2afad30d5d0f72104f152a6cf94f,Formatting changes to examples/client.js.
jcoglan,2011-11-09 22:22:41,https://api.github.com/repos/faye/faye/git/commits/c99f6c1aac59b7cbe0e6197ad236cdee295cddbd,c99f6c1aac59b7cbe0e6197ad236cdee295cddbd,"Stop using sys in Node examples, and use local faye var."
jcoglan,2011-11-09 22:20:02,https://api.github.com/repos/faye/faye/git/commits/d2704f3bbeb2b5cfa1b72f00878fce1b0a255eb5,d2704f3bbeb2b5cfa1b72f00878fce1b0a255eb5,Implement publish() feedback for JavaScript.
jcoglan,2011-11-09 21:51:59,https://api.github.com/repos/faye/faye/git/commits/3db20bde1ae6aa1c1538bc01f31cb671239f39b1,3db20bde1ae6aa1c1538bc01f31cb671239f39b1,"Merge remote branch 'groupme/publication' into 0.7.x

Conflicts:
	lib/faye.rb"
cmdrkeene,2011-11-09 15:14:40,https://api.github.com/repos/faye/faye/git/commits/f488359e5205ad5d64ed180ef260db3d38ce6f85,f488359e5205ad5d64ed180ef260db3d38ce6f85,Add Publication deferrable to Client.publish()
cmdrkeene,2011-11-09 15:07:28,https://api.github.com/repos/faye/faye/git/commits/f5ef2564ec363bb5223e9657dd7dfdccd3edc61c,f5ef2564ec363bb5223e9657dd7dfdccd3edc61c,Ignore .rvmrc
jcoglan,2011-11-09 12:44:52,https://api.github.com/repos/faye/faye/git/commits/92072a4f35778e0e4b867d7941620f4be82de7c5,92072a4f35778e0e4b867d7941620f4be82de7c5,Comment to tell people not to delete JS file from the gemspec.
jcoglan,2011-11-09 12:44:52,https://api.github.com/repos/faye/faye/git/commits/01ea0bf36a3907310b98d2f4c4f552a0632d7423,01ea0bf36a3907310b98d2f4c4f552a0632d7423,Comment to tell people not to delete JS file from the gemspec.
jcoglan,2011-11-08 23:34:21,https://api.github.com/repos/faye/faye/git/commits/2503004d40b4b8732b02ac0036d8d0cfb109ffff,2503004d40b4b8732b02ac0036d8d0cfb109ffff,Bump version number to 0.7.0.
jcoglan,2011-11-08 23:18:52,https://api.github.com/repos/faye/faye/git/commits/7d3370da86064276879499545c553818825e33a2,7d3370da86064276879499545c553818825e33a2,Reorder a few functions.
jcoglan,2011-11-08 23:09:30,https://api.github.com/repos/faye/faye/git/commits/97e29a2d51b474902fbc150083e3c772351fab4c,97e29a2d51b474902fbc150083e3c772351fab4c,"Put all the 'require' statements at the top of the root file, and load all internal parts of Faye using autoload."
jcoglan,2011-11-08 22:46:08,https://api.github.com/repos/faye/faye/git/commits/e9484300dcfee1b92450dc1badebd1e8ddecf80d,e9484300dcfee1b92450dc1badebd1e8ddecf80d,Strip comments out of redis.conf.
jcoglan,2011-11-08 00:00:09,https://api.github.com/repos/faye/faye/git/commits/c2e8d13841a41d07003b242e17790439467bd240,c2e8d13841a41d07003b242e17790439467bd240,"Close open WebSockets when Client#disconnect completes. Fixes the tests on Node 0.6, where open sockets stop the server shutting down."
jcoglan,2011-11-07 23:12:20,https://api.github.com/repos/faye/faye/git/commits/55e613086427f783eb0e13385ae60a9a28f72cf5,55e613086427f783eb0e13385ae60a9a28f72cf5,Correct user agents for Autobahn client tests.
jcoglan,2011-11-07 23:12:04,https://api.github.com/repos/faye/faye/git/commits/99b995ab19bdf2c2cf6cb3dc20e736e405a4d364,99b995ab19bdf2c2cf6cb3dc20e736e405a4d364,Remove some redundant Protocol8Parser methods.
jcoglan,2011-11-06 18:37:49,https://api.github.com/repos/faye/faye/git/commits/c57e8f4559bf9f9a6fd7a995f0e1900b7f81b2ce,c57e8f4559bf9f9a6fd7a995f0e1900b7f81b2ce,Fix WebSocket client handshake on Node 0.6.
jcoglan,2011-11-06 18:07:18,https://api.github.com/repos/faye/faye/git/commits/07c0331f2b563ba868be2125784873d36d5c9c03,07c0331f2b563ba868be2125784873d36d5c9c03,Add masking to the WebSocket clients and pass the Autobahn client tests.
jcoglan,2011-11-06 15:09:28,https://api.github.com/repos/faye/faye/git/commits/3c029eca59d353366a066c60ba57750fd37bc535,3c029eca59d353366a066c60ba57750fd37bc535,Move example websocket files.
jcoglan,2011-11-06 15:05:59,https://api.github.com/repos/faye/faye/git/commits/2524c234be8d56b1976115fd30697504744dfb7a,2524c234be8d56b1976115fd30697504744dfb7a,Echo closing codes and expose the code and reason to onclose events.
jcoglan,2011-11-06 12:43:18,https://api.github.com/repos/faye/faye/git/commits/1b7c16f0ad7c0f12209319f9e0a31136faf54d37,1b7c16f0ad7c0f12209319f9e0a31136faf54d37,Implement the correct signature for the WebSocket#close method.
jcoglan,2011-11-06 03:20:55,https://api.github.com/repos/faye/faye/git/commits/c261bacc14662ab83b8457408311b8dc245ebc38,c261bacc14662ab83b8457408311b8dc245ebc38,Refactor Faye::WebSocket to take a raw env rather than a Rack::Request.
jcoglan,2011-11-06 03:12:39,https://api.github.com/repos/faye/faye/git/commits/21f68b53ddd8f3e9a9bf1a870fa516fe36df30c5,21f68b53ddd8f3e9a9bf1a870fa516fe36df30c5,Adjust a few load paths in Ruby code.
jcoglan,2011-11-06 02:44:01,https://api.github.com/repos/faye/faye/git/commits/8f5e9393a7ab2ede98ac5de7d5fcd1be6f97c2bb,8f5e9393a7ab2ede98ac5de7d5fcd1be6f97c2bb,Catch close frames with invalid UTF-8 payloads.
jcoglan,2011-11-06 00:33:40,https://api.github.com/repos/faye/faye/git/commits/6ce1fe2767b137f6f6fad418e9224276308eadf5,6ce1fe2767b137f6f6fad418e9224276308eadf5,Fix *some* UTF-8 encoding problems with Node WebSockets.
jcoglan,2011-11-05 22:52:21,https://api.github.com/repos/faye/faye/git/commits/464eef3c0f7f20279954b80af05f02757a268783,464eef3c0f7f20279954b80af05f02757a268783,"Store WebSocket handshake buffer as bytes, not strings."
jcoglan,2011-11-05 20:46:01,https://api.github.com/repos/faye/faye/git/commits/4f296024dfddcd1e3c94b90dfe4857571ade1d98,4f296024dfddcd1e3c94b90dfe4857571ade1d98,"This commit passes Autobahn tests on Ruby{1.8.7,1.9.2,1.9.3} and Node{0.4.12,0.6.0}, except for UTF-8 validation on Node."
jcoglan,2011-11-05 20:44:55,https://api.github.com/repos/faye/faye/git/commits/9ca464a8c73d43c5b3529e55be642ca92afe9d44,9ca464a8c73d43c5b3529e55be642ca92afe9d44,Make WebSocket echo server run on Ruby 1.8.7.
jcoglan,2011-11-05 19:16:50,https://api.github.com/repos/faye/faye/git/commits/30e66b741b076128646e197e4fb104a722d373b2,30e66b741b076128646e197e4fb104a722d373b2,"Fix incorrect WebSocket close responses, except for UTF-8 validation in Node."
jcoglan,2011-11-05 19:06:16,https://api.github.com/repos/faye/faye/git/commits/ccab18314e92c2f7b4d6d64c471816337d01b393,ccab18314e92c2f7b4d6d64c471816337d01b393,Fix UTF-8 conformance in Ruby WebSocket handler.
jcoglan,2011-11-05 13:22:40,https://api.github.com/repos/faye/faye/git/commits/8d9cb57bf1cb477033d83f79a01de3a22c874720,8d9cb57bf1cb477033d83f79a01de3a22c874720,"Merge branch 'master' into 0.7.x

Conflicts:
	.gitignore
	site/src/pages/ruby.haml"
jcoglan,2011-11-05 13:20:22,https://api.github.com/repos/faye/faye/git/commits/3e0294f0ccbb4264db411dc26d5af87eb465239e,3e0294f0ccbb4264db411dc26d5af87eb465239e,process.ARGV is now called process.argv.
jcoglan,2011-11-05 13:20:04,https://api.github.com/repos/faye/faye/git/commits/d34909527e1c72e19225ad95c6d10f502001df4a,d34909527e1c72e19225ad95c6d10f502001df4a,Ignore vim files.
jcoglan,2011-11-05 01:46:39,https://api.github.com/repos/faye/faye/git/commits/50ea9647fd44ecef28f71d858b36c6283e9a7abc,50ea9647fd44ecef28f71d858b36c6283e9a7abc,Close sockets if RSV bits are set.
jcoglan,2011-11-05 01:27:42,https://api.github.com/repos/faye/faye/git/commits/f5fde8d60a17eba8cc461faac0c0e3cf966d8e11,f5fde8d60a17eba8cc461faac0c0e3cf966d8e11,Fix some WebSocket ping/pong bugs.
jcoglan,2011-11-04 23:30:17,https://api.github.com/repos/faye/faye/git/commits/a55609dc14dd71c292b780bae698262b2ddc930c,a55609dc14dd71c292b780bae698262b2ddc930c,Support binary WebSocket messages.
jcoglan,2011-11-04 00:36:56,https://api.github.com/repos/faye/faye/git/commits/67e92af0b826dfa1ab7ab79ae2edafed00208022,67e92af0b826dfa1ab7ab79ae2edafed00208022,More WebSocket closing tweaks.
jcoglan,2011-11-03 23:47:16,https://api.github.com/repos/faye/faye/git/commits/db8a4d02575d6d7c8a86bc4de06b9f4786897d37,db8a4d02575d6d7c8a86bc4de06b9f4786897d37,Handle WebSocket closing codes (more) correctly.
jcoglan,2011-11-03 23:03:43,https://api.github.com/repos/faye/faye/git/commits/ea2d8af5049f212a8bfaef0d9b71706e80670359,ea2d8af5049f212a8bfaef0d9b71706e80670359,Close WebSocket connections on the server side after sending the close response.
jcoglan,2011-11-03 21:31:40,https://api.github.com/repos/faye/faye/git/commits/82ab408168696c98bd77f0e4e4a6a510d35e242a,82ab408168696c98bd77f0e4e4a6a510d35e242a,Delete a blank line.
jcoglan,2011-11-02 22:39:34,https://api.github.com/repos/faye/faye/git/commits/e476f2469d73650ba45457716692c2365959ec98,e476f2469d73650ba45457716692c2365959ec98,Fix handling of empty protocol-8 WebSocket text frames.
jcoglan,2011-11-01 21:06:07,https://api.github.com/repos/faye/faye/git/commits/2e28a4c28d427f5f36548bb75c79826afa7e376f,2e28a4c28d427f5f36548bb75c79826afa7e376f,Some WebSocket echo servers.
jcoglan,2011-10-24 08:56:42,https://api.github.com/repos/faye/faye/git/commits/770637f89fde2e21bd5e36df3782e1185a169bd3,770637f89fde2e21bd5e36df3782e1185a169bd3,"Merge pull request #105 from CodeBlock/patch-1

Add a missing space in between two words ;)"
jcoglan,2011-10-21 20:51:21,https://api.github.com/repos/faye/faye/git/commits/6e332d9989d6ff017074e0d16446d9d38e5b8ebe,6e332d9989d6ff017074e0d16446d9d38e5b8ebe,Copy messages where necessary so that a different object is used for each client the message is sent to. This means extensions will get a clean copy of the message each they are invoked.
jcoglan,2011-10-20 20:17:31,https://api.github.com/repos/faye/faye/git/commits/d47617a554f9a722323677cbcfe02f122dd1c3f3,d47617a554f9a722323677cbcfe02f122dd1c3f3,"Merge branch 'master' into 0.7.x

Conflicts:
	javascript/util/node/web_socket.js"
jcoglan,2011-10-20 20:01:31,https://api.github.com/repos/faye/faye/git/commits/a2ad13c82958ea7a2376c70a9df9860f2f4eb451,a2ad13c82958ea7a2376c70a9df9860f2f4eb451,Update version numbers and changelog.
jcoglan,2011-10-20 19:52:32,https://api.github.com/repos/faye/faye/git/commits/e3fb0c17db1ffdf607b8323235b03e19c27057e0,e3fb0c17db1ffdf607b8323235b03e19c27057e0,Adjust Terminus test script.
jcoglan,2011-10-18 21:12:35,https://api.github.com/repos/faye/faye/git/commits/fecd377d54193426a274f48c9e17e51da811dea9,fecd377d54193426a274f48c9e17e51da811dea9,Increase timeout in CORS and JSON-P transports since the error handlers are probably in a race with the server returning the response.
jcoglan,2011-10-18 20:20:32,https://api.github.com/repos/faye/faye/git/commits/4ddd612d7b88696e4c094b14f249735bf9d8711a,4ddd612d7b88696e4c094b14f249735bf9d8711a,Return 304 for the client script if the If-Modified-Since header is equal to the file's mtime.
jcoglan,2011-10-18 20:14:15,https://api.github.com/repos/faye/faye/git/commits/58152baaea4b5830fe0aa9b3126d1c9a51d08dc8,58152baaea4b5830fe0aa9b3126d1c9a51d08dc8,s/head/headers/
jcoglan,2011-10-18 20:11:33,https://api.github.com/repos/faye/faye/git/commits/57e36724de65d1fe794166efac91195831bafee3,57e36724de65d1fe794166efac91195831bafee3,Give the client script precendence when routing a request in RackAdapter.
jcoglan,2011-10-18 20:01:30,https://api.github.com/repos/faye/faye/git/commits/31f7824d50246502dee608c47fb8f077f3a0a7cb,31f7824d50246502dee608c47fb8f077f3a0a7cb,Add HTTP caching using ETag and Last-Modified for serving the client script.
jcoglan,2011-10-15 09:07:43,https://api.github.com/repos/faye/faye/git/commits/294f99508b00987e8973fd6d9675c11faf84b7a9,294f99508b00987e8973fd6d9675c11faf84b7a9,Make RackAdapter cache the client script in memory.
jcoglan,2011-10-15 08:58:19,https://api.github.com/repos/faye/faye/git/commits/257a988e664126d4302eed57c435174bcbcc463a,257a988e664126d4302eed57c435174bcbcc463a,Don't call cleanUp before we've got the data from the XHR object.
jcoglan,2011-10-15 08:57:38,https://api.github.com/repos/faye/faye/git/commits/70eb1ed6a5286041238e61097ec068350089c36e,70eb1ed6a5286041238e61097ec068350089c36e,Make sure cleanUp in CORS transport can safely be re-called.
jcoglan,2011-10-15 08:51:04,https://api.github.com/repos/faye/faye/git/commits/a4f5fcc71dbf54fe1a7708814f4a01b3178662f5,a4f5fcc71dbf54fe1a7708814f4a01b3178662f5,Refactor some network error handling for CORS and JSON-P.
jcoglan,2011-09-23 17:16:36,https://api.github.com/repos/faye/faye/git/commits/b1d26c7a070a6574790528573ae229afac4b5e07,b1d26c7a070a6574790528573ae229afac4b5e07,Document socket connection option for Redis.
jcoglan,2011-09-23 17:09:36,https://api.github.com/repos/faye/faye/git/commits/0ecb537d769bd59223999fca7f60deb8baa2d7d2,0ecb537d769bd59223999fca7f60deb8baa2d7d2,Merge branch 'master' into 0.7.x
jcoglan,2011-09-23 17:09:24,https://api.github.com/repos/faye/faye/git/commits/be0bc533b29cc87c1a983a7e541dcff4ac19c158,be0bc533b29cc87c1a983a7e541dcff4ac19c158,"Use a Redis transaction when flushing a client's message queue, prevents the same message being delivered multiple times."
jcoglan,2011-09-23 16:10:13,https://api.github.com/repos/faye/faye/git/commits/3789914ef29785b2b4c64d2641a2198bffc4bdeb,3789914ef29785b2b4c64d2641a2198bffc4bdeb,Depend on npm hiredis package.
jcoglan,2011-09-23 12:34:07,https://api.github.com/repos/faye/faye/git/commits/148e759474028787c202e0835620399f2d945ca7,148e759474028787c202e0835620399f2d945ca7,Test Redis connections through a Unix socket.
jcoglan,2011-09-23 12:20:32,https://api.github.com/repos/faye/faye/git/commits/805a23f09e319b7064ae37d0df2331b1df52a0e2,805a23f09e319b7064ae37d0df2331b1df52a0e2,"Merge remote branch 'dre3k/master' into redis-socket

Conflicts:
	javascript/engines/redis.js"
jcoglan,2011-09-23 11:34:39,https://api.github.com/repos/faye/faye/git/commits/d21e8511faaba75329751ebf9f98ab545a148ab7,d21e8511faaba75329751ebf9f98ab545a148ab7,Adjust cookie parsing code.
jcoglan,2011-09-23 06:40:15,https://api.github.com/repos/faye/faye/git/commits/563f66cb077ba11f391c4f4e75c9a04f036031b3,563f66cb077ba11f391c4f4e75c9a04f036031b3,Delay WebSocket client test to give the server time to spin up.
jcoglan,2011-09-23 01:03:19,https://api.github.com/repos/faye/faye/git/commits/2cd7ad010f20d108d0eae6a8268a7e43a6785500,2cd7ad010f20d108d0eae6a8268a7e43a6785500,Merge branch 'cookies' into 0.7.x
jcoglan,2011-09-23 00:48:23,https://api.github.com/repos/faye/faye/git/commits/434b383a174e12c187783ce00bfeb4e56197458c,434b383a174e12c187783ce00bfeb4e56197458c,Merge branch 'master' into 0.7.x
jcoglan,2011-09-23 00:40:03,https://api.github.com/repos/faye/faye/git/commits/3f82e407ab7b5958e935fe03950abd5b32b729fe,3f82e407ab7b5958e935fe03950abd5b32b729fe,Documentation for monitoring events.
jcoglan,2011-09-22 23:09:10,https://api.github.com/repos/faye/faye/git/commits/fdccd771401d4565c2683f0f5827a2680b5e0db3,fdccd771401d4565c2683f0f5827a2680b5e0db3,Split server documentation into several pages.
jcoglan,2011-09-22 22:35:16,https://api.github.com/repos/faye/faye/git/commits/d6a292be9704ec0df2096d6203c34897b3658fe7,d6a292be9704ec0df2096d6203c34897b3658fe7,"Send no-cache, no-store cache-control headers on JSON-P responses, and remove the nocache param on JSON-P requests."
jcoglan,2011-09-22 20:22:07,https://api.github.com/repos/faye/faye/git/commits/92fc39d908861ce12cb8e8682a1ef9d208b9cccf,92fc39d908861ce12cb8e8682a1ef9d208b9cccf,"If a Redis lock is deleted between SETNX and GET, do nothing since it's probably caused by another process having just finished doing GC."
jcoglan,2011-09-22 17:38:43,https://api.github.com/repos/faye/faye/git/commits/7a08b405f880476fd12e48fa7811a550d947c519,7a08b405f880476fd12e48fa7811a550d947c519,Add cookie support to Transport::Http.
jcoglan,2011-09-22 14:42:56,https://api.github.com/repos/faye/faye/git/commits/20b41fa8d50eaa138d7cca39cb7c55f959468be6,20b41fa8d50eaa138d7cca39cb7c55f959468be6,Add cookie capabilities to Transport.NodeHttp.
jcoglan,2011-09-21 18:35:45,https://api.github.com/repos/faye/faye/git/commits/2854f0523c4b585fbf57255b1746bc5ca2a43496,2854f0523c4b585fbf57255b1746bc5ca2a43496,Record some benchmarks for different transport types.
jcoglan,2011-09-21 18:09:15,https://api.github.com/repos/faye/faye/git/commits/a1154da915c70042ce20b95230acebcbf913ab0e,a1154da915c70042ce20b95230acebcbf913ab0e,Fix the server integration specs so that HTTP client tests work.
jcoglan,2011-09-21 14:52:46,https://api.github.com/repos/faye/faye/git/commits/415334816fb965250e3b39d7c5d2dc0838e2e43b,415334816fb965250e3b39d7c5d2dc0838e2e43b,"Merge branch 'websocket-client' into 0.7.x

Conflicts:
	javascript/util/node/web_socket.js
	lib/faye/util/web_socket.rb"
jcoglan,2011-09-21 14:42:21,https://api.github.com/repos/faye/faye/git/commits/baac038f292e55b7af202f37ce62670e4e2f88b8,baac038f292e55b7af202f37ce62670e4e2f88b8,Merge branch 'master' into websocket-client
jcoglan,2011-09-21 14:41:18,https://api.github.com/repos/faye/faye/git/commits/a3fd080d1dcbcca75a7fbc0b9a6938cdae18373d,a3fd080d1dcbcca75a7fbc0b9a6938cdae18373d,Don't publish subscribe events for subscriptions that already exist.
jcoglan,2011-09-20 23:28:50,https://api.github.com/repos/faye/faye/git/commits/91e6ce180a36a0dad076e9f93cbdc082ca554295,91e6ce180a36a0dad076e9f93cbdc082ca554295,Merge branch 'master' into notifications
jcoglan,2011-09-20 22:58:37,https://api.github.com/repos/faye/faye/git/commits/a66ff170c57b9857f9c022f7d58a6e3666fc0688,a66ff170c57b9857f9c022f7d58a6e3666fc0688,Add a random element to the nocache parameter in the JSON-P transport.
jcoglan,2011-09-20 22:47:51,https://api.github.com/repos/faye/faye/git/commits/38202dbf921d7a29f1ab535b73013b7041221810,38202dbf921d7a29f1ab535b73013b7041221810,"Merge pull request #97 from ramonpoca/master

Fix for #96: IE caching JSONP handshakes."
ramonpoca,2011-09-20 11:23:20,https://api.github.com/repos/faye/faye/git/commits/46eec28f22f2f48a64088413c4c3e2e306e9ff8b,46eec28f22f2f48a64088413c4c3e2e306e9ff8b,Add a random parameter to the JSONP URL to bypass IE caching previous responses.
jcoglan,2011-09-18 01:46:10,https://api.github.com/repos/faye/faye/git/commits/c993e6718ca8306c7c9408a5e025bcc9b4d610ec,c993e6718ca8306c7c9408a5e025bcc9b4d610ec,Check that timeout still exists when GETing after SETNX in Redis engine.
dre3k,2011-09-17 16:17:58,https://api.github.com/repos/faye/faye/git/commits/aa25341bf99ca9f8149c6b53e0295aee42a4e5e9,aa25341bf99ca9f8149c6b53e0295aee42a4e5e9,Allow using a unix socket for redis
jcoglan,2011-09-17 14:24:44,https://api.github.com/repos/faye/faye/git/commits/0f04678261089736840c36a3b12805ff5b62e765,0f04678261089736840c36a3b12805ff5b62e765,Merge branch 'master' into notifications
jcoglan,2011-09-17 09:29:01,https://api.github.com/repos/faye/faye/git/commits/2b636958c9b138f2c0f6ccc586b582a7b9b26b6c,2b636958c9b138f2c0f6ccc586b582a7b9b26b6c,Consistent use of milliseconds for times in Ruby Redis engine.
jcoglan,2011-09-15 23:34:11,https://api.github.com/repos/faye/faye/git/commits/c73bffa7b7336e0aa83933160eed6d9fa0ba3f3d,c73bffa7b7336e0aa83933160eed6d9fa0ba3f3d,Default to empty string for Redis engine namespace in Node version -- was inserting 'undefined' into DB keys.
jcoglan,2011-09-13 15:04:34,https://api.github.com/repos/faye/faye/git/commits/88823de86d84a99b39f4a9375d44a0dc523d5586,88823de86d84a99b39f4a9375d44a0dc523d5586,"Merge pull request #94 from carlhoerberg/connect_https

Browser faye doesn't connect over https"
carlhoerberg,2011-09-13 14:11:38,https://api.github.com/repos/faye/faye/git/commits/aff7356ab5c11fb9ce0574bf396f47f200770f34,aff7356ab5c11fb9ce0574bf396f47f200770f34,"Don't default to http, use the current protocol"
jcoglan,2011-09-12 20:00:21,https://api.github.com/repos/faye/faye/git/commits/25d3d8aee8a2fa1f9e17507273fc4cfc41474506,25d3d8aee8a2fa1f9e17507273fc4cfc41474506,Fix a bug deciding whether to publish :unsubscribe notifications.
jcoglan,2011-09-12 19:52:59,https://api.github.com/repos/faye/faye/git/commits/5b6abbd618f1d5893f6a8dcc52d15338d3ce6460,5b6abbd618f1d5893f6a8dcc52d15338d3ce6460,Implement engine notifications for Node.
jcoglan,2011-09-12 19:10:20,https://api.github.com/repos/faye/faye/git/commits/d3f7df83ad1813ac7efbd1a91e66451c474b2cac,d3f7df83ad1813ac7efbd1a91e66451c474b2cac,Merge branch 'master' into notifications
jcoglan,2011-09-12 19:01:12,https://api.github.com/repos/faye/faye/git/commits/3b380f003d9dc65d14c69afc4b57e08d14e077b4,3b380f003d9dc65d14c69afc4b57e08d14e077b4,Bump version in package.json.
jcoglan,2011-09-12 18:55:44,https://api.github.com/repos/faye/faye/git/commits/d20f1cce9fc15b9e658918708a4056c7ba5db7e9,d20f1cce9fc15b9e658918708a4056c7ba5db7e9,Document SSL options to Adapter#listen.
jcoglan,2011-09-12 18:49:13,https://api.github.com/repos/faye/faye/git/commits/95a610f0c13764715f690c64924bc9d5cad9348a,95a610f0c13764715f690c64924bc9d5cad9348a,Bump version number and changelog for 0.6.6.
jcoglan,2011-09-12 18:39:27,https://api.github.com/repos/faye/faye/git/commits/4d8e62d07fc0759faf379578a73bcd80df9f63dd,4d8e62d07fc0759faf379578a73bcd80df9f63dd,Lock down em-http-request dependency to make the gem installable.
jcoglan,2011-09-09 15:19:50,https://api.github.com/repos/faye/faye/git/commits/cfbed12458dd7d4e98289da4b5a3718c4695aac8,cfbed12458dd7d4e98289da4b5a3718c4695aac8,"Merge pull request #92 from ramonpoca/master

Check ontimeout for IE9 in IE8 comp. mode"
ramonpoca,2011-09-08 13:06:44,https://api.github.com/repos/faye/faye/git/commits/aaa5b8067f7a5158f33e623ad5201a208e4bd95c,aaa5b8067f7a5158f33e623ad5201a208e4bd95c,Edited javascript/transport/cors.js via GitHub
jcoglan,2011-09-01 18:34:15,https://api.github.com/repos/faye/faye/git/commits/5da824f423d1ae97d1fdeceeada1d35987bf61ed,5da824f423d1ae97d1fdeceeada1d35987bf61ed,Remove the 'receive' event.
jcoglan,2011-09-01 18:25:29,https://api.github.com/repos/faye/faye/git/commits/6bd3a4770e2822d88b78cd07d4a20bd009a161ca,6bd3a4770e2822d88b78cd07d4a20bd009a161ca,"Merge branch 'master' into notifications

Conflicts:
	examples/ruby/server.rb"
jcoglan,2011-09-01 18:23:55,https://api.github.com/repos/faye/faye/git/commits/a11ed1fb06fe2c91dac57e1ae13a6065d08533ca,a11ed1fb06fe2c91dac57e1ae13a6065d08533ca,Bring all the new WebSocket parser stuff onto master.
jcoglan,2011-08-30 23:31:59,https://api.github.com/repos/faye/faye/git/commits/203900a3268033d0fc2defb95e7705823fca4256,203900a3268033d0fc2defb95e7705823fca4256,Add some benchmarking scripts to measure difference made by server-side socket clients.
jcoglan,2011-08-30 21:04:56,https://api.github.com/repos/faye/faye/git/commits/715ab3838e77efb15c318f4e84d9d9fb75a74588,715ab3838e77efb15c318f4e84d9d9fb75a74588,Allow example clients to be set to connect via SSL.
jcoglan,2011-08-30 20:59:38,https://api.github.com/repos/faye/faye/git/commits/babc0c05410c095a8d741d462b29de03657b09ad,babc0c05410c095a8d741d462b29de03657b09ad,Implement secure WebSocket clients. Mostly okay except for some perf problems with new SSL-aware HTTP transport for Node.
jcoglan,2011-08-30 18:53:11,https://api.github.com/repos/faye/faye/git/commits/1502b65457e42fb83ea6e9cc9640c423902a0301,1502b65457e42fb83ea6e9cc9640c423902a0301,"Merge branch 'master' into websocket-client

Conflicts:
	javascript/util/node/web_socket.js
	javascript/util/node/web_socket/protocol8_parser.js
	lib/faye/util/web_socket.rb
	vendor/js.class"
jcoglan,2011-08-30 17:37:54,https://api.github.com/repos/faye/faye/git/commits/f0bf0588395f4ac9575f4bb8fa6ae465770ac517,f0bf0588395f4ac9575f4bb8fa6ae465770ac517,Add SSL options to Adapter#listen.
jcoglan,2011-08-30 13:05:46,https://api.github.com/repos/faye/faye/git/commits/35e6d75c66b2e14ffcccf636983dabfe6a3360a3,35e6d75c66b2e14ffcccf636983dabfe6a3360a3,Set up example servers to run in HTTPS mode.
jcoglan,2011-08-29 21:16:45,https://api.github.com/repos/faye/faye/git/commits/1784136d7c1f247fe0cced0b66beb48b36d0c810,1784136d7c1f247fe0cced0b66beb48b36d0c810,Do a nicer job of constructing example endpoint that works for HTTPS and portless hosts.
jcoglan,2011-08-29 19:27:59,https://api.github.com/repos/faye/faye/git/commits/ae9be4d9feaa5010a0fb3e071f3bf518a0588d9a,ae9be4d9feaa5010a0fb3e071f3bf518a0588d9a,Update version info.
jcoglan,2011-08-29 19:24:56,https://api.github.com/repos/faye/faye/git/commits/96f8f6ea9652a2d6983f2e81f31d3e70cea2541d,96f8f6ea9652a2d6983f2e81f31d3e70cea2541d,Make WebSocket#close take any number of args.
jcoglan,2011-08-29 15:37:02,https://api.github.com/repos/faye/faye/git/commits/d402866dcf7d1b67608b0a9be69f09667efcdc4d,d402866dcf7d1b67608b0a9be69f09667efcdc4d,Undo some example debugging.
jcoglan,2011-08-29 15:36:26,https://api.github.com/repos/faye/faye/git/commits/6d1528507c307ed27cd39d404a9370c91fdcfa94,6d1528507c307ed27cd39d404a9370c91fdcfa94,Backport parsers from websocket-client branch.
jcoglan,2011-08-29 15:14:46,https://api.github.com/repos/faye/faye/git/commits/2567bc8e9177df6ca7dd4a0208bcf1a8c63a5f48,2567bc8e9177df6ca7dd4a0208bcf1a8c63a5f48,Bump JS.Class.
jcoglan,2011-08-29 15:04:06,https://api.github.com/repos/faye/faye/git/commits/3620e42aeeef7cf0a2ef71a414ad608e1b68394e,3620e42aeeef7cf0a2ef71a414ad608e1b68394e,Implement WebSocket transport for Ruby.
