jcoglan,2013-07-31 01:30:33,https://api.github.com/repos/faye/faye/git/commits/b67e7dd57a560aa8876df12d0d6ba56cfc568bb2,b67e7dd57a560aa8876df12d0d6ba56cfc568bb2,"Stop transport publishing up/down events, have the client emit them based on whether responses or errors are received."
jcoglan,2013-07-30 22:52:16,https://api.github.com/repos/faye/faye/git/commits/41c9574a1eeff54ac10c84c565e2a5d767981f99,41c9574a1eeff54ac10c84c565e2a5d767981f99,"Refactor the client/transport contract so that there is less per-transport error handling, especially of timeouts. This should give us more uniform reconnection recovery across transport types."
jcoglan,2013-07-29 22:23:07,https://api.github.com/repos/faye/faye/git/commits/423f22f436f62064bc902cbd5eb58b43dc96c118,423f22f436f62064bc902cbd5eb58b43dc96c118,"Have the WebSocket transport periodically send an empty message list to the server. This serves to 'wake the socket up' in situations where the connection is closed while the computer is asleep but Chrome doesn't report anything, and triggers the client into reconnecting."
jcoglan,2013-07-23 14:17:04,https://api.github.com/repos/faye/faye/git/commits/aa3f0801101f72323d507d6827b7dfec8bbf55a7,aa3f0801101f72323d507d6827b7dfec8bbf55a7,Escape characters that are safe in JSON but not safe in JavaScript when returning JSON-P responses.
jcoglan,2013-07-15 18:51:50,https://api.github.com/repos/faye/faye/git/commits/8b967051a077022b390d0245954707d14831ad94,8b967051a077022b390d0245954707d14831ad94,Replace 'write(buffer) ; end()' with 'end(buffer)'.
jcoglan,2013-07-14 23:31:04,https://api.github.com/repos/faye/faye/git/commits/7f4f86e0f4a26d1852eca58667f5448a8d418edc,7f4f86e0f4a26d1852eca58667f5448a8d418edc,Only delete a Deferrable's promise if it's in a non-pending state. Otherwise every call to setDeferredStatus('deferred') erases the stored callbacks and breaks some reconnection logic in the WebSocket transport.
jcoglan,2013-07-14 17:07:52,https://api.github.com/repos/faye/faye/git/commits/8224b31651b5949b6916d39d13e53702a700e9e9,8224b31651b5949b6916d39d13e53702a700e9e9,"It's possible that we might call Server#open_socket with a nil value, so prevent this from creating invalid Socket wrappers."
jcoglan,2013-07-14 16:58:26,https://api.github.com/repos/faye/faye/git/commits/20b6cbbebcaedc30764516274f8aacfdbcdaf41a,20b6cbbebcaedc30764516274f8aacfdbcdaf41a,Check we have a socket before sending messages.
jcoglan,2013-07-14 15:53:24,https://api.github.com/repos/faye/faye/git/commits/9f9d39387e0ecee6722b146bc4c38e7cc3c868f7,9f9d39387e0ecee6722b146bc4c38e7cc3c868f7,Fix the server in the case where the mount point is /
jcoglan,2013-07-14 14:31:14,https://api.github.com/repos/faye/faye/git/commits/12e271efa1b93fded8f10a74bb038806f8f214d3,12e271efa1b93fded8f10a74bb038806f8f214d3,Wrap build in a closure to constrain scope of 'use strict'.
jcoglan,2013-07-14 12:01:16,https://api.github.com/repos/faye/faye/git/commits/522a63afe5a11e4fe24545a8dba0063396bb3428,522a63afe5a11e4fe24545a8dba0063396bb3428,Only read file once in extension examples.
jcoglan,2013-07-14 10:46:55,https://api.github.com/repos/faye/faye/git/commits/6e8d2e4b3f05e22797ffe8c763f18be1cfc2535b,6e8d2e4b3f05e22797ffe8c763f18be1cfc2535b,Implement request-size limiting across all batching transports.
jcoglan,2013-07-14 09:49:04,https://api.github.com/repos/faye/faye/git/commits/d2c4dccf208b9288afdc008d0790b6707e6f6127,d2c4dccf208b9288afdc008d0790b6707e6f6127,Add custom header support to the CORS and WebSocket transports.
jcoglan,2013-07-14 08:43:40,https://api.github.com/repos/faye/faye/git/commits/fac7f10e8b1bd9f96d7e6c118e90be1125c08364,fac7f10e8b1bd9f96d7e6c118e90be1125c08364,Swat rspec deprecation warnings
jcoglan,2013-07-14 08:40:21,https://api.github.com/repos/faye/faye/git/commits/ac5a27f1d59e57eb5e82fda31d5988667c79880b,ac5a27f1d59e57eb5e82fda31d5988667c79880b,Reorder some methods in the adapter classes.
jcoglan,2013-07-11 22:31:48,https://api.github.com/repos/faye/faye/git/commits/474ed51f9e316f7dc8bf6714269f896b54a7135f,474ed51f9e316f7dc8bf6714269f896b54a7135f,Fix protocol-relative URI parsing.
jcoglan,2013-07-11 22:08:51,https://api.github.com/repos/faye/faye/git/commits/0fc1ec8b70b6b7bde39ff2af234a7c7cb867ad20,0fc1ec8b70b6b7bde39ff2af234a7c7cb867ad20,Treat URLs as objects internally and accept URL objects instead of strings when creating a client.
jcoglan,2013-07-10 17:44:39,https://api.github.com/repos/faye/faye/git/commits/083f64859c7392be953c49ca270d62b8083ee486,083f64859c7392be953c49ca270d62b8083ee486,Allow Faye::Client to be instantiated with URI objects instead of strings.
jcoglan,2013-07-10 17:13:35,https://api.github.com/repos/faye/faye/git/commits/e7fb83592ad6fd654984d389477fb103a038be35,e7fb83592ad6fd654984d389477fb103a038be35,"A litte Promise refactoring, including making setTimeout unstubbable to fix the browser tests."
jcoglan,2013-07-10 11:04:48,https://api.github.com/repos/faye/faye/git/commits/dfef27b2d6661a4d16bfc3c8e9b37e9d634c4c13,dfef27b2d6661a4d16bfc3c8e9b37e9d634c4c13,Update URL to Promises/A+ docs.
jcoglan,2013-07-07 15:36:02,https://api.github.com/repos/faye/faye/git/commits/2f2886e963ebb675c9b7ddda16538b6d3dd45a97,2f2886e963ebb675c9b7ddda16538b6d3dd45a97,Make the deferrables returned by publish() and subscribe() compatible with Promises/A+.
jcoglan,2013-07-07 11:30:24,https://api.github.com/repos/faye/faye/git/commits/bb58261993dd131f4beceae313dd698d24a1c94c,bb58261993dd131f4beceae313dd698d24a1c94c,Implement Promises/A+.
jcoglan,2013-07-06 21:36:50,https://api.github.com/repos/faye/faye/git/commits/c09913550cf616022aeabecf62b343fb32dff590,c09913550cf616022aeabecf62b343fb32dff590,Add stubs for listen() method that raise deprecation errors.
jcoglan,2013-07-06 18:56:19,https://api.github.com/repos/faye/faye/git/commits/fcb0ce1ae5488e89bbc1f34975f2aec2f0c01c07,fcb0ce1ae5488e89bbc1f34975f2aec2f0c01c07,Update build instructions.
jcoglan,2013-07-06 18:55:24,https://api.github.com/repos/faye/faye/git/commits/a28db61ca32cc0d3efc242fabdfa4ded25026292,a28db61ca32cc0d3efc242fabdfa4ded25026292,Remove the listen() and stop() methods from the adapter classes.
jcoglan,2013-07-06 18:16:01,https://api.github.com/repos/faye/faye/git/commits/89ce3df83dd9f7f98946fd40962105adacfccbfb,89ce3df83dd9f7f98946fd40962105adacfccbfb,s/addListener/on/
jcoglan,2013-07-06 18:09:14,https://api.github.com/repos/faye/faye/git/commits/9eca64f8423de254cdd962e826a7dbe0dce49eea,9eca64f8423de254cdd962e826a7dbe0dce49eea,Accommodate the legacy functional style of logger.
jcoglan,2013-07-06 18:04:16,https://api.github.com/repos/faye/faye/git/commits/b7117601d1d3f0fa2483d953a4486b06556b41bf,b7117601d1d3f0fa2483d953a4486b06556b41bf,Make Faye.logger compatible with actual logging libraries.
jcoglan,2013-07-06 17:39:19,https://api.github.com/repos/faye/faye/git/commits/e434878751591aa59a5ecad4fc33bee28c03f285,e434878751591aa59a5ecad4fc33bee28c03f285,Load faye using Bundler in examples.
jcoglan,2013-07-06 17:33:22,https://api.github.com/repos/faye/faye/git/commits/69fd7386cf411d9c5714a5a6c2c73ceaa7bae035,69fd7386cf411d9c5714a5a6c2c73ceaa7bae035,Fix WebSocket construction in the browser.
jcoglan,2013-07-06 17:16:44,https://api.github.com/repos/faye/faye/git/commits/ac335a3b59d3f4381538d0c6c44c3e724e8603b5,ac335a3b59d3f4381538d0c6c44c3e724e8603b5,Remove clientId field from published messages.
jcoglan,2013-07-06 17:04:22,https://api.github.com/repos/faye/faye/git/commits/4084be2f7d6a8829a3c774bd9ec104d082f1af43,4084be2f7d6a8829a3c774bd9ec104d082f1af43,Fix use of clientId in transport.
jcoglan,2013-07-06 16:56:47,https://api.github.com/repos/faye/faye/git/commits/d4f2c4cd5b373a4b91283169bea5d7027d00cd00,d4f2c4cd5b373a4b91283169bea5d7027d00cd00,Remove the query methods for client ID and state.
jcoglan,2013-07-06 16:40:02,https://api.github.com/repos/faye/faye/git/commits/c9f5e026e6ad7871c0aca2adc5e207090d8965c1,c9f5e026e6ad7871c0aca2adc5e207090d8965c1,Remove json2 from the build.
jcoglan,2013-07-06 16:36:40,https://api.github.com/repos/faye/faye/git/commits/6758a1931fdb9725de984b4313669147f9665c32,6758a1931fdb9725de984b4313669147f9665c32,Add a 'ca' option to the JS client for passing the certificate for secure servers.
jcoglan,2013-07-06 16:15:09,https://api.github.com/repos/faye/faye/git/commits/6c864e1273e2d5f83934980a90541db631791422,6c864e1273e2d5f83934980a90541db631791422,Migrate the tests to jstest.
jcoglan,2013-06-06 21:52:46,https://api.github.com/repos/faye/faye/git/commits/edc5b42f6560d31eae61caf00f6765a90e1818d1,edc5b42f6560d31eae61caf00f6765a90e1818d1,Migrate from jake to wake as our JS build tool.
jcoglan,2013-05-12 22:47:37,https://api.github.com/repos/faye/faye/git/commits/9b4e29ecdf37ccc5097af6d94d7477253ce133ae,9b4e29ecdf37ccc5097af6d94d7477253ce133ae,Skip some tests on JRuby while we figure out to make them more robust.
jcoglan,2013-05-12 22:33:38,https://api.github.com/repos/faye/faye/git/commits/3d458b993bcfd06a314807b34c497d795b7a79f4,3d458b993bcfd06a314807b34c497d795b7a79f4,"Replace Yajl with MultiJson, so we now run on JRuby."
jcoglan,2013-05-12 22:12:58,https://api.github.com/repos/faye/faye/git/commits/a8216618af26978dffc441b077f1a43b5547e178,a8216618af26978dffc441b077f1a43b5547e178,Use Puma for the server integration tests.
jcoglan,2013-05-12 21:58:37,https://api.github.com/repos/faye/faye/git/commits/ce9cceca5e177d4fe57b65f67b324ab319e4e3b7,ce9cceca5e177d4fe57b65f67b324ab319e4e3b7,Replace Thin with Puma for running the RackAdapter tests.
jcoglan,2013-05-12 20:41:47,https://api.github.com/repos/faye/faye/git/commits/1dd29d62ab6c765b69924c027036c12e7d74264f,1dd29d62ab6c765b69924c027036c12e7d74264f,Add support for the rack.hijack API for async responses.
jcoglan,2013-05-12 20:38:21,https://api.github.com/repos/faye/faye/git/commits/fca45c0245f2f41aa8a0b8a3a984694762a6c2cc,fca45c0245f2f41aa8a0b8a3a984694762a6c2cc,"Remove cluster examples, you need a distributed backend for those."
jcoglan,2013-05-12 17:31:44,https://api.github.com/repos/faye/faye/git/commits/e01d5e881e33f36de84f05bc333e562b01008fd2,e01d5e881e33f36de84f05bc333e562b01008fd2,"Update dependencies, including upgrading to faye-websocket 0.6."
jcoglan,2013-05-08 11:56:07,https://api.github.com/repos/faye/faye/git/commits/1ee9e5985d4182e8f099bc7016c01f35ce5da6ee,1ee9e5985d4182e8f099bc7016c01f35ce5da6ee,Update our copy of json2.js.
jcoglan,2013-05-08 11:54:07,https://api.github.com/repos/faye/faye/git/commits/bd627fe3288cb6c0ec4075f0abf9a4f0aff3b2ea,bd627fe3288cb6c0ec4075f0abf9a4f0aff3b2ea,A couple of tweaks to package.json.
edef1c,2012-09-25 00:42:49,https://api.github.com/repos/faye/faye/git/commits/63f9f362ea90c83ede7641c95cdf031ac32dd5fc,63f9f362ea90c83ede7641c95cdf031ac32dd5fc,"Add final CommonJS/browserify magic.

Conflicts:

	javascript/faye.js"
edef1c,2012-09-25 00:41:00,https://api.github.com/repos/faye/faye/git/commits/832513fa620a71474f2096ab54968ec2796d42e3,832513fa620a71474f2096ab54968ec2796d42e3,add browserify magic
jcoglan,2013-04-03 23:37:19,https://api.github.com/repos/faye/faye/git/commits/e8f760cb5661331342de182834f5753e923dbaa9,e8f760cb5661331342de182834f5753e923dbaa9,"Remove confusing references to an endpoint that used to be in the security docs, but was removed."
jcoglan,2013-04-03 23:31:11,https://api.github.com/repos/faye/faye/git/commits/e4291dcb4ef48280578d9e41498e7db75a9afa66,e4291dcb4ef48280578d9e41498e7db75a9afa66,Fix a formatting error in security docs.
jcoglan,2013-03-14 10:38:50,https://api.github.com/repos/faye/faye/git/commits/04a29e4006ab68aa89f73a76aea2c64836cf4893,04a29e4006ab68aa89f73a76aea2c64836cf4893,Change how environment detection is done: use existence of 'window' to check we're in a browser.
jcoglan,2013-03-03 10:52:57,https://api.github.com/repos/faye/faye/git/commits/f4b7928ddea0317492588c78f50eb898d543c930,f4b7928ddea0317492588c78f50eb898d543c930,Change Terminus script to hit an external app instead of loading the app-under-test in process.
jcoglan,2013-02-26 22:52:35,https://api.github.com/repos/faye/faye/git/commits/c7fac489b1bcf4d12404b395cdb8ef06963a4425,c7fac489b1bcf4d12404b395cdb8ef06963a4425,Add Myspace to the list of user sites.
jcoglan,2013-02-26 22:44:11,https://api.github.com/repos/faye/faye/git/commits/3ae56688413c678bd5010bc8a0dd2b9dd9e42adf,3ae56688413c678bd5010bc8a0dd2b9dd9e42adf,Bump version to 0.8.9.
jcoglan,2013-02-24 18:09:25,https://api.github.com/repos/faye/faye/git/commits/f20c9fc76600a977ed5c2994e3a11defcc65fcb5,f20c9fc76600a977ed5c2994e3a11defcc65fcb5,Fix Ruby client handshake spec: bad Transport stub.
jcoglan,2013-02-21 21:22:56,https://api.github.com/repos/faye/faye/git/commits/838bd1404b9156f239f57c6279a041b91ceb48fc,838bd1404b9156f239f57c6279a041b91ceb48fc,Mention hang-up errors in changelog.
jcoglan,2013-02-21 21:14:52,https://api.github.com/repos/faye/faye/git/commits/121b0d8a035c6f998813df7d927fd3e1f10c24e0,121b0d8a035c6f998813df7d927fd3e1f10c24e0,"Remove the try/catch everywhere, just attach error listeners to request and response objects that log the error and return a 400 if possible."
jcoglan,2013-02-21 01:28:16,https://api.github.com/repos/faye/faye/git/commits/e55cdfb92a35e0ce6914b4e944a52e433357a877,e55cdfb92a35e0ce6914b4e944a52e433357a877,Wrap try/catch around all response-writing code because Node 0.8.20 throws hangup errors more often than before. See: http://clock.co.uk/tech-blogs/preventing-http-raise-hangup-error-on-destroyed-socket-write-from-crashing-your-nodejs-server
jcoglan,2013-02-21 00:58:03,https://api.github.com/repos/faye/faye/git/commits/a445c5b6f987acc4dc9407ff29c964241a6040ac,a445c5b6f987acc4dc9407ff29c964241a6040ac,Bump copyright ranges.
jcoglan,2013-02-21 00:07:18,https://api.github.com/repos/faye/faye/git/commits/6efbb3509d45919c64dbe8b66d59d0f5e397d785,6efbb3509d45919c64dbe8b66d59d0f5e397d785,Remove some trailing whitespace.
jcoglan,2013-02-21 00:03:26,https://api.github.com/repos/faye/faye/git/commits/a50a7458c9862d3924c5dfc558fe998038aa69c4,a50a7458c9862d3924c5dfc558fe998038aa69c4,Fix bugs in WebSocket reconnection. WebSocket transports were not working after reconnection because the transport is closed when selecting a new transport for the handshake. After the handshake the cached WebSocket transport is reused but its closed status stops it working.
jcoglan,2013-02-20 23:32:47,https://api.github.com/repos/faye/faye/git/commits/380e2e7eb3a38fad8cd2581896248a6b3aea6ff5,380e2e7eb3a38fad8cd2581896248a6b3aea6ff5,Display which connection type is in use in the demo app.
jcoglan,2013-02-20 22:44:13,https://api.github.com/repos/faye/faye/git/commits/e6d3dbbd5fbfeb1f400e78d5e225dacdfe9cb06e,e6d3dbbd5fbfeb1f400e78d5e225dacdfe9cb06e,"Set WebSocket callbacks to null instead of deleting them, since deleting causes reconnect problems in Safari."
jcoglan,2013-02-20 22:25:42,https://api.github.com/repos/faye/faye/git/commits/bdab0e1eb2944b2c4843f266ef4cf14c894f042f,bdab0e1eb2944b2c4843f266ef4cf14c894f042f,Remove trailing comma that's making IE unhappy.
jcoglan,2013-02-20 21:46:29,https://api.github.com/repos/faye/faye/git/commits/5a01263f6a5f214bf8eb3b9336a102488ef8e901,5a01263f6a5f214bf8eb3b9336a102488ef8e901,Update the changelog.
jcoglan,2013-02-20 21:43:50,https://api.github.com/repos/faye/faye/git/commits/6188600a9a28a2cb23bd5e4ae21e7d73073f3c60,6188600a9a28a2cb23bd5e4ae21e7d73073f3c60,"Use the WebSocket onerror event to cycle the connection, not just the onclose event."
jcoglan,2013-02-20 21:19:35,https://api.github.com/repos/faye/faye/git/commits/1c62311f953f051b9e4e27d4b256addb8c54b82c,1c62311f953f051b9e4e27d4b256addb8c54b82c,Remove the word 'queue' from log messages about flushing connections.
jcoglan,2013-02-19 22:45:57,https://api.github.com/repos/faye/faye/git/commits/7df2c501a8fc5b4691225f7209568ee2e04ec51e,7df2c501a8fc5b4691225f7209568ee2e04ec51e,Remove stale TestSwarm links.
jcoglan,2013-02-19 22:26:55,https://api.github.com/repos/faye/faye/git/commits/c367858a20b6f82d0e3f3b72404e7667d8f6867b,c367858a20b6f82d0e3f3b72404e7667d8f6867b,"Export a global var when running in the browser, to support module loaders that use eval()."
jcoglan,2013-02-19 22:11:17,https://api.github.com/repos/faye/faye/git/commits/913f166e5f13d7752f0632f460e5440f78c34817,913f166e5f13d7752f0632f460e5440f78c34817,Update the TestSwarm script.
jcoglan,2013-02-19 21:55:28,https://api.github.com/repos/faye/faye/git/commits/c7c497c652a42776f0b4744281c9b3f41a5e91e6,c7c497c652a42776f0b4744281c9b3f41a5e91e6,"Update the changelog, preparing for release of 0.8.9."
jcoglan,2013-02-19 21:54:53,https://api.github.com/repos/faye/faye/git/commits/b8cc515afa752cde11d6f51764df141d573a776a,b8cc515afa752cde11d6f51764df141d573a776a,Change Gemfile source to appease Bundler.
jcoglan,2013-02-14 21:43:14,https://api.github.com/repos/faye/faye/git/commits/8006ff05e909e567523df7f43995091e64620c2f,8006ff05e909e567523df7f43995091e64620c2f,Constrain haml version so the website continues to build.
jcoglan,2013-02-14 21:41:15,https://api.github.com/repos/faye/faye/git/commits/e71502e4a1669ccafaca392e543c74126ade96d4,e71502e4a1669ccafaca392e543c74126ade96d4,Fix requests for the client script when the server is mounted at '/'.
jcoglan,2013-02-09 10:27:49,https://api.github.com/repos/faye/faye/git/commits/6c16ea54587cecc45416e086caa6c968aa46d24e,6c16ea54587cecc45416e086caa6c968aa46d24e,Use strict mode for JavaScript.
jcoglan,2013-02-08 21:32:11,https://api.github.com/repos/faye/faye/git/commits/25c220fbe754b99e806e3eabd85d2beaebb6913a,25c220fbe754b99e806e3eabd85d2beaebb6913a,Plug a global leak in Node static file server.
jcoglan,2013-02-08 21:30:40,https://api.github.com/repos/faye/faye/git/commits/e78a88857f58a1af30af2e5d2c6a2c5a43910700,e78a88857f58a1af30af2e5d2c6a2c5a43910700,Rename some vars in static file serving for clarity.
jcoglan,2013-02-03 21:15:36,https://api.github.com/repos/faye/faye/git/commits/9675a7b4c9a2c7b0caa1901b249fa6b6386befac,9675a7b4c9a2c7b0caa1901b249fa6b6386befac,"Disabled transport types should be ignored in all calls to selectTransport().

Select the initial transport in handshake(), not initialize(). This allows transports to be disabled before the first one is selected.

Pass list of disabled transports to Transport.get() so they are skipped during selection. This stops us pre-emptively checking WebSocket/EventSource if the user has disabled them."
jcoglan,2013-01-10 22:09:23,https://api.github.com/repos/faye/faye/git/commits/1de0f0621e630ea5fe8676a638ad8c598b8ac315,1de0f0621e630ea5fe8676a638ad8c598b8ac315,"Merge branch 'meta-whitelist'

Conflicts:
	javascript/protocol/server.js
	lib/faye.rb
	lib/faye/protocol/channel.rb
	lib/faye/protocol/server.rb
	site/src/pages/download.haml
	spec/javascript/server_spec.js"
jcoglan,2013-01-10 21:19:43,https://api.github.com/repos/faye/faye/git/commits/3a1ba28192e14cd8d9a627f9f38e8e9e171d0a77,3a1ba28192e14cd8d9a627f9f38e8e9e171d0a77,Bump version to 0.8.8.
jcoglan,2013-01-10 20:11:49,https://api.github.com/repos/faye/faye/git/commits/b070eab297598a911d58d66868f7e9a272172725,b070eab297598a911d58d66868f7e9a272172725,Bump version to 0.8.7.
jcoglan,2013-01-10 20:05:37,https://api.github.com/repos/faye/faye/git/commits/730d364893bae2ca6cdd05da398bd58aa670d634,730d364893bae2ca6cdd05da398bd58aa670d634,"Whitelist methods that can be invoked by meta-channel messages, to prevent messages invoking arbitrary object methods. Also stop Ruby's Channel.parse() from creating symbols from user input."
jcoglan,2012-12-22 19:29:28,https://api.github.com/repos/faye/faye/git/commits/7aba71ddd15bb6a7d1064e30dd83896f85540d20,7aba71ddd15bb6a7d1064e30dd83896f85540d20,"Catch cases where WebSocket messages contain no data, happens occasionally for people in production."
jcoglan,2012-12-22 18:08:17,https://api.github.com/repos/faye/faye/git/commits/d7ea4a1a40ed8cf9e56e4ba256cd9def9bd961f7,d7ea4a1a40ed8cf9e56e4ba256cd9def9bd961f7,Don't send Content-Length or Content-Type with 304.
jcoglan,2012-12-22 17:41:03,https://api.github.com/repos/faye/faye/git/commits/3e2a47955fe13fe1f3c895a7a49634da03702f21,3e2a47955fe13fe1f3c895a7a49634da03702f21,"Close Engine.Connections when the clientId of a WebSocket changes. This happens after server restarts -- a socket sends one clientId, has it rejected, then gets another one and reuses the socket."
jcoglan,2012-12-22 17:09:19,https://api.github.com/repos/faye/faye/git/commits/59e520558fb798b0769b7aef796f1ea6d8619d2c,59e520558fb798b0769b7aef796f1ea6d8619d2c,Remove trailing whitespace.
jcoglan,2012-12-22 16:37:03,https://api.github.com/repos/faye/faye/git/commits/4d5d7af586dc5b1f39c595110cfe7b25ff610534,4d5d7af586dc5b1f39c595110cfe7b25ff610534,Don't parse the query string of URIs when checking isSameOrigin() -- this mitigates problems people have had when hosting Faye on pages with invalid UTF-8 in their query strings.
jcoglan,2012-12-22 16:19:31,https://api.github.com/repos/faye/faye/git/commits/82b8d57f940fd2551cc07a86fc2d966740c007a5,82b8d57f940fd2551cc07a86fc2d966740c007a5,"Index EventSource connections including the client ID, so that if we get an 'unknown client' error we connect to a new endpoint."
jcoglan,2012-12-22 01:18:38,https://api.github.com/repos/faye/faye/git/commits/89470cd972a830e1b99397553f1a635b244c5e4a,89470cd972a830e1b99397553f1a635b244c5e4a,"Don't configure bundler on behalf of everyone else, it doesn't pan out well."
jcoglan,2012-10-25 13:30:19,https://api.github.com/repos/faye/faye/git/commits/93f5e3a27f5a082bc0bdbb2fd66ce85c1caf2d91,93f5e3a27f5a082bc0bdbb2fd66ce85c1caf2d91,Always bundle gems locally.
jcoglan,2012-12-03 22:07:00,https://api.github.com/repos/faye/faye/git/commits/e407e08c68dd885896552b59ce65503be85030ad,e407e08c68dd885896552b59ce65503be85030ad,Mitigate BEAST attack on Node SSL server.
jcoglan,2012-12-03 21:59:56,https://api.github.com/repos/faye/faye/git/commits/f8ed12cc315a008b637bf97341c296dfb2bd7c35,f8ed12cc315a008b637bf97341c296dfb2bd7c35,Fix whitespace in previous commit.
jcoglan,2012-12-03 21:54:38,https://api.github.com/repos/faye/faye/git/commits/78fb03d63a982483030fc172188faaefafbad0e3,78fb03d63a982483030fc172188faaefafbad0e3,"Merge pull request #174 from pselden4/replies-closure-fix

Fix mutable variable usage inside a closure for outgoing extensions so t..."
jcoglan,2012-12-03 21:46:51,https://api.github.com/repos/faye/faye/git/commits/f21aaee6a927836c311f0e8479394ccdcc51fa55,f21aaee6a927836c311f0e8479394ccdcc51fa55,Rename Cloudblocks to Cloud 66.
jcoglan,2012-12-03 21:23:31,https://api.github.com/repos/faye/faye/git/commits/aff2d63d7c5eb92c9c2a816755932d51bbdcb84b,aff2d63d7c5eb92c9c2a816755932d51bbdcb84b,Bump em-rspec and adjust accordingly.
jcoglan,2012-10-25 09:59:42,https://api.github.com/repos/faye/faye/git/commits/b8a087beb03618585872195a61cd3cc828f61ace,b8a087beb03618585872195a61cd3cc828f61ace,Some further explanation of why not to rely on Origin headers.
jcoglan,2012-10-13 14:59:01,https://api.github.com/repos/faye/faye/git/commits/10b2f8b70b78ddcf8cee60090ae35aea25a35eb2,10b2f8b70b78ddcf8cee60090ae35aea25a35eb2,Correct the word 'method' where we really mean 'function'.
jcoglan,2012-10-13 14:51:38,https://api.github.com/repos/faye/faye/git/commits/dba8a1b2294476a15759d3914ee270642d1ca6a1,dba8a1b2294476a15759d3914ee270642d1ca6a1,Simplify a few JavaScript examples in the security docs.
jcoglan,2012-10-13 14:21:16,https://api.github.com/repos/faye/faye/git/commits/920eb232c74f5814ba53a8c9512c0940edf4e683,920eb232c74f5814ba53a8c9512c0940edf4e683,Fix browser specs.
jcoglan,2012-10-07 21:24:05,https://api.github.com/repos/faye/faye/git/commits/7f64ac2bae26e824e898beeb2c14090f7376b06d,7f64ac2bae26e824e898beeb2c14090f7376b06d,Bump version to 0.8.6 and update the changelog.
jcoglan,2012-10-07 21:22:22,https://api.github.com/repos/faye/faye/git/commits/d5da96b390816cee60ccd78c95940ef0d9c220ec,d5da96b390816cee60ccd78c95940ef0d9c220ec,Make sure messages pushed to the client over a socket pass through the outgoing extensions.
jcoglan,2012-09-30 11:23:07,https://api.github.com/repos/faye/faye/git/commits/be37b076ea1a8a7a517ff4e37cb1232b8bbaf744,be37b076ea1a8a7a517ff4e37cb1232b8bbaf744,"Bump version to 0.8.5, update the changelog."
jcoglan,2012-09-30 11:17:52,https://api.github.com/repos/faye/faye/git/commits/85580e9a1354ad790c5071d383443c60a63531cd,85580e9a1354ad790c5071d383443c60a63531cd,Fix inference bug in URI.parse(). Only the protocol and host should be inferred from window.location.
jcoglan,2012-09-29 15:51:09,https://api.github.com/repos/faye/faye/git/commits/dc963f072238b4240698e1d806d3f0459413e7a0,dc963f072238b4240698e1d806d3f0459413e7a0,Bump version to 0.8.4 and update the changelog.
jcoglan,2012-09-29 15:39:59,https://api.github.com/repos/faye/faye/git/commits/4d542941c22cb4bee27abb2e7d1e83fa6d0eeab0,4d542941c22cb4bee27abb2e7d1e83fa6d0eeab0,Fix bugs with EventSource transport detection in legacy browsers.
jcoglan,2012-09-29 15:20:40,https://api.github.com/repos/faye/faye/git/commits/265b9e5bc8877b054dc26dd48b5bdb7f24ce723a,265b9e5bc8877b054dc26dd48b5bdb7f24ce723a,Change Faye.random() so we stay within the float accuracy bounds in JS.
jcoglan,2012-09-29 14:43:05,https://api.github.com/repos/faye/faye/git/commits/c7086e173ca02ba5f4d649e3989903c8085edea7,c7086e173ca02ba5f4d649e3989903c8085edea7,Move transport selection logging into the Client class.
jcoglan,2012-09-29 13:48:39,https://api.github.com/repos/faye/faye/git/commits/d6d7dea65e564c7cf4e97082b262cef8daad8112,d6d7dea65e564c7cf4e97082b262cef8daad8112,Document the connection:open and connection:close engine events.
jcoglan,2012-09-26 23:53:53,https://api.github.com/repos/faye/faye/git/commits/d389c93c7573f2862439cedebb540a27b1a4e0a0,d389c93c7573f2862439cedebb540a27b1a4e0a0,"Merge pull request #163 from jamesotron/patch-1

Security advice: Fix grammar and add summary section."
