jcoglan,2011-03-20 11:19:49,https://api.github.com/repos/faye/faye/git/commits/3237c305ee5aad54d184557f51d6b87e3ad643a7,3237c305ee5aad54d184557f51d6b87e3ad643a7,Implement the Redis engine in JavaScript.
jcoglan,2011-03-19 20:56:44,https://api.github.com/repos/faye/faye/git/commits/79cf4f44b5f38cc268822b67c7332dff8204a914,79cf4f44b5f38cc268822b67c7332dff8204a914,Refactor the JavaScript Memory engine to fit the API required for distributed engines.
mlangenberg,2011-03-19 15:56:29,https://api.github.com/repos/faye/faye/git/commits/818b08ca08bd5cd24a1eab25c93c2e9d90720355,818b08ca08bd5cd24a1eab25c93c2e9d90720355,Added CORS support to browser and NodeAdapter.
mlangenberg,2011-03-19 15:11:29,https://api.github.com/repos/faye/faye/git/commits/b3a9fd01a1f4618368d46b29606d632d015e9e52,b3a9fd01a1f4618368d46b29606d632d015e9e52,"Merge remote branch 'upstream/master'

Conflicts:
	javascript/util/node/web_socket.js"
jcoglan,2011-03-19 11:54:39,https://api.github.com/repos/faye/faye/git/commits/219b299b7c421732d7d5496cdd8d22eae172ae85,219b299b7c421732d7d5496cdd8d22eae172ae85,Change some Ruby references in the JavaScript source.
jcoglan,2011-03-19 11:51:49,https://api.github.com/repos/faye/faye/git/commits/132cea383e11a8f122d2767348cfc636a51b1bac,132cea383e11a8f122d2767348cfc636a51b1bac,"Refactor such that the Redis engine supports multiple frontend servers correctly, i.e. push all state and message queueing out of the server and into Redis."
jcoglan,2011-03-17 22:18:51,https://api.github.com/repos/faye/faye/git/commits/893b4bb6014a324d02a49f8455a8067445beb785,893b4bb6014a324d02a49f8455a8067445beb785,Working Redis-backed engine for Ruby. Still needs some re-organisation to work properly behind a load balancer.
jcoglan,2011-03-16 15:43:08,https://api.github.com/repos/faye/faye/git/commits/617158d393601665a74c3c11327e156ac5cb847b,617158d393601665a74c3c11327e156ac5cb847b,Make sure IDs are always a consistent length (makes it easier to use AB to test.
jcoglan,2011-03-16 09:53:04,https://api.github.com/repos/faye/faye/git/commits/5a48486f90562efc478b78e655b78a29dab969e6,5a48486f90562efc478b78e655b78a29dab969e6,Update Server#destroy_connection.
jcoglan,2011-03-16 09:12:59,https://api.github.com/repos/faye/faye/git/commits/e2f68187c205f70c491ff2487b8bc215bf4ca63d,e2f68187c205f70c491ff2487b8bc215bf4ca63d,Unit tests for NodeAdapter.
jcoglan,2011-03-15 22:47:58,https://api.github.com/repos/faye/faye/git/commits/0ff56a38426482f84a7f76ed621ddbc950fb2a89,0ff56a38426482f84a7f76ed621ddbc950fb2a89,Unit tests for RackAdapter.
jcoglan,2011-03-15 07:52:36,https://api.github.com/repos/faye/faye/git/commits/5482020b21d933c6f5c7a4eff8a2d327b4ec99ac,5482020b21d933c6f5c7a4eff8a2d327b4ec99ac,Bump js.class submodule.
jcoglan,2011-03-14 23:13:17,https://api.github.com/repos/faye/faye/git/commits/e60191aba002d23eac84fa970e040c1ec28f28b6,e60191aba002d23eac84fa970e040c1ec28f28b6,Unit test Ruby's Server#(un)subscribe.
jcoglan,2011-03-14 22:28:31,https://api.github.com/repos/faye/faye/git/commits/3a837200c0a0bfba0d435d89272a2828880e0f37,3a837200c0a0bfba0d435d89272a2828880e0f37,Unit test Ruby's Server#disconnect.
jcoglan,2011-03-14 09:23:13,https://api.github.com/repos/faye/faye/git/commits/002126c1cbc718682a8102b78e907972dc8babe3,002126c1cbc718682a8102b78e907972dc8babe3,Unit test Ruby's Server#connect.
jcoglan,2011-03-14 09:08:52,https://api.github.com/repos/faye/faye/git/commits/62809543741e4ff5aee1bdc5638730c27ca5eb60,62809543741e4ff5aee1bdc5638730c27ca5eb60,Unit test Ruby's Server#handshake.
jcoglan,2011-03-14 00:08:37,https://api.github.com/repos/faye/faye/git/commits/c925e4e0d1ed8996189b20a0298b0f73e6f44224,c925e4e0d1ed8996189b20a0298b0f73e6f44224,Change a spec name.
jcoglan,2011-03-13 23:41:11,https://api.github.com/repos/faye/faye/git/commits/1c26f25b21207308ac236a6e22802d7e38cb4bf2,1c26f25b21207308ac236a6e22802d7e38cb4bf2,Fix :disconnect notification in Engine::Memory.
jcoglan,2011-03-12 19:10:59,https://api.github.com/repos/faye/faye/git/commits/c84d4f619b7ccee85a11c323962bfef6332e6f86,c84d4f619b7ccee85a11c323962bfef6332e6f86,Engine should publish events when clients are destroyed.
jcoglan,2011-03-13 18:09:17,https://api.github.com/repos/faye/faye/git/commits/ebeaa354ac2b70baee1671f4c6dda6d3c404b5e0,ebeaa354ac2b70baee1671f4c6dda6d3c404b5e0,"Refactor Ruby Server class to use the Engine::Memory backend. Old integration tests pass (except publishing to wildcards), but we need new unit tests around the Server class."
jcoglan,2011-03-13 16:49:47,https://api.github.com/repos/faye/faye/git/commits/c6d1aa3c0288d8430da7dd4865122160138cd09f,c6d1aa3c0288d8430da7dd4865122160138cd09f,Make Engine#(un)subscribe take a callback.
jcoglan,2011-03-13 16:36:47,https://api.github.com/repos/faye/faye/git/commits/9fe8f494a11f0048697fe7dcfceafe3fc5ba53c6,9fe8f494a11f0048697fe7dcfceafe3fc5ba53c6,Implement the in-memory pub/sub engine for Ruby (not wired up to Server yet).
jcoglan,2011-03-13 12:54:36,https://api.github.com/repos/faye/faye/git/commits/e6a68f6c49c3dbdfd6c64afd674d278f0a8fba4e,e6a68f6c49c3dbdfd6c64afd674d278f0a8fba4e,Rename Engine#distribute to Engine#publish.
jcoglan,2011-03-13 12:46:39,https://api.github.com/repos/faye/faye/git/commits/76f4115b7f48fd120df456bd56f474da1212d920,76f4115b7f48fd120df456bd56f474da1212d920,Refactor EngineSpec into async style using AsyncSteps.
jcoglan,2011-03-12 23:21:29,https://api.github.com/repos/faye/faye/git/commits/4bcbc4699c2aa8e815352e8eb2f3dc79ff8cc9b5,4bcbc4699c2aa8e815352e8eb2f3dc79ff8cc9b5,Load Faye using JS.Packages in the browser tests.
jcoglan,2011-03-12 23:17:32,https://api.github.com/repos/faye/faye/git/commits/c8cfdd956879ca0f613959185af0af34c9ed04b9,c8cfdd956879ca0f613959185af0af34c9ed04b9,"Add a browser test runner. Only contains Channel tests so far, but fun fact: I tried running the Server and Engine specs and they both run in browsers."
jcoglan,2011-03-12 22:49:21,https://api.github.com/repos/faye/faye/git/commits/39a5d984b24b7da5535648569a186ae12d394f18,39a5d984b24b7da5535648569a186ae12d394f18,Test that local clients can subscribe to metachannels.
jcoglan,2011-03-12 19:02:57,https://api.github.com/repos/faye/faye/git/commits/1b3626135876e6b5c913acd4c325d1d26ab74fe8,1b3626135876e6b5c913acd4c325d1d26ab74fe8,Use mocking to test how Engine delivers messages.
jcoglan,2011-03-12 18:54:28,https://api.github.com/repos/faye/faye/git/commits/d369f15692b3b1e790097afd840a05e13ee02b14,d369f15692b3b1e790097afd840a05e13ee02b14,Test that Server listens to the correct notifications from Engine.
jcoglan,2011-03-12 18:45:02,https://api.github.com/repos/faye/faye/git/commits/c36de1c7fc3c70353405ac2b0d24c0000e0498d0,c36de1c7fc3c70353405ac2b0d24c0000e0498d0,Use a fake engine object to test the Server.
jcoglan,2011-03-12 18:36:20,https://api.github.com/repos/faye/faye/git/commits/67f1c8af24847591724320213b3539f6228951cb,67f1c8af24847591724320213b3539f6228951cb,Don't remove a Connection's deletion timeout just because more data was pushed to it; deletion should only be cancelled when a client connects.
jcoglan,2011-03-12 17:53:52,https://api.github.com/repos/faye/faye/git/commits/acf8df908be41740ec3fe024cb0115754fb98d4e,acf8df908be41740ec3fe024cb0115754fb98d4e,Extract the pub/sub core engine from the Server class (JavaScript version) and get some unit tests around the Engine and the Server's protocol methods.
jcoglan,2011-03-06 14:57:39,https://api.github.com/repos/faye/faye/git/commits/b3410969d3a3c1cbeae084e6e253d3f85e5efe4f,b3410969d3a3c1cbeae084e6e253d3f85e5efe4f,Refactor exception handling in NodeAdapter.
jcoglan,2011-03-06 01:51:01,https://api.github.com/repos/faye/faye/git/commits/827580f72a63f03a8757aee7b7960d50b35febda,827580f72a63f03a8757aee7b7960d50b35febda,Some NodeAdapter refactorings to catch a few more bad requests.
jcoglan,2011-01-16 13:08:52,https://api.github.com/repos/faye/faye/git/commits/19b91e5158742ad257497d399c7d5a9b81414e99,19b91e5158742ad257497d399c7d5a9b81414e99,Update version numbers and History.
jcoglan,2011-01-03 18:45:15,https://api.github.com/repos/faye/faye/git/commits/ecd7a4859ee51683e5a110fa11144480cf5566a3,ecd7a4859ee51683e5a110fa11144480cf5566a3,Don't mask exceptions in writeToSocket(); let the server catch them so it can retry messages.
jcoglan,2011-01-03 18:35:01,https://api.github.com/repos/faye/faye/git/commits/26cee48881e16a859631d7d311ee676f72282c29,26cee48881e16a859631d7d311ee676f72282c29,"Switch to an asynchronous form of Transport.isUsable(), meaning we can attempt to open a WebSocket with the server to see if it can speak to the client properly."
mlangenberg,2010-12-30 08:14:26,https://api.github.com/repos/faye/faye/git/commits/5b7d21876ecd34ee8ec71c512ac03b6b0727c975,5b7d21876ecd34ee8ec71c512ac03b6b0727c975,"Catch ""Stream not writable"" errors, thrown when a socket connection is closed during WebSocket handshake. This is probably caused by a user behind a proxy, breaking WebSocket connections.
TODO browser should switch to a more reliable transport when WebSocket handshake fails."
mlangenberg,2010-12-30 08:14:26,https://api.github.com/repos/faye/faye/git/commits/51ec1088755930b8ed4577102e3fcd9e08c35b40,51ec1088755930b8ed4577102e3fcd9e08c35b40,"Catch ""Stream not writable"" errors, thrown when a socket connection is closed during WebSocket handshake. This is probably caused by a user behind a proxy, breaking WebSocket connections.
TODO browser should switch to a more reliable transport when WebSocket handshake fails."
jcoglan,2010-12-19 15:03:05,https://api.github.com/repos/faye/faye/git/commits/be87e1db10a3040c58498f39e86c1f6668637298,be87e1db10a3040c58498f39e86c1f6668637298,Correct spacing in some documentation.
jcoglan,2010-12-19 14:59:20,https://api.github.com/repos/faye/faye/git/commits/05d891cce148db719ef83dab5921b0b6bb45b832,05d891cce148db719ef83dab5921b0b6bb45b832,Add constructor option for adding extensions to RackAdapter middleware.
jcoglan,2010-12-19 14:46:55,https://api.github.com/repos/faye/faye/git/commits/023d0ced556835f5f6dced35761ef9af70a9caff,023d0ced556835f5f6dced35761ef9af70a9caff,Make Subscription objects Deferrable so we can detect when they become active.
jcoglan,2010-12-19 14:08:18,https://api.github.com/repos/faye/faye/git/commits/374b45f34412ea999024e999d6ac02f76f4b8538,374b45f34412ea999024e999d6ac02f76f4b8538,Bump version to 0.5.4.
jcoglan,2010-12-17 10:54:22,https://api.github.com/repos/faye/faye/git/commits/102d241c2beb2ca0b5dcdcbbbd7227b700ecd7ea,102d241c2beb2ca0b5dcdcbbbd7227b700ecd7ea,Use port 8000 for Rack examples.
jcoglan,2010-12-02 20:32:08,https://api.github.com/repos/faye/faye/git/commits/a4e05aabab2fff4280bfe032a594d00e6b87e927,a4e05aabab2fff4280bfe032a594d00e6b87e927,"Recover gracefully from errors when writing to a WebSocket in Node, without dropping the messages."
jcoglan,2010-12-02 20:11:16,https://api.github.com/repos/faye/faye/git/commits/7286b2ba11a5b18e44c5543e00e970d3123ee00c,7286b2ba11a5b18e44c5543e00e970d3123ee00c,Use exponential backoff to reconnect WebSockets.
jcoglan,2010-12-02 19:38:31,https://api.github.com/repos/faye/faye/git/commits/864ab0a73b75de2b75eb3fb0fc6c6e60c93ee90c,864ab0a73b75de2b75eb3fb0fc6c6e60c93ee90c,Use HTTP_X_FORWARDED_PROTO to detect secure WebSockets on Thin (thanks mlangenberg).
mlangenberg,2010-11-07 11:01:31,https://api.github.com/repos/faye/faye/git/commits/e32f82cd2ff61e7799a7529fcab1b9472c5ab466,e32f82cd2ff61e7799a7529fcab1b9472c5ab466,"Respect X-Forwarded-Proto HTTP header when dealing with the WebSocket handshake.

When using a reverse proxy to do the SSL heavy lifting, the proxy will talk plain http to Faye.
In order to return the correct WebSocket-Location, Faye needs to know if the original request (between browser and proxy) was secure or not."
jcoglan,2010-10-21 13:10:22,https://api.github.com/repos/faye/faye/git/commits/9ffe44d45f3c0ed475c9e671c8fcfebb12a6e0cb,9ffe44d45f3c0ed475c9e671c8fcfebb12a6e0cb,To-do items: monitoring API and services.
jcoglan,2010-10-21 00:19:52,https://api.github.com/repos/faye/faye/git/commits/f54e770924fa3a60d9cc724ccc12673a0befe227,f54e770924fa3a60d9cc724ccc12673a0befe227,Update to-do list.
jcoglan,2010-10-20 23:29:18,https://api.github.com/repos/faye/faye/git/commits/fbc23e46c02a3e9ef50014812d9ccce9584320cf,fbc23e46c02a3e9ef50014812d9ccce9584320cf,"Bump version number, update history."
jcoglan,2010-10-19 23:09:16,https://api.github.com/repos/faye/faye/git/commits/41064b5af7389a97608aac7777002eea3ec4429e,41064b5af7389a97608aac7777002eea3ec4429e,Pass messages to handler methods in Server even if an incoming extension sets an error. This is to make sure the server upholds the protocol requirements rather than ignoring the message's content.
jcoglan,2010-10-18 21:42:08,https://api.github.com/repos/faye/faye/git/commits/87c5d5577aef8991dbb183fc342268d99f718349,87c5d5577aef8991dbb183fc342268d99f718349,Cache client script in memory in NodeAdapter.
jcoglan,2010-10-18 21:38:01,https://api.github.com/repos/faye/faye/git/commits/19e6bf1df334ea004472c0dfc32e65a6666c2f40,19e6bf1df334ea004472c0dfc32e65a6666c2f40,Update to-do list.
jcoglan,2010-10-18 21:27:11,https://api.github.com/repos/faye/faye/git/commits/bd25f60ed454bba506ea910ff9ed5c9ce33cd38e,bd25f60ed454bba506ea910ff9ed5c9ce33cd38e,Fix WebSocketTransport so that it doesn't keep re-queueing messages to be written to the socket while the connection is down.
jcoglan,2010-10-18 20:11:59,https://api.github.com/repos/faye/faye/git/commits/63056df96eb001ec9705a3e7fab5795b12d513a0,63056df96eb001ec9705a3e7fab5795b12d513a0,Make WebSocketTransport#resend async to avoid feedback loop that happens if messages are sent during disconnection.
jcoglan,2010-10-17 21:06:38,https://api.github.com/repos/faye/faye/git/commits/e8a82c696fb93054ecde2edc24e387c65c947eab,e8a82c696fb93054ecde2edc24e387c65c947eab,Clean up unused channel objects when subscriptions are removed.
jcoglan,2010-10-17 20:01:45,https://api.github.com/repos/faye/faye/git/commits/9e8dd1aee06eaf1c7206ba44fe9a93e75b4a0600,9e8dd1aee06eaf1c7206ba44fe9a93e75b4a0600,Handle content-type with charsets as sent by browsers.
jcoglan,2010-10-17 19:37:29,https://api.github.com/repos/faye/faye/git/commits/2ba64b3492f705dab6d10b6c4e77a4dc89b3f7fa,2ba64b3492f705dab6d10b6c4e77a4dc89b3f7fa,Use wss: in WebSocket handshake for secure pages in Ruby version.
jcoglan,2010-10-17 19:27:05,https://api.github.com/repos/faye/faye/git/commits/22733c5d9f4253646314012174a84c56f3a94687,22733c5d9f4253646314012174a84c56f3a94687,Support legacy application/x-www-form-urlencoded POST requests. Anything not typed as application/json is assumed to be using querystring-style request bodies.
jcoglan,2010-10-15 12:25:11,https://api.github.com/repos/faye/faye/git/commits/f2db2a84c6e105e6ba38a81ea51f47c738ff48a1,f2db2a84c6e105e6ba38a81ea51f47c738ff48a1,Merge remote branch 'mlangenberg/master'
mlangenberg,2010-10-15 12:05:17,https://api.github.com/repos/faye/faye/git/commits/485c44664f663a96d92eb6a446c09d9eee32d68d,485c44664f663a96d92eb6a446c09d9eee32d68d,Use wss: scheme when connection is secure.
jcoglan,2010-10-15 11:43:26,https://api.github.com/repos/faye/faye/git/commits/1187a8059d5937802cb0b04e3043d34e8a742ef8,1187a8059d5937802cb0b04e3043d34e8a742ef8,Fix the Jakefile's loading of lib files on Ruby 1.9.2
jcoglan,2010-10-14 19:22:53,https://api.github.com/repos/faye/faye/git/commits/25af6614aa221c1c21e322cb02909d1bb6c8a48f,25af6614aa221c1c21e322cb02909d1bb6c8a48f,ANNOUNCEMENT: we have a maling list now.
jcoglan,2010-10-13 22:22:45,https://api.github.com/repos/faye/faye/git/commits/5de4ab00f609c30691ebaa1207729e85cd66a45c,5de4ab00f609c30691ebaa1207729e85cd66a45c,Add a few to-do items. There are probably more but this is what I can remember right now.
jcoglan,2010-09-02 06:00:37,https://api.github.com/repos/faye/faye/git/commits/662a6110f7d25f0db3ccd03381b84076e3ea5201,662a6110f7d25f0db3ccd03381b84076e3ea5201,Use wss: protocol for WebSocket if given endpoint is https:
jcoglan,2010-08-31 19:14:47,https://api.github.com/repos/faye/faye/git/commits/d012a5791c5748af33fa49b6cb9e8607b8d8b233,d012a5791c5748af33fa49b6cb9e8607b8d8b233,Use port 443 by default for secure connections in NodeHttpTransport.
driverdan,2010-08-30 18:49:16,https://api.github.com/repos/faye/faye/git/commits/2b6dd14938044e96939adeb7512880a5f77f1c24,2b6dd14938044e96939adeb7512880a5f77f1c24,Add default port 80 for Faye.NodeHttpTransport
jcoglan,2010-08-21 10:48:48,https://api.github.com/repos/faye/faye/git/commits/46ffdff4ea4336e89a0161c67d419fba3cd29854,46ffdff4ea4336e89a0161c67d419fba3cd29854,server() test method should allow time for the server to spin up.
jcoglan,2010-08-12 19:54:27,https://api.github.com/repos/faye/faye/git/commits/2d63b7ccd398de334b6a6828a00f18d665c10829,2d63b7ccd398de334b6a6828a00f18d665c10829,Bump version to 0.5.2.
jcoglan,2010-08-12 19:50:52,https://api.github.com/repos/faye/faye/git/commits/07525f9222570b672b5f4d1f6e2b1cdbcc3c48e6,07525f9222570b672b5f4d1f6e2b1cdbcc3c48e6,Reduce the timeout used to batch together messages (100ms was really a little high).
jcoglan,2010-08-12 18:47:44,https://api.github.com/repos/faye/faye/git/commits/845d886e1729ae93498bb3fc67ea49674574052c,845d886e1729ae93498bb3fc67ea49674574052c,"Merge branch 'ws-draft76'

Conflicts:
	lib/faye/util/web_socket.rb"
jcoglan,2010-07-31 09:37:42,https://api.github.com/repos/faye/faye/git/commits/a83009636297887fc183bd06692f429bce2dd347,a83009636297887fc183bd06692f429bce2dd347,Implement a draft76 WebSocket handler for Ruby.
jcoglan,2010-07-27 21:00:14,https://api.github.com/repos/faye/faye/git/commits/937aab3a7b7083f414163d35e0c4ce0025c92368,937aab3a7b7083f414163d35e0c4ce0025c92368,Fix UTF-8 encoding problem in WebSocket under Ruby 1.9.
jcoglan,2010-07-27 21:00:14,https://api.github.com/repos/faye/faye/git/commits/21cffed54f1e6e22136caa0b870532b38c945ef3,21cffed54f1e6e22136caa0b870532b38c945ef3,Fix UTF-8 encoding problem in WebSocket under Ruby 1.9.
jcoglan,2010-07-21 23:15:19,https://api.github.com/repos/faye/faye/git/commits/8268ff7ac0efb008df9b9f9ad7bd38a5a8b8c61a,8268ff7ac0efb008df9b9f9ad7bd38a5a8b8c61a,Initial implementation of draft76 WebSockets for Node.
jcoglan,2010-07-21 00:17:52,https://api.github.com/repos/faye/faye/git/commits/b45f05dc15b36eb5c960b23604de2f2a847675ec,b45f05dc15b36eb5c960b23604de2f2a847675ec,Bump version to 0.5.1.
jcoglan,2010-07-21 00:08:26,https://api.github.com/repos/faye/faye/git/commits/4a7976e01feb43147b65f9fde9bcbdcd2eb89ef6,4a7976e01feb43147b65f9fde9bcbdcd2eb89ef6,Fix a weird bug caused by use of Object#method in local clients that publish as soon as they're created.
jcoglan,2010-07-17 17:01:08,https://api.github.com/repos/faye/faye/git/commits/0dabe9fcc5b6469736d928e2cf107730ed42077a,0dabe9fcc5b6469736d928e2cf107730ed42077a,Update the readme and changelog.
jcoglan,2010-07-17 16:45:40,https://api.github.com/repos/faye/faye/git/commits/10b797140670388996abd922ac4aa3651e818d42,10b797140670388996abd922ac4aa3651e818d42,Website updates.
jcoglan,2010-07-17 15:05:24,https://api.github.com/repos/faye/faye/git/commits/5b5763bc7ba8d965a5dffe08c39d666187a1bd2d,5b5763bc7ba8d965a5dffe08c39d666187a1bd2d,Fix a problem with reconnection logic in Ruby version.
jcoglan,2010-07-17 14:40:33,https://api.github.com/repos/faye/faye/git/commits/74fce343d6fddfcabb528c5209dd36349b8df07c,74fce343d6fddfcabb528c5209dd36349b8df07c,A few example adjustments.
jcoglan,2010-07-17 13:57:36,https://api.github.com/repos/faye/faye/git/commits/761d816ca26217ea261a4375006909ac3ae3ca70,761d816ca26217ea261a4375006909ac3ae3ca70,Make the build run on Ruby 1.9.x.
jcoglan,2010-07-17 13:49:14,https://api.github.com/repos/faye/faye/git/commits/c5c7803c58988d658550c004e6eef4de8a8e36e6,c5c7803c58988d658550c004e6eef4de8a8e36e6,Remove a duplicated line from the client tests.
jcoglan,2010-07-17 13:02:17,https://api.github.com/repos/faye/faye/git/commits/c7afa63142c3b19831913c79c7341ff727160f92,c7afa63142c3b19831913c79c7341ff727160f92,Put a description in the Rakefile.
jcoglan,2010-07-17 12:34:01,https://api.github.com/repos/faye/faye/git/commits/85d21d1865a7679aa1fe9ddf724f834ed3a7c676,85d21d1865a7679aa1fe9ddf724f834ed3a7c676,Refactor Transport.supportedConnectionTypes().
jcoglan,2010-07-17 12:10:09,https://api.github.com/repos/faye/faye/git/commits/3a9f684721b381f239c6ab6b3182d8d723bdecd0,3a9f684721b381f239c6ab6b3182d8d723bdecd0,Slim down the gem manifest.
jcoglan,2010-07-17 12:08:42,https://api.github.com/repos/faye/faye/git/commits/57f6ed9d74721f054731029af70bff57ac63b8fc,57f6ed9d74721f054731029af70bff57ac63b8fc,Bump version to 0.5.0.
jcoglan,2010-07-17 11:59:07,https://api.github.com/repos/faye/faye/git/commits/dea89c40b5e3b42528d92c3d1d5e58513ff40d67,dea89c40b5e3b42528d92c3d1d5e58513ff40d67,Add a package.json file for installing through npm.
jcoglan,2010-07-17 11:12:28,https://api.github.com/repos/faye/faye/git/commits/0c11c7169e7ab101d710d136a4a69dbd347dccf4,0c11c7169e7ab101d710d136a4a69dbd347dccf4,Always pass a function to http.createServer().
jcoglan,2010-07-17 11:12:10,https://api.github.com/repos/faye/faye/git/commits/89e3a232d3f2c65405df7d6a01299f16309378d0,89e3a232d3f2c65405df7d6a01299f16309378d0,Add logging on the client side in the example app.
jcoglan,2010-07-17 10:44:04,https://api.github.com/repos/faye/faye/git/commits/73f9a51eea57141fd69c8f71489246229d558752,73f9a51eea57141fd69c8f71489246229d558752,Change API for binding the Bayeux server to an HTTP frontend in Node.
jcoglan,2010-07-14 22:13:34,https://api.github.com/repos/faye/faye/git/commits/abc5f3fff3f2847e4e9118137266f05eb393fc57,abc5f3fff3f2847e4e9118137266f05eb393fc57,Improve handling of connection errors in NodeHttpTransport.
jcoglan,2010-07-13 18:05:30,https://api.github.com/repos/faye/faye/git/commits/6bd79a55cd9090e456c889250ab6022c4e90583f,6bd79a55cd9090e456c889250ab6022c4e90583f,Delay the start of message sending in ping examples.
jcoglan,2010-07-11 18:11:02,https://api.github.com/repos/faye/faye/git/commits/3944344945d6e5f31731051c2156276f0cf3427d,3944344945d6e5f31731051c2156276f0cf3427d,Fix a scoping bug in Ruby client tests.
jcoglan,2010-07-11 17:35:33,https://api.github.com/repos/faye/faye/git/commits/74101a4ca40d0d2414fe72e5e6ef4cb508bb3266,74101a4ca40d0d2414fe72e5e6ef4cb508bb3266,Refactor and improve client reconnection code.
jcoglan,2010-07-11 15:33:33,https://api.github.com/repos/faye/faye/git/commits/d26424fff3ffad4bf35c781b1cbc1ab81a2305a5,d26424fff3ffad4bf35c781b1cbc1ab81a2305a5,Tiny formatting change.
jcoglan,2010-07-11 15:12:39,https://api.github.com/repos/faye/faye/git/commits/e2176b9d0a590a46457bc2e9f27d3067d794762b,e2176b9d0a590a46457bc2e9f27d3067d794762b,Refactor Node WebSocket class a little.
jcoglan,2010-07-11 15:02:56,https://api.github.com/repos/faye/faye/git/commits/f8aeecb96e5e4a202513b493fd49b67a50d73e9a,f8aeecb96e5e4a202513b493fd49b67a50d73e9a,Clean up a little JavaScript with a map() function.
jcoglan,2010-07-11 14:41:25,https://api.github.com/repos/faye/faye/git/commits/206d5ce98dfd59d49ac09a02d4dad9556353ec62,206d5ce98dfd59d49ac09a02d4dad9556353ec62,Rename Deferrable#waiters to Deferrable#callbacks.
jcoglan,2010-07-11 14:37:52,https://api.github.com/repos/faye/faye/git/commits/3791beb39cd13c3f0c27e64284800b1ef43d0428,3791beb39cd13c3f0c27e64284800b1ef43d0428,Export Logging module.
jcoglan,2010-07-11 11:54:55,https://api.github.com/repos/faye/faye/git/commits/8ca7cc7be7d67b1c11243ed636be07856be0ec6f,8ca7cc7be7d67b1c11243ed636be07856be0ec6f,"Merge remote branch 'iaddict/master'

Conflicts:
	javascript/network/node.js"
jcoglan,2010-07-11 11:34:42,https://api.github.com/repos/faye/faye/git/commits/9aa748013dc9b1c89302c50fe9da7d7b4ece6f32,9aa748013dc9b1c89302c50fe9da7d7b4ece6f32,Ruby server only works under Thin.
jcoglan,2010-07-11 11:30:38,https://api.github.com/repos/faye/faye/git/commits/530db0a9819c9cbd3e5f457ecf4eb25f59ae07af,530db0a9819c9cbd3e5f457ecf4eb25f59ae07af,s/client-min/browser-min/
jcoglan,2010-07-11 11:25:54,https://api.github.com/repos/faye/faye/git/commits/b43281888fe5ffde097a430ee442c980921cc502,b43281888fe5ffde097a430ee442c980921cc502,Emit a 'passthrough' event when the Node server does not respond to a request. Update the docs.
jcoglan,2010-07-11 11:11:15,https://api.github.com/repos/faye/faye/git/commits/369c2da1a51863fc8098d3f50e08c4f0cebf092d,369c2da1a51863fc8098d3f50e08c4f0cebf092d,Replace 'comet' with 'bayeux'.
jcoglan,2010-07-11 10:18:05,https://api.github.com/repos/faye/faye/git/commits/33a9def54e4c2f7d90bb411882111a2e806f0638,33a9def54e4c2f7d90bb411882111a2e806f0638,Improve connection dropout handling in WebSocket transport by keeping track of which messages haven't had responses.
jcoglan,2010-07-11 09:16:01,https://api.github.com/repos/faye/faye/git/commits/18db6a286cf119cc682476d4e5a82c854165dadb,18db6a286cf119cc682476d4e5a82c854165dadb,"Schedule Connections for deletion as soon as they are created, so clients that never connect don't leak memory."
jcoglan,2010-07-11 08:36:46,https://api.github.com/repos/faye/faye/git/commits/85dc0dcef9a422aa15d91216037d5e6302f4f373,85dc0dcef9a422aa15d91216037d5e6302f4f373,"Respond to /service/** messages, even though we don't support them yet. This makes the CometD load tester happy."
jcoglan,2010-07-07 23:49:43,https://api.github.com/repos/faye/faye/git/commits/1961dffdd2c11b8f0eb35f48b4fd32707bccbdb6,1961dffdd2c11b8f0eb35f48b4fd32707bccbdb6,Add added() and removed() hook methods for extensions.
jcoglan,2010-07-07 22:48:11,https://api.github.com/repos/faye/faye/git/commits/ee5141ad208b3cb239d09c44d4d5ca8becdf93c8,ee5141ad208b3cb239d09c44d4d5ca8becdf93c8,Merge branch 'cometd-compat'
jcoglan,2010-07-07 22:34:06,https://api.github.com/repos/faye/faye/git/commits/1355735c67f4eef4b2588b1cedad26fe01a368f0,1355735c67f4eef4b2588b1cedad26fe01a368f0,Transport#request no longer needs to return anything.
