faye,Simple pub/sub messaging for the web
username,timestamp,url,sha,message
jcoglan,2019-06-11 18:49:52,https://api.github.com/repos/faye/faye/git/commits/7d34ad9c7c9d0de894fabe44c42a2627df8f6c6a,7d34ad9c7c9d0de894fabe44c42a2627df8f6c6a,Reformat some front-matter files.
jcoglan,2019-06-11 16:56:40,https://api.github.com/repos/faye/faye/git/commits/6c9b25fa7b78589a1e32db4a9ce39afe4af265d9,6c9b25fa7b78589a1e32db4a9ce39afe4af265d9,Formatting update to the gemspec
jcoglan,2019-06-11 15:20:48,https://api.github.com/repos/faye/faye/git/commits/f16db781115ad93cbd689a4cd58843ef945b0639,f16db781115ad93cbd689a4cd58843ef945b0639,Formatting adjustment for constants in the Client class
jcoglan,2019-06-11 11:38:33,https://api.github.com/repos/faye/faye/git/commits/8d9ac16bc418b3802c6a5356b827a5735e7e74b0,8d9ac16bc418b3802c6a5356b827a5735e7e74b0,Formatting change {} object/hash literals should have internal spaces
jcoglan,2019-06-10 22:21:54,https://api.github.com/repos/faye/faye/git/commits/45a1731cc2ce7ea8e9b4dc3557266e424cd637f6,45a1731cc2ce7ea8e9b4dc3557266e424cd637f6,Remove the WebSocket 'ping' functionality of sending an empty list of messages as CometD no longer accepts it
jcoglan,2019-06-10 16:07:06,https://api.github.com/repos/faye/faye/git/commits/632de807ba9d3770d4d9f01c9ce7fb7b565956d4,632de807ba9d3770d4d9f01c9ce7fb7b565956d4,Don't set WebSocket._unloaded if autodisconnect has been disabled
jcoglan,2019-06-10 15:51:51,https://api.github.com/repos/faye/faye/git/commits/ed42812827ae9f0f02ee99ac54b39fd0d5cfed8a,ed42812827ae9f0f02ee99ac54b39fd0d5cfed8a,Echo the Origin or Referer head back as the value of Access-Control-Allow-Origin
jcoglan,2019-06-10 15:39:26,https://api.github.com/repos/faye/faye/git/commits/5ff1e771b528c57c99e569dd7c2a70b9980dcca4,5ff1e771b528c57c99e569dd7c2a70b9980dcca4,"Merge pull request #499 from smooch/fix-options-cors-headers

Echo origin/referer in cors origin header for OPTION requests"
jcoglan,2019-06-10 15:36:47,https://api.github.com/repos/faye/faye/git/commits/70a91d460f284d5bd18673319408bbbed764c782,70a91d460f284d5bd18673319408bbbed764c782,"Merge pull request #507 from tnoonan-salesforce/patch-1

Update transport.js"
jcoglan,2019-06-10 15:33:18,https://api.github.com/repos/faye/faye/git/commits/6969a8523585e7ee6882b6088b81b4521e3e77a7,6969a8523585e7ee6882b6088b81b4521e3e77a7,"Merge pull request #509 from FabienChaynes/fix-ruby-dispatcher-error-handling

Handle message id collisions from another client in Faye::Dispatcher#handle_response"
jcoglan,2019-06-10 13:53:03,https://api.github.com/repos/faye/faye/git/commits/37bf0c771657175aaca50c3901738fa7e6938d7a,37bf0c771657175aaca50c3901738fa7e6938d7a,Update the build scripts for recent version of Webpack
jcoglan,2019-06-10 12:27:14,https://api.github.com/repos/faye/faye/git/commits/06ba46ad2adcd5f902a82e9406d29f369b191e73,06ba46ad2adcd5f902a82e9406d29f369b191e73,Fix deprecation warnings for using the Buffer() constructor
jcoglan,2019-06-10 12:26:12,https://api.github.com/repos/faye/faye/git/commits/0376fc3d58215f5248b5489375c76464453e24e1,0376fc3d58215f5248b5489375c76464453e24e1,Update the test SSL certificates
jcoglan,2019-06-10 12:21:25,https://api.github.com/repos/faye/faye/git/commits/ce567097d0a4250e74d2d9ed9d30c471835af3fd,ce567097d0a4250e74d2d9ed9d30c471835af3fd,Let npm reformat package.json
jcoglan,2019-06-10 12:21:09,https://api.github.com/repos/faye/faye/git/commits/99b136efed394c9c81aa51a824c1dc4c3b5fdedb,99b136efed394c9c81aa51a824c1dc4c3b5fdedb,Switch to the Apache-2.0 license
FabienChaynes,2018-12-20 15:15:58,https://api.github.com/repos/faye/faye/git/commits/2e865af7044edac3a6f951873f1ab83f6d11ace6,2e865af7044edac3a6f951873f1ab83f6d11ace6,Handle message id collisions from another client in Faye::Dispatcher#handle_response
tnoonan-salesforce,2018-11-11 05:05:31,https://api.github.com/repos/faye/faye/git/commits/c03ae33757ec350edd16bdeb682c213a2608f76b,c03ae33757ec350edd16bdeb682c213a2608f76b,"Update transport.js

when calling /meta/connect salesforce sends three cookies with two different paths.

The toughCookies API to get cookies only gets cookies with the path ""/"" by default.
Unless you pass an options object that asks for all paths.

jar.getCookiesSync(url, { allPaths: true });

""BrowserId=Yu1pLffTRJOxKC4WVkDoTQ;Path=/;Domain=.salesforce.com;Expires=Tue, 08-Jan-2019 17:59:00 GMT;Max-Age=5184000"",
""t=!0vaFlJER5UsrfIGrfKp9YI2pARkJi5YS8O/yCf8GE+6HiX+CvWWacnC3MzF+OXsuC3USJWIP3jamDQ==;Path=/cometd/;HttpOnly"",
""BAYEUX_BROWSER=cc18-1mj9cwp47ftryjoabs1wo14bc;Path=/cometd/;Secure""

Without this option, only the BrowserId is included in subsequent requests. The Salesforce API required all these cookies."
alavers,2018-06-18 20:02:29,https://api.github.com/repos/faye/faye/git/commits/0059a5faf32cddf174472fc2003be9442738e80d,0059a5faf32cddf174472fc2003be9442738e80d,Add options handler unit tests
alavers,2018-06-01 20:40:04,https://api.github.com/repos/faye/faye/git/commits/137face6e9852bacfdc31ab6334ebbaf3e8cb8e0,137face6e9852bacfdc31ab6334ebbaf3e8cb8e0,"Fix CORS headers handling

- Have Faye echo the referrer or origin header in CORS headers for options requests"
jcoglan,2018-05-22 21:14:40,https://api.github.com/repos/faye/faye/git/commits/51a42ee10a7031fa5faeb660b353e97fd55f60a3,51a42ee10a7031fa5faeb660b353e97fd55f60a3,Remove analytics from the website.
jcoglan,2017-10-20 09:04:18,https://api.github.com/repos/faye/faye/git/commits/be9fb4aa0f3543f89981e339d7d30d3622ffe8fb,be9fb4aa0f3543f89981e339d7d30d3622ffe8fb,"When stringifying an IPv6 URI, include brackets in the host part."
jcoglan,2017-09-24 09:46:58,https://api.github.com/repos/faye/faye/git/commits/dc754e38008cce762c9ea49fc713dadeeeaad63d,dc754e38008cce762c9ea49fc713dadeeeaad63d,Fix support for IPv6 hostnames in URI.parse().
jcoglan,2017-09-16 08:56:12,https://api.github.com/repos/faye/faye/git/commits/b455db632c94c8bb94f4fd06b137c77ce0e7b8c1,b455db632c94c8bb94f4fd06b137c77ce0e7b8c1,"Merge pull request #482 from smooch/master

Catch CSP error in web_socket to allow fallback"
jugarrit,2017-09-06 15:11:13,https://api.github.com/repos/faye/faye/git/commits/2645207ba51ea0779e54e82663aeba7789c425c0,2645207ba51ea0779e54e82663aeba7789c425c0,Move CSP try/catch to _createSocket
jugarrit,2017-08-28 16:25:29,https://api.github.com/repos/faye/faye/git/commits/0263dce4da30f664367145056055d95c7de2dec1,0263dce4da30f664367145056055d95c7de2dec1,Catch CSP error in web_socket to allow fallback
jcoglan,2017-08-15 18:24:25,https://api.github.com/repos/faye/faye/git/commits/fca961ddff7b173a094d7bd9d927d7e5c0ca090f,fca961ddff7b173a094d7bd9d927d7e5c0ca090f,Change the commands for starting the Thin server so that it exits on SIGINT.
jcoglan,2017-08-14 22:44:22,https://api.github.com/repos/faye/faye/git/commits/47b1f7218206ee9fad80718c56093f8265b2f287,47b1f7218206ee9fad80718c56093f8265b2f287,How on earth did I still have Shopify on here.
jcoglan,2017-08-02 19:38:10,https://api.github.com/repos/faye/faye/git/commits/1a297b0e094927cde04cf0595e17a2ed4c3f1030,1a297b0e094927cde04cf0595e17a2ed4c3f1030,Lock Uglify dependency down to a release that works with our build.
jcoglan,2017-08-02 19:12:12,https://api.github.com/repos/faye/faye/git/commits/876f0ab5a3fce6bf1ef37e858da7b7e101ff4c71,876f0ab5a3fce6bf1ef37e858da7b7e101ff4c71,Allow credentials in CORS requests and set withCredentials on requests from the browser client.
jcoglan,2017-07-31 23:10:51,https://api.github.com/repos/faye/faye/git/commits/5b6721e70a421585f117b57e07781a1b2352f155,5b6721e70a421585f117b57e07781a1b2352f155,"Replace extend() with assign(), which is closer to the modern Object.assign() function."
jcoglan,2017-07-31 17:10:23,https://api.github.com/repos/faye/faye/git/commits/d30d78c0967ef6afe3dd84b8d37fec37f03ade9b,d30d78c0967ef6afe3dd84b8d37fec37f03ade9b,Send Basic Auth headers in the Node HTTP transport.
jcoglan,2017-07-31 17:06:09,https://api.github.com/repos/faye/faye/git/commits/0df185776468f2d82ff5d678cb120ce106b247cb,0df185776468f2d82ff5d678cb120ce106b247cb,Parse and stringify username:password auth fields from URIs.
jcoglan,2017-07-31 17:05:02,https://api.github.com/repos/faye/faye/git/commits/3f50e7eef096ffe6611dc5ef062aa8c9d47b0cd1,3f50e7eef096ffe6611dc5ef062aa8c9d47b0cd1,Use URI.href rather than URI.stringify() to get the string version of a URL.
jcoglan,2017-07-31 17:02:57,https://api.github.com/repos/faye/faye/git/commits/dc1a3264bbbabd6cd3584741eb12c32c64613960,dc1a3264bbbabd6cd3584741eb12c32c64613960,Update the SSL certificates for testing.
jcoglan,2017-02-20 23:49:22,https://api.github.com/repos/faye/faye/git/commits/7b59ab40f3bb323a0e3580df56e37bf5e67e3a02,7b59ab40f3bb323a0e3580df56e37bf5e67e3a02,"Rewrite the Promise implementation. According to the Bluebird benchmark, this is 1/3 more efficient on CPU and memory than the previous implementation."
jcoglan,2017-01-28 16:15:45,https://api.github.com/repos/faye/faye/git/commits/4778552e834c07e24ca24043dd95c99e73d62768,4778552e834c07e24ca24043dd95c99e73d62768,Explicitly load some Puma components that don't load by default in 3.7.0.
jcoglan,2017-01-28 15:58:28,https://api.github.com/repos/faye/faye/git/commits/34968ed812dee572d0812f65fb45a5d87ee280bf,34968ed812dee572d0812f65fb45a5d87ee280bf,Bump version to 1.2.4.
jcoglan,2017-01-28 15:45:27,https://api.github.com/repos/faye/faye/git/commits/8861ffcd3ce0077d289556746bf59bfed990fe13,8861ffcd3ce0077d289556746bf59bfed990fe13,Document how to check CSRF tokens in recent Rails.
jcoglan,2016-12-27 15:06:02,https://api.github.com/repos/faye/faye/git/commits/22b9cf55bc86353b38926e88845e063dd0120ebf,22b9cf55bc86353b38926e88845e063dd0120ebf,"Merge pull request #458 from dhilipb/master

Changing url to URI to variable not defined error"
dhilipb,2016-12-09 12:04:26,https://api.github.com/repos/faye/faye/git/commits/c46cc91e00a49ee288094e9c58593a3c6fae34ca,c46cc91e00a49ee288094e9c58593a3c6fae34ca,Changing url to URI to variable not defined error
jcoglan,2016-11-15 22:09:00,https://api.github.com/repos/faye/faye/git/commits/2afb2dbb4e6883157d18f46952040c4e67d719c2,2afb2dbb4e6883157d18f46952040c4e67d719c2,Log errors in the Node HTTP transport.
jcoglan,2016-11-12 17:35:32,https://api.github.com/repos/faye/faye/git/commits/bd01bc7c0a5885afe933392087a4708a25021675,bd01bc7c0a5885afe933392087a4708a25021675,"One of the call sites changed in c0e135911f3b98bcaf6d3fcf6b9580043e60fc7d should use a type check before calling URI(), because the input might be a Faye::Server. URI() will try to parse anything that's not a URI, not just strings."
jcoglan,2016-11-12 17:30:37,https://api.github.com/repos/faye/faye/git/commits/36f6ea65c35e2cebfe060b5844ef4a1ba6854ea2,36f6ea65c35e2cebfe060b5844ef4a1ba6854ea2,"For some reason, trying to connect to Puma on 'localhost' rather than '0.0.0.0' does not work on macOS Sierra, so I'm switching to '0.0.0.0' in integration tests."
jcoglan,2016-10-31 20:44:19,https://api.github.com/repos/faye/faye/git/commits/03c9259ce5607afb04fa3ee36a247c1b63a9a7f9,03c9259ce5607afb04fa3ee36a247c1b63a9a7f9,"Merge pull request #451 from matthisk/master

Fixed: Don't use reserved keyword in dot member notation (IE8)"
matthisk,2016-10-12 10:08:13,https://api.github.com/repos/faye/faye/git/commits/4b1a1a61fe4fe399d2232c7dc3c11dc10526da06,4b1a1a61fe4fe399d2232c7dc3c11dc10526da06,Fixed: Don't use reserved keyword in dot member notation (IE8)
jcoglan,2016-10-11 20:27:04,https://api.github.com/repos/faye/faye/git/commits/4dfcc5572a56d692ba7f7f937f447115aa2c97df,4dfcc5572a56d692ba7f7f937f447115aa2c97df,Bump version to 1.2.3.
jcoglan,2016-08-22 19:25:45,https://api.github.com/repos/faye/faye/git/commits/3615453ae915a7d62514fab4b8f55aa8cded0976,3615453ae915a7d62514fab4b8f55aa8cded0976,Make the server return an error if published message contain no 'data' field. This should not break existing apps as the client won't distribute messages with no data.
jcoglan,2016-08-11 14:29:16,https://api.github.com/repos/faye/faye/git/commits/c0e135911f3b98bcaf6d3fcf6b9580043e60fc7d,c0e135911f3b98bcaf6d3fcf6b9580043e60fc7d,Use Kernel#URI rather than URI.parse to parse URLs; this will leave values that are already URI objects alone.
jcoglan,2016-07-29 05:51:32,https://api.github.com/repos/faye/faye/git/commits/c647be92b3f370d71e4ce1257346c4c7fc95de7e,c647be92b3f370d71e4ce1257346c4c7fc95de7e,Return null from ws.create() if the browser does not support WebSocket. This prevents crashes in IE <10.
jcoglan,2016-07-29 05:32:08,https://api.github.com/repos/faye/faye/git/commits/b3cb856df0726642b7d328e791ef93a909088a9c,b3cb856df0726642b7d328e791ef93a909088a9c,Allow the Thin server to receive requests on any interface.
jcoglan,2016-07-18 18:59:49,https://api.github.com/repos/faye/faye/git/commits/51942c86bb500468ef57e79d53260ba4073f52d3,51942c86bb500468ef57e79d53260ba4073f52d3,Bump the version to 1.2.2.
jcoglan,2016-07-18 18:57:28,https://api.github.com/repos/faye/faye/git/commits/74d388a5c3dd0e81d316e77ed20f3db7900c24be,74d388a5c3dd0e81d316e77ed20f3db7900c24be,"Mitigate HTTPoxy by using Ruby's URI#find_proxy method, and implementing a similar method for Node.js."
jcoglan,2016-07-11 18:08:56,https://api.github.com/repos/faye/faye/git/commits/6dd7e7a9aef08c49e8233ac5a6fe2684d866532b,6dd7e7a9aef08c49e8233ac5a6fe2684d866532b,Correct terminology used in promise.js.
jcoglan,2016-07-10 19:41:16,https://api.github.com/repos/faye/faye/git/commits/ad714b4c8797461cc6702587da280e48834b97ef,ad714b4c8797461cc6702587da280e48834b97ef,Remove unused path module from webpack config.
jcoglan,2016-06-29 20:45:47,https://api.github.com/repos/faye/faye/git/commits/79be75540226e18d11dd839b063203af7409f048,79be75540226e18d11dd839b063203af7409f048,Bump version to 1.2.1.
jcoglan,2016-06-29 20:25:52,https://api.github.com/repos/faye/faye/git/commits/d84c148570a942c42571c760090b415c93e600a9,d84c148570a942c42571c760090b415c93e600a9,"Merge pull request #443 from mx-pkorte/patch-1

e is undefined"
mx-pkorte,2016-06-29 12:16:31,https://api.github.com/repos/faye/faye/git/commits/83d07c0c9fc4e8b7ca26c1aab65ced9414d9011c,83d07c0c9fc4e8b7ca26c1aab65ced9414d9011c,e is undefined
jcoglan,2016-06-28 22:38:31,https://api.github.com/repos/faye/faye/git/commits/f49725cb5f99cbce86ab846758fff35edd53701f,f49725cb5f99cbce86ab846758fff35edd53701f,Use an https: link to the Bayeux docs.
jcoglan,2016-06-28 22:37:12,https://api.github.com/repos/faye/faye/git/commits/adabbc49373660fd630bfda3c2ac14f425a3176b,adabbc49373660fd630bfda3c2ac14f425a3176b,"Merge pull request #442 from vincentwoo/fix-links

Fix outdated links to Bayeux spec"
vincentwoo,2016-06-28 22:13:00,https://api.github.com/repos/faye/faye/git/commits/9709450a80812664cdab994c712ad5a3229f7c82,9709450a80812664cdab994c712ad5a3229f7c82,Fix outdated links to Bayeux spec
jcoglan,2016-06-27 22:24:32,https://api.github.com/repos/faye/faye/git/commits/cdc16eef888f7261172458ee2272bc346c3f48ac,cdc16eef888f7261172458ee2272bc346c3f48ac,Correct build comment in the gemspec.
jcoglan,2016-06-27 22:24:23,https://api.github.com/repos/faye/faye/git/commits/924a00880224e26f7ea3357c183f2a323d9c9346,924a00880224e26f7ea3357c183f2a323d9c9346,Correct the release date on the website.
jcoglan,2016-06-26 11:17:08,https://api.github.com/repos/faye/faye/git/commits/216ea3333d7bc0fd7f6c6d25e6eb0815b259ec73,216ea3333d7bc0fd7f6c6d25e6eb0815b259ec73,Bump version to 1.2.0.
jcoglan,2016-06-26 02:00:47,https://api.github.com/repos/faye/faye/git/commits/598218eba94f19123a1eb82526c9de3cf63709cb,598218eba94f19123a1eb82526c9de3cf63709cb,Use protocol-relative URL for fonts to work with SSL.
jcoglan,2016-06-25 20:23:00,https://api.github.com/repos/faye/faye/git/commits/d170b6b77b0c0ad0725fb988ed1eda9016d2d928,d170b6b77b0c0ad0725fb988ed1eda9016d2d928,Update the test SSL certificates.
jcoglan,2016-06-25 20:17:31,https://api.github.com/repos/faye/faye/git/commits/96ab2810042a1c464be0804745b283f36a7c343f,96ab2810042a1c464be0804745b283f36a7c343f,Remove duplicate property name from Engine.Proxy.
jcoglan,2016-06-25 15:03:22,https://api.github.com/repos/faye/faye/git/commits/efc288e80b3a98c8ee595e8ac618583bfc6a18cf,efc288e80b3a98c8ee595e8ac618583bfc6a18cf,"Only use imports-loader when building the tests, not the production code."
jcoglan,2016-06-25 15:02:10,https://api.github.com/repos/faye/faye/git/commits/56d0ca4d7cb6fc62170b5c029bf9667dddbcc1e8,56d0ca4d7cb6fc62170b5c029bf9667dddbcc1e8,Rename the _promise variable used in Transport since it conflicts with that in Deferrable and makes EventSource stop working.
jcoglan,2016-06-25 15:00:13,https://api.github.com/repos/faye/faye/git/commits/ccc84cd0e3084f713226aeb87e4210a100986885,ccc84cd0e3084f713226aeb87e4210a100986885,The EventSource transport was not working because the transport class name was shadowing the EventSource global.
jcoglan,2016-06-14 22:17:35,https://api.github.com/repos/faye/faye/git/commits/8a200097bc012db267ca9d092089b1d93c2746c6,8a200097bc012db267ca9d092089b1d93c2746c6,"Local transport should make requests asynchronously. Otherwise, when the server-side Connection flushes messages to it, the immediate /meta/connect request puts the Connection back in the :unknown state and breaks callbacks that are still queued from the flush. Making this async makes sure that set_deferred_status is not reentrant."
jcoglan,2016-06-11 10:02:07,https://api.github.com/repos/faye/faye/git/commits/bb7cf05a954bdf9d7eeda9fca65e78354e6035bb,bb7cf05a954bdf9d7eeda9fca65e78354e6035bb,Document the Subscription#withChannel() method.
jcoglan,2016-06-11 09:44:34,https://api.github.com/repos/faye/faye/git/commits/c7e4163638ac73e55c258e291694a298d0469635,c7e4163638ac73e55c258e291694a298d0469635,Add a changelog for the upcoming 1.2.0 release.
jcoglan,2016-06-11 00:10:29,https://api.github.com/repos/faye/faye/git/commits/691535ba3ae97ca85b2695bd7d3805e660d29301,691535ba3ae97ca85b2695bd7d3805e660d29301,Check WebSocket ready state before sending messages or pings in Ruby.
jcoglan,2016-06-11 00:05:50,https://api.github.com/repos/faye/faye/git/commits/ec60c02e73cf7a8b40145484001d8e61e0762d83,ec60c02e73cf7a8b40145484001d8e61e0762d83,Port the change from 51eaf0bfcdfca7697836c7ac89e3f2541872ceaf to Ruby.
jcoglan,2016-06-11 00:03:20,https://api.github.com/repos/faye/faye/git/commits/b5ac24b4e773212484fbf8e2e759b5d71cd2cb20,b5ac24b4e773212484fbf8e2e759b5d71cd2cb20,"Revert ""Require the root module in Node examples, to avoid having to run 'make' first.""

This reverts commit e86a7b37cef33b2a3a0e73aa1616a076017c9bec."
jcoglan,2016-05-30 23:24:43,https://api.github.com/repos/faye/faye/git/commits/e86a7b37cef33b2a3a0e73aa1616a076017c9bec,e86a7b37cef33b2a3a0e73aa1616a076017c9bec,"Require the root module in Node examples, to avoid having to run 'make' first."
jcoglan,2016-05-30 23:22:02,https://api.github.com/repos/faye/faye/git/commits/b1a82892fff00e97e9b5cdda035741f85920c236,b1a82892fff00e97e9b5cdda035741f85920c236,Use '.' as the input to webpack(1) to make sure the package.json browser field points to the right place.
jcoglan,2016-05-30 23:09:26,https://api.github.com/repos/faye/faye/git/commits/4e555a753072d07df4bd8d3b4d0352a5cf3606f3,4e555a753072d07df4bd8d3b4d0352a5cf3606f3,"Package the JavaScript files from the JS client build, rather than copying them into the 'lib' directory."
jcoglan,2016-05-30 20:00:44,https://api.github.com/repos/faye/faye/git/commits/b14b25417bf4ec97cce60b54f049193624be61ff,b14b25417bf4ec97cce60b54f049193624be61ff,Replace all uses of 'window' with 'global'; this allows the Client to work inside a WebWorker.
jcoglan,2016-05-30 17:25:04,https://api.github.com/repos/faye/faye/git/commits/41f40c17500c0b9395b4ec264024c21b9b4c9533,41f40c17500c0b9395b4ec264024c21b9b4c9533,"When receiving messages in the client, scope try/catch to just the JSON parsing, since calling _receive() might trigger errors in the user's application and cause the client to think it needs enter error handling."
jcoglan,2016-05-30 17:12:48,https://api.github.com/repos/faye/faye/git/commits/eb851a8b9fcd2483fd814ecbcbba83fddf828264,eb851a8b9fcd2483fd814ecbcbba83fddf828264,Always use the variable name 'error' with 'catch' statements.
jcoglan,2016-05-30 17:10:47,https://api.github.com/repos/faye/faye/git/commits/a8727f0a692a1d29ca60274d9ca6e2de9ef2cbbf,a8727f0a692a1d29ca60274d9ca6e2de9ef2cbbf,"Handle cases where a partial JSON message arrives via EventSource. This can happen because the EventSource protocol does not include length headers on messages, it's just a line-delimited stream."
jcoglan,2016-05-30 17:05:29,https://api.github.com/repos/faye/faye/git/commits/a0d3598782b881b8cf906cbe19df0f788a1bb9fd,a0d3598782b881b8cf906cbe19df0f788a1bb9fd,Make the XHR transport usable on React Native.
jcoglan,2016-05-30 16:29:12,https://api.github.com/repos/faye/faye/git/commits/038af1bd4df98dab60981cbf4aed3120e5aa2226,038af1bd4df98dab60981cbf4aed3120e5aa2226,Adjust formatting of Ruby transport options.
jcoglan,2016-05-30 16:21:41,https://api.github.com/repos/faye/faye/git/commits/d2ed6a89ec67d7e976adc1e5a2630daa8e200d21,d2ed6a89ec67d7e976adc1e5a2630daa8e200d21,"Merge pull request #437 from jamesotron/support-sni-ssl-connections

Add support for connecting to TLS servers using SNI."
jcoglan,2016-05-18 21:22:06,https://api.github.com/repos/faye/faye/git/commits/8c96cabce0e3e7edcfce5afee10b8d71efc789fa,8c96cabce0e3e7edcfce5afee10b8d71efc789fa,Replace our 'defer' module with 'asap' from npm.
jcoglan,2016-05-18 20:43:37,https://api.github.com/repos/faye/faye/git/commits/2ba036123dcc820a0bc1716c422bf981b8c3ea24,2ba036123dcc820a0bc1716c422bf981b8c3ea24,"Migrate Promise to the modern standard API, dropping the old Promise.fulfill() and Promise.reject() class methods for settling existing promises."
jcoglan,2016-05-08 11:04:09,https://api.github.com/repos/faye/faye/git/commits/b190812c6a5284460107f07d54e634b1b261242b,b190812c6a5284460107f07d54e634b1b261242b,"Merge remote-tracking branch 'damienwhaley/feature/ie10_client'

Conflicts:
	src/transport/xhr.js"
damienwhaley,2016-05-04 10:29:04,https://api.github.com/repos/faye/faye/git/commits/91ecf50676ecb2fa15c057364c54e76f6e5d74f2,91ecf50676ecb2fa15c057364c54e76f6e5d74f2,Refactored the selection of the XHR transport to be clearer and improved error handling
jcoglan,2016-04-30 22:05:02,https://api.github.com/repos/faye/faye/git/commits/a99192e7823dcf628b1a3e20a6aa738ea3027ce1,a99192e7823dcf628b1a3e20a6aa738ea3027ce1,"Rename directories: javascript->src and build/lib->build/src. This means the source and build directories have the same name, and the module should be able to work straight out of git without a build step."
jcoglan,2016-04-30 21:42:12,https://api.github.com/repos/faye/faye/git/commits/d97c3a949e2d09ea38c48bb56d7f112e171b61a2,d97c3a949e2d09ea38c48bb56d7f112e171b61a2,Remove 'Connection: Close' from HTTP responses; see https://github.com/faye/faye/issues/420
jcoglan,2016-04-30 21:36:55,https://api.github.com/repos/faye/faye/git/commits/a3d767210f6fcaac16e6b6d3be7e4b01d4ecbcb5,a3d767210f6fcaac16e6b6d3be7e4b01d4ecbcb5,Reject requests that do not contain an object or array as their top-level JSON structure.
jcoglan,2016-04-30 16:47:16,https://api.github.com/repos/faye/faye/git/commits/87fbb33c8729c61a14acb0e8e56ca30187b13bc7,87fbb33c8729c61a14acb0e8e56ca30187b13bc7,Add Promise.catch().
jcoglan,2016-04-27 20:04:46,https://api.github.com/repos/faye/faye/git/commits/4392a250a91a96b7d390f90dac17e4e73f833d24,4392a250a91a96b7d390f90dac17e4e73f833d24,Add tests for the client.subscribe().withChannel() API.
jcoglan,2016-04-27 19:59:12,https://api.github.com/repos/faye/faye/git/commits/e63c70136b14843494a0c0b06d5965e2a9cfdb30,e63c70136b14843494a0c0b06d5965e2a9cfdb30,Add with_channel to the Ruby client.
jcoglan,2016-03-26 18:01:34,https://api.github.com/repos/faye/faye/git/commits/b41ba0a9abff35d657b461530bf1f9001464b003,b41ba0a9abff35d657b461530bf1f9001464b003,"Merge branch 'with-channel'

Conflicts:
	javascript/protocol/channel.js
	javascript/protocol/client.js"
jcoglan,2016-03-25 17:48:48,https://api.github.com/repos/faye/faye/git/commits/29559496cbd0a05170a07caf7b781a99b359d4a8,29559496cbd0a05170a07caf7b781a99b359d4a8,"We should use process.nextTick() for promises rather than setImmediate, since the former creates microtasks."
jcoglan,2016-03-25 17:42:53,https://api.github.com/repos/faye/faye/git/commits/c89b1ff65b86ae25c51acfa646b1edcf7beb0f23,c89b1ff65b86ae25c51acfa646b1edcf7beb0f23,"Merge branch 'node-modules'

Conflicts:
	javascript/transport/transport.js"
jcoglan,2016-03-07 21:10:45,https://api.github.com/repos/faye/faye/git/commits/e7e6c975a28e748770325c14e0ead09a3d747bb9,e7e6c975a28e748770325c14e0ead09a3d747bb9,Fix the 'Cannot read property _state of undefined' error. It was possible for flushLargeBatch() to delete the existing promise without replacing it with a new one before flush() was called with the new message.
jcoglan,2016-02-16 22:53:59,https://api.github.com/repos/faye/faye/git/commits/95dfcfa7d2f229ed2766837645814be3c0846f8e,95dfcfa7d2f229ed2766837645814be3c0846f8e,Link to the faye-couchbase engine.
jcoglan,2015-11-18 23:57:51,https://api.github.com/repos/faye/faye/git/commits/f95814048061afd3b4d1b5397f990125a94c7bb2,f95814048061afd3b4d1b5397f990125a94c7bb2,Update the contributing instructions.
jcoglan,2015-11-18 21:54:27,https://api.github.com/repos/faye/faye/git/commits/c52be2b76efea145c5c97822bf70df923302bffe,c52be2b76efea145c5c97822bf70df923302bffe,Make test JavaScript test suites run on require() modules on Node and in the browser.
jcoglan,2015-11-18 22:21:19,https://api.github.com/repos/faye/faye/git/commits/2e130e400575475c2254aa693559126129aeb4db,2e130e400575475c2254aa693559126129aeb4db,Update the link to the Bayeux spec.
jcoglan,2015-11-15 16:08:44,https://api.github.com/repos/faye/faye/git/commits/c862f3dbf612a0716f3050ef0bf12eef275e3db6,c862f3dbf612a0716f3050ef0bf12eef275e3db6,Remove the ENV constant and use 'global' instead; webpack replaces this with 'window' in the browser.
