bottomsheet,Android component which presents a dismissible view from the bottom of the screen
username,timestamp,url,sha,message
kyild,2018-02-23 20:45:08,https://api.github.com/repos/Flipboard/bottomsheet/git/commits/2792f24d60a19e0948ff0e9977ea6ccff4a6a35d,2792f24d60a19e0948ff0e9977ea6ccff4a6a35d,"Merge pull request #194 from Flipboard/fixexpand

Fixes faulty bottom sheet position"
kyild,2018-02-22 23:14:32,https://api.github.com/repos/Flipboard/bottomsheet/git/commits/85024ab6170b0f18b8c307e5ced4836af4a05594,85024ab6170b0f18b8c307e5ced4836af4a05594,"Fixes faulty bottom sheet position

Caused by: https://github.com/Flipboard/bottomsheet/commit/c3d365a648b9c17d64e9$
Peek to expand case incorrectly triggered during bottomsheet's initial layout"
kyild,2018-02-21 19:17:07,https://api.github.com/repos/Flipboard/bottomsheet/git/commits/ed39a767ad6d0854688c86d21102034387713332,ed39a767ad6d0854688c86d21102034387713332,"Merge pull request #193 from Flipboard/expand

Fix wrong bottom sheet position after sheet gets expanded"
kyild,2018-02-16 21:22:51,https://api.github.com/repos/Flipboard/bottomsheet/git/commits/c3d365a648b9c17d64e929c03d94825059053dec,c3d365a648b9c17d64e929c03d94825059053dec,"Fix wrong bottom sheet position after sheet gets expanded

We need to call setSheetTranslation after layout expand events as well as layout shrink"
dlackty,2017-08-29 18:30:13,https://api.github.com/repos/Flipboard/bottomsheet/git/commits/43ab062dcbda34f89b2bdc603b78de98b5f9c0c2,43ab062dcbda34f89b2bdc603b78de98b5f9c0c2,"Customize tile layout (#165)

* Allow customization of tile layout"
markrietveld,2017-05-08 18:43:20,https://api.github.com/repos/Flipboard/bottomsheet/git/commits/26747ae46b4a9123f7836897a778f8299028ae57,26747ae46b4a9123f7836897a778f8299028ae57,"Merge pull request #176 from petterh/petterh/fix-readme

Fixed headers, changed tabs to spaces and fixed markdownlint warnings"
petterh,2017-04-07 12:40:54,https://api.github.com/repos/Flipboard/bottomsheet/git/commits/d67bb207948a39da3afc2e0210e85cf050d02257,d67bb207948a39da3afc2e0210e85cf050d02257,"Fixed headers, changed tabs to spaces and fixed markdownlint warnings"
xiphirx,2016-11-18 18:12:34,https://api.github.com/repos/Flipboard/bottomsheet/git/commits/af3aa339d891154907bb3fe779aad1e0ff318469,af3aa339d891154907bb3fe779aad1e0ff318469,"Fix initial bottom sheet height (#166)

Fix initial bottom sheet height"
petershu,2016-09-09 01:05:40,https://api.github.com/repos/Flipboard/bottomsheet/git/commits/466aa6a9bce2b20883a8f8e58dce5e12936eb412,466aa6a9bce2b20883a8f8e58dce5e12936eb412,Increase version name to 1.5.2 for release
petershu,2016-09-09 01:03:41,https://api.github.com/repos/Flipboard/bottomsheet/git/commits/d0e42919dd14a87da0761dcc39761f0ee8c96406,d0e42919dd14a87da0761dcc39761f0ee8c96406,"Update README.md.template

Changes should not be made directly to README.md, since it's always generated from the template file"
kyild,2016-07-20 20:50:42,https://api.github.com/repos/Flipboard/bottomsheet/git/commits/02d10fdb1e34469111b22ab632852f6d3dc782fc,02d10fdb1e34469111b22ab632852f6d3dc782fc,Merge branch 'kem/bug/xl_text_UI_fix_4316'
kyild,2016-07-20 01:34:28,https://api.github.com/repos/Flipboard/bottomsheet/git/commits/5e6cddb5b6220c3dac0220216856ad86ed3d7bc9,5e6cddb5b6220c3dac0220216856ad86ed3d7bc9,"Fix Extra Large Label UI on Grid Item on bottomsheet
Extra Large text was cutting since text size was predetermined fix changes the text style to wrap its content and ads little bit padding on the sides for better look and feel"
meierjan,2016-06-23 13:14:00,https://api.github.com/repos/Flipboard/bottomsheet/git/commits/133c072b84d55715bed6ff4eb658b7e1519a28b8,133c072b84d55715bed6ff4eb658b7e1519a28b8,"Fix scrolling issue by taking x&y scrollposition into account (#133)

fixes #132 by taking x&y scrollposition into account"
markrietveld,2016-05-31 15:04:33,https://api.github.com/repos/Flipboard/bottomsheet/git/commits/dcbfa2626323ae8dd73fd52f19bf9d15eedb5010,dcbfa2626323ae8dd73fd52f19bf9d15eedb5010,"Merge pull request #140 from erishforG/master

Fix IntentPickerSheetView example wrong syntax"
erishforG,2016-05-30 05:40:42,https://api.github.com/repos/Flipboard/bottomsheet/git/commits/82ce87d233c44df5a5b3561d345ee6e35a8a80f4,82ce87d233c44df5a5b3561d345ee6e35a8a80f4,"Fix IntentPickerSheetView example wrong syntax

- change wrong bracket in IntentPickerSheetView example"
markrietveld,2016-05-26 16:20:25,https://api.github.com/repos/Flipboard/bottomsheet/git/commits/8c8f78c0ff8aa9522f69cc57dab1f7d8f9a4fb70,8c8f78c0ff8aa9522f69cc57dab1f7d8f9a4fb70,Increase version name to 1.5.1 for release
markrietveld,2016-05-24 18:16:19,https://api.github.com/repos/Flipboard/bottomsheet/git/commits/ca13df76b25a64d659bd98320d9ceaa1992ff41c,ca13df76b25a64d659bd98320d9ceaa1992ff41c,"Merge pull request #139 from Flipboard/duplicate

Fix duplicate state notifications"
markrietveld,2016-05-24 16:37:26,https://api.github.com/repos/Flipboard/bottomsheet/git/commits/76832ca35e47f5baa6fac641fd3e8d9c5f6683d6,76832ca35e47f5baa6fac641fd3e8d9c5f6683d6,"Fix duplicate state notifications

Fixes https://github.com/Flipboard/bottomsheet/issues/99"
ZacSweers,2016-02-28 03:42:33,https://api.github.com/repos/Flipboard/bottomsheet/git/commits/5a1f99befd8b2e73634638e540f120386ef4b22a,5a1f99befd8b2e73634638e540f120386ef4b22a,Update deps and use support menu to avoid hacky-ness
markrietveld,2016-05-17 17:21:52,https://api.github.com/repos/Flipboard/bottomsheet/git/commits/5cf20b54fc6c764e16cad804bd5b59347e2d0712,5cf20b54fc6c764e16cad804bd5b59347e2d0712,"Merge pull request #138 from Flipboard/clamp

Fix incorrect dimming and sheet position"
markrietveld,2016-05-17 16:51:59,https://api.github.com/repos/Flipboard/bottomsheet/git/commits/4e1c4a445e74665f84b54c5c51c9df694cb3d393,4e1c4a445e74665f84b54c5c51c9df694cb3d393,"Fix incorrect dimming and sheet position

If translation > maxSheetTranslation the sheet won't be attached to the bottom, and the dimAlpha can go beyond the max dimming value
Resolves https://github.com/Flipboard/bottomsheet/issues/91"
markrietveld,2016-05-17 16:41:03,https://api.github.com/repos/Flipboard/bottomsheet/git/commits/d51f88bec3743f13c216867f6e66fc1c70aae033,d51f88bec3743f13c216867f6e66fc1c70aae033,"Merge pull request #137 from Flipboard/update_build

Update build tools and gradle to latest (2.1.0 and 2.12)"
markrietveld,2016-05-17 16:33:30,https://api.github.com/repos/Flipboard/bottomsheet/git/commits/0bf0c8975ca3faa0c807ab31f77dad1af3e62ffe,0bf0c8975ca3faa0c807ab31f77dad1af3e62ffe,Update build tools and gradle to latest (2.1.0 and 2.13)
markrietveld,2016-03-21 17:20:19,https://api.github.com/repos/Flipboard/bottomsheet/git/commits/6cf653ca5236ea98a726decd87b526381a03d373,6cf653ca5236ea98a726decd87b526381a03d373,"Merge pull request #127 from Servus7/kec/update-readme

ENHANCEMENT: updates readme"
Servus7,2016-03-18 16:42:49,https://api.github.com/repos/Flipboard/bottomsheet/git/commits/977a0304305edaa6239db1e7c65c96490d82a74a,977a0304305edaa6239db1e7c65c96490d82a74a,updates readme
markrietveld,2016-01-20 23:22:00,https://api.github.com/repos/Flipboard/bottomsheet/git/commits/cf799b0b5428503d9c37a5db0753bdc72a4051c2,cf799b0b5428503d9c37a5db0753bdc72a4051c2,"Merge pull request #116 from TheFinestArtist/master

Check READ_EXTERNAL_STORAGE permission if API is higher than 16"
TheFinestArtist,2016-01-20 13:03:51,https://api.github.com/repos/Flipboard/bottomsheet/git/commits/274ef102eda14660d440cdfab85e0779cc389fde,274ef102eda14660d440cdfab85e0779cc389fde,Check READ_EXTERNAL_STORAGE permission if API is higher than 16
markrietveld,2015-12-30 21:07:05,https://api.github.com/repos/Flipboard/bottomsheet/git/commits/e0c6cf6fce88eac3c6f4956442c92a4566ace372,e0c6cf6fce88eac3c6f4956442c92a4566ace372,"Merge pull request #110 from TheFinestArtist/patch-2

Update IntentPickerSheetView.java"
TheFinestArtist,2015-12-30 17:50:36,https://api.github.com/repos/Flipboard/bottomsheet/git/commits/780c86593d21dd7e43cbc98c32e0dafed2c38789,780c86593d21dd7e43cbc98c32e0dafed2c38789,"Update IntentPickerSheetView.java

Added access to titleView."
ZacSweers,2015-12-16 22:52:40,https://api.github.com/repos/Flipboard/bottomsheet/git/commits/e9cdfa3ece6b9a1824e1e33f33c4a4cb4f8070ed,e9cdfa3ece6b9a1824e1e33f33c4a4cb4f8070ed,Specify jcenter
ZacSweers,2015-12-13 08:48:36,https://api.github.com/repos/Flipboard/bottomsheet/git/commits/9510fa310247c47a6343c322d297c3bc24458a59,9510fa310247c47a6343c322d297c3bc24458a59,Use new gradle plugin
markrietveld,2015-12-01 21:06:42,https://api.github.com/repos/Flipboard/bottomsheet/git/commits/53862cab9806712681672c5e7523b8a6b3e2f416,53862cab9806712681672c5e7523b8a6b3e2f416,Increase version to 1.5.0 for bintray release
markrietveld,2015-11-25 22:29:02,https://api.github.com/repos/Flipboard/bottomsheet/git/commits/a144e47e19821552aa19a0f7f54cd4723d3c1757,a144e47e19821552aa19a0f7f54cd4723d3c1757,"Merge pull request #89 from vanniktech/master_static_classes

Made private classes static to prevent Memory Leaks"
vanniktech,2015-11-25 10:50:10,https://api.github.com/repos/Flipboard/bottomsheet/git/commits/97a4f468976c7bdf44b2acc9e619332eb2212049,97a4f468976c7bdf44b2acc9e619332eb2212049,Made private classes static to prevent Memory Leaks
ZacSweers,2015-11-24 02:49:43,https://api.github.com/repos/Flipboard/bottomsheet/git/commits/907d533ca3aedb03f669dcb05fc6fcbccd36e314,907d533ca3aedb03f669dcb05fc6fcbccd36e314,"Merge pull request #86 from Flipboard/z/addlisteners

Switch API to support composite listeners"
evant,2015-11-05 19:04:25,https://api.github.com/repos/Flipboard/bottomsheet/git/commits/b5500d53b388e07621dff9133823a8422912a33f,b5500d53b388e07621dff9133823a8422912a33f,Added a BottomSheetFragment to bottomsheet-commons that works like a DialogFragment.
markrietveld,2015-10-19 04:51:36,https://api.github.com/repos/Flipboard/bottomsheet/git/commits/5473cd730c4f1dd59e21a7c8e84dfb1089474424,5473cd730c4f1dd59e21a7c8e84dfb1089474424,"Merge pull request #70 from TheFinestArtist/patch-1

Update IntentPickerSheetView modifiers"
TheFinestArtist,2015-09-29 11:37:41,https://api.github.com/repos/Flipboard/bottomsheet/git/commits/e810e3e16b5f131f0c980bccbe3764756ac8167c,e810e3e16b5f131f0c980bccbe3764756ac8167c,"Update IntentPickerSheetView modifiers

This will help developers access each variable and customise it.
(ImagePickerSheetView.java set all variable with protected modifiers.)"
markrietveld,2015-09-15 17:14:07,https://api.github.com/repos/Flipboard/bottomsheet/git/commits/222440d6084e4917e0149a6498cd1261421c6835,222440d6084e4917e0149a6498cd1261421c6835,Increase version to 1.4.3 for bintray release
markrietveld,2015-09-15 17:11:37,https://api.github.com/repos/Flipboard/bottomsheet/git/commits/e73951641ffa2fff5c158bbc4d4934ac2c04bc68,e73951641ffa2fff5c158bbc4d4934ac2c04bc68,"Merge pull request #64 from Flipboard/share

Share sheet fix and improvement"
markrietveld,2015-09-15 03:58:44,https://api.github.com/repos/Flipboard/bottomsheet/git/commits/753b7163953090ad9804108d8db8bdb7dcea1f75,753b7163953090ad9804108d8db8bdb7dcea1f75,"Add custom column width to ImagePicker and Menu sheets

The default is sensible, but some apps might want a different number of columns than other"
markrietveld,2015-09-15 03:24:09,https://api.github.com/repos/Flipboard/bottomsheet/git/commits/ec8ec41c66b04b1b5bd835f215dc85a3e4286aa3,ec8ec41c66b04b1b5bd835f215dc85a3e4286aa3,"Fix mix-ins pointing to the wrong application package

The first parameter of ComponentInfo is the app id, which is different from the java package
There is no way to get the app id without a context.
The sample project only worked because the application id was exactly the same as the java package by coincidence

NOTE: the is a breaking API change for using mix-ins with IntentPickerSheetView in commons
Fixes https://github.com/Flipboard/bottomsheet/issues/62"
markrietveld,2015-09-15 03:10:37,https://api.github.com/repos/Flipboard/bottomsheet/git/commits/2764c0ad7a579c53fa1ef8436fceb2b795f53811,2764c0ad7a579c53fa1ef8436fceb2b795f53811,"Make column width for Intent picker sheet configurable

The default is sensible, but different apps might want different numbers of columns"
markrietveld,2015-09-08 07:56:09,https://api.github.com/repos/Flipboard/bottomsheet/git/commits/06e3d74d8962be7f2148f5f10811685ffc5bd7f9,06e3d74d8962be7f2148f5f10811685ffc5bd7f9,Increase version to 1.4.2 for bintray release
markrietveld,2015-09-08 06:43:38,https://api.github.com/repos/Flipboard/bottomsheet/git/commits/8f716cffb5f7bc6a695cf57136ee58ea9b098468,8f716cffb5f7bc6a695cf57136ee58ea9b098468,"Merge pull request #59 from Flipboard/show

Handle showing a sheet when another sheet is already showing"
markrietveld,2015-09-08 06:03:59,https://api.github.com/repos/Flipboard/bottomsheet/git/commits/a45422d07876faf46ecd5a840925e20e5c6a4524,a45422d07876faf46ecd5a840925e20e5c6a4524,"Cancel any running bottomsheet animation when the view is detached

Avoids doing extra work after the view is no longer on screen"
markrietveld,2015-09-08 03:54:45,https://api.github.com/repos/Flipboard/bottomsheet/git/commits/566d0773fe84f4619ac5c56108fd19967b9192f9,566d0773fe84f4619ac5c56108fd19967b9192f9,"Handle showing a sheet when another sheet is already showing

In most cases, the caller will want to replace the current sheet with the new one
Animate out the existing sheet normally, and then animate in the new sheet
Resolves https://github.com/Flipboard/bottomsheet/issues/56"
markrietveld,2015-09-08 03:01:06,https://api.github.com/repos/Flipboard/bottomsheet/git/commits/f9a4a3b742de87b5cc0284d265612c2339819c0b,f9a4a3b742de87b5cc0284d265612c2339819c0b,Increase version to 1.4.1 for bintray release
markrietveld,2015-09-08 02:45:34,https://api.github.com/repos/Flipboard/bottomsheet/git/commits/f26f4c1f1bc0f8b45d6b1e1823e27de7b8635f85,f26f4c1f1bc0f8b45d6b1e1823e27de7b8635f85,"Merge pull request #58 from Flipboard/dim

Make bottomsheet work with YoutubePlayer from the Youtube SDK"
markrietveld,2015-09-08 01:10:42,https://api.github.com/repos/Flipboard/bottomsheet/git/commits/e8d8b9a7980e9a403b80792833a36196a4033a5c,e8d8b9a7980e9a403b80792833a36196a4033a5c,"Make bottomsheet work with YoutubePlayer from the Youtube SDK

The player pauses if something is covering it. In the bottomsheet case, the dimview was always covering it
The alpha was always 0 in the closed state, but the player doesn't care about that
Setting dimView to INVISIBLE makes the player work. It will still pause when a sheet is opened, but that seems like expected behavior, and it can be resume after closing the sheet"
ZacSweers,2015-09-01 22:05:27,https://api.github.com/repos/Flipboard/bottomsheet/git/commits/8103b066e03159453b7f106904a7d249641623b0,8103b066e03159453b7f106904a7d249641623b0,Update README with ImagePicker gif
ZacSweers,2015-09-01 19:19:16,https://api.github.com/repos/Flipboard/bottomsheet/git/commits/c88ea918fa603ddc037b2a534102b251105284e3,c88ea918fa603ddc037b2a534102b251105284e3,1.4.0
ZacSweers,2015-09-01 07:08:27,https://api.github.com/repos/Flipboard/bottomsheet/git/commits/bfd8af38c06be691f8009f4226b03038ca3e1054,bfd8af38c06be691f8009f4226b03038ca3e1054,"Merge pull request #54 from Flipboard/z/misc_updates

Couple misc updates"
ZacSweers,2015-09-01 06:55:01,https://api.github.com/repos/Flipboard/bottomsheet/git/commits/bc1d121507f196d41ef0904540781c07f08dea3d,bc1d121507f196d41ef0904540781c07f08dea3d,"Set drawSelectorOnTop in constructor

Copy pasta mistake, doesn't need to happen in onMeasure"
ZacSweers,2015-09-01 05:43:41,https://api.github.com/repos/Flipboard/bottomsheet/git/commits/2fd3ff1b053c495279efddc3689162329f0e85b4,2fd3ff1b053c495279efddc3689162329f0e85b4,"Default to WRAP_CONTENT for height

This way content that doesn't fill the screen won't allow for a fully expanded state"
ZacSweers,2015-09-01 05:41:08,https://api.github.com/repos/Flipboard/bottomsheet/git/commits/0a3a7e3a5423dae6ade2031fc10298275d4f9e30,0a3a7e3a5423dae6ade2031fc10298275d4f9e30,"Standardize columnCount calculation method

Doing it in onMeasure avoids platform and race conditions with onLayout, while allowing for dynamic calculation if the sheet is set to match parent width"
markrietveld,2015-09-01 04:49:33,https://api.github.com/repos/Flipboard/bottomsheet/git/commits/65cbeba76c2399e8b8257013f201325181be91bb,65cbeba76c2399e8b8257013f201325181be91bb,"Merge pull request #53 from Flipboard/mixin_updates

Mix-in updates"
markrietveld,2015-08-31 06:46:01,https://api.github.com/repos/Flipboard/bottomsheet/git/commits/e64581196c5a1d9cf9a09185b8af20b210b517c9,e64581196c5a1d9cf9a09185b8af20b210b517c9,"Lazy load icons in intent picker sheet in bottomsheet commons

Loading icons can take a long time, especially the first time the sheet is opened
This change makes the sheet open significantly faster that first time, at the expense of the icons coming in a little later"
markrietveld,2015-08-29 02:03:36,https://api.github.com/repos/Flipboard/bottomsheet/git/commits/609e63d7885359bb49ee85565c358ac35167583a,609e63d7885359bb49ee85565c358ac35167583a,"Handle column number in onMeasure instead of onLayout

onLayout is too late. That's why Android complains in newer versions, and just fails in older versions"
markrietveld,2015-08-28 21:07:22,https://api.github.com/repos/Flipboard/bottomsheet/git/commits/7b0e1a8afc82f8bac21a7d60efc8180600f27284,7b0e1a8afc82f8bac21a7d60efc8180600f27284,"Modify click handling API for IntentPickerSheet in commons

Some usages of mix-ins need a way to keep track of some extra information
Note: this introduces a breaking API change for the intent share sheet in bottomsheet-commons"
ZacSweers,2015-09-01 02:43:46,https://api.github.com/repos/Flipboard/bottomsheet/git/commits/14f6f8d5ef80a2334e7cf5f68d826b604492093f,14f6f8d5ef80a2334e7cf5f68d826b604492093f,"Fix stale class reference

We should really get some basic smoke testing going on travis..."
ZacSweers,2015-08-30 01:31:54,https://api.github.com/repos/Flipboard/bottomsheet/git/commits/a5025ba25ae516ab665d512f5ef4443ec417d897,a5025ba25ae516ab665d512f5ef4443ec417d897,"Merge pull request #50 from Flipboard/z/image_picker

Image picker sheet"
ZacSweers,2015-08-30 00:21:59,https://api.github.com/repos/Flipboard/bottomsheet/git/commits/63e55b37970ebde293bfc2cd6217aecd48fb8bd2,63e55b37970ebde293bfc2cd6217aecd48fb8bd2,"Update to bintray-release 3.4 and android gradle plugin 1.3.1

Was waiting for a fix to be merged to the 3.4 version of the bintray-release plugin before we could update to android's 1.3.1 update"
ZacSweers,2015-08-28 20:12:07,https://api.github.com/repos/Flipboard/bottomsheet/git/commits/6a7e79b7e1f782649fa56e6e2ff683bd123c2260,6a7e79b7e1f782649fa56e6e2ff683bd123c2260,"Add special tile type intdef to make the special constructor obvious

One should only be using this constructor for CAMERA and PICKER, so this makes that obvious"
ZacSweers,2015-08-27 06:42:57,https://api.github.com/repos/Flipboard/bottomsheet/git/commits/e732be7b2151a38feabc6c54f4bdfe6119e69f85,e732be7b2151a38feabc6c54f4bdfe6119e69f85,Restructure ImagePickerTile and standardize storage v. picker nomenclature
ZacSweers,2015-08-27 06:28:56,https://api.github.com/repos/Flipboard/bottomsheet/git/commits/82f0e8624705b82f99e051116614dcde7199a901,82f0e8624705b82f99e051116614dcde7199a901,"Use different name and more accurate docs for ImagePickerSheetImageView

Name change avoids the explicit implication that it's always a square, which isn't actually the case when widthSpec's mode isn't EXACTLY"
ZacSweers,2015-08-27 06:26:57,https://api.github.com/repos/Flipboard/bottomsheet/git/commits/efa2d61d61a744d216d4ea3c35450783952f5d7e,efa2d61d61a744d216d4ea3c35450783952f5d7e,Use more accurate name for clarity in measuring
ZacSweers,2015-08-27 06:25:23,https://api.github.com/repos/Flipboard/bottomsheet/git/commits/5b21b0fe8cba9b005381145b988b67e8934a1ea7,5b21b0fe8cba9b005381145b988b67e8934a1ea7,Keep track of original list top padding so it doesn't compound on repeat setTitle() calls
ZacSweers,2015-08-24 06:50:12,https://api.github.com/repos/Flipboard/bottomsheet/git/commits/3f3265d5b6baff47926fff16a1eaa8348433e8fe,3f3265d5b6baff47926fff16a1eaa8348433e8fe,Update travis config
ZacSweers,2015-08-24 06:03:53,https://api.github.com/repos/Flipboard/bottomsheet/git/commits/1027a6b4adee578f84e6e14f6b8fcf3e609d35d7,1027a6b4adee578f84e6e14f6b8fcf3e609d35d7,Add missing docs to BottomSheetLayout
ZacSweers,2015-08-24 05:57:01,https://api.github.com/repos/Flipboard/bottomsheet/git/commits/2ed2f2230f3b2e218a3400b8996f93e3b88fc797,2ed2f2230f3b2e218a3400b8996f93e3b88fc797,"Add ImagePickerSheetView sample to sample app

This includes some general example implementations for how to handle camera capture and image picking as well, complete with permission checking."
ZacSweers,2015-08-24 05:54:57,https://api.github.com/repos/Flipboard/bottomsheet/git/commits/6eb1044547db6e2e4db6ce0da2b429e6c7cc67f4,6eb1044547db6e2e4db6ce0da2b429e6c7cc67f4,"Implement ImagePickerSheetView

This is a sheet view that shows a grid of recent local images as well as options to take a new picture or pick one from any app that supports the image picking API. This adds a dependency on the actual bottom sheet library (to access its isTablet/predictedDefaultWidth functions), which we should probably have been doing anyway."
ZacSweers,2015-08-24 05:45:59,https://api.github.com/repos/Flipboard/bottomsheet/git/commits/f6ad3eb14a2f7106b5d754898a5dd986ff64e9e6,f6ad3eb14a2f7106b5d754898a5dd986ff64e9e6,"Add public helper methods for retrieving BottomSheetLayout configs

These will be useful for some of the commons components as well as anyone that wants to have logic ahead of time for how BottomSheetLayout will behave on different densities."
ZacSweers,2015-08-24 05:42:45,https://api.github.com/repos/Flipboard/bottomsheet/git/commits/9a7d6ef0cdd36d55487ad596008569fdf0171bad,9a7d6ef0cdd36d55487ad596008569fdf0171bad,API 23
ZacSweers,2015-08-24 05:34:44,https://api.github.com/repos/Flipboard/bottomsheet/git/commits/b7d0a6b896bc2dec6be0cb956c90015f03d54fe8,b7d0a6b896bc2dec6be0cb956c90015f03d54fe8,"Update bintray-release version

Still not compatible with android gradle plugin 1.3.0+, but it's the latest at least"
ZacSweers,2015-08-21 08:37:43,https://api.github.com/repos/Flipboard/bottomsheet/git/commits/7301b547be29800960ac734f2f79e4f728793d00,7301b547be29800960ac734f2f79e4f728793d00,"Merge pull request #49 from emilsjolander/emil_add_preparing_state

Add preparing state to sheet view."
emilsjolander,2015-08-20 13:12:50,https://api.github.com/repos/Flipboard/bottomsheet/git/commits/2f916244b666a16410087be6c323c9a34dfd5c87,2f916244b666a16410087be6c323c9a34dfd5c87,"Add preparing state to sheet view.

This ensures that isSheetShowing() returns true while we are still laying out the sheet. Before this showWithSheetView() could break even though isSheetShowing() returned false."
ZacSweers,2015-08-05 21:24:16,https://api.github.com/repos/Flipboard/bottomsheet/git/commits/0ca1173a9da83a9f2b3f62997b08e59f3d55586d,0ca1173a9da83a9f2b3f62997b08e59f3d55586d,Fix travis badge
ZacSweers,2015-08-04 06:30:20,https://api.github.com/repos/Flipboard/bottomsheet/git/commits/90084633bb9a7c119d152457cc7644bf0328fd4e,90084633bb9a7c119d152457cc7644bf0328fd4e,"Merge pull request #38 from Flipboard/z/tablet_widths

Use pre-defined widths for tablets when sheet params are WRAP_CONTENT"
ZacSweers,2015-08-04 01:11:21,https://api.github.com/repos/Flipboard/bottomsheet/git/commits/a6e952136f49a58095f3481d5153739dc4b32dca,a6e952136f49a58095f3481d5153739dc4b32dca,"Merge pull request #35 from davideas/master

Added custom peek"
ZacSweers,2015-08-03 23:10:38,https://api.github.com/repos/Flipboard/bottomsheet/git/commits/715b80919776df451feb99b1118bd78044edd881,715b80919776df451feb99b1118bd78044edd881,"Default sheetEndX to screen width

This ensures that the sheet behaves normally when it's match parent, and fixes a bug where full-width sheets would always register touches as outside the sheet"
ZacSweers,2015-08-03 06:12:08,https://api.github.com/repos/Flipboard/bottomsheet/git/commits/5880c0174b43ce78a5330a4111c56fe78011129f,5880c0174b43ce78a5330a4111c56fe78011129f,Fix incorrect dimen resource name
ZacSweers,2015-08-03 04:40:30,https://api.github.com/repos/Flipboard/bottomsheet/git/commits/a34a855929167585cf6acc46389f59e6813d8cb2,a34a855929167585cf6acc46389f59e6813d8cb2,"Use pre-defined widths for tablets when sheet params are WRAP_CONTENT

This introduces some proper width handling on tablets. Forcing all sheets to be the same width as the parent can be a bad UI experience, especially for short lines of text.

This is based on what the system does for the width of the notification panel, with custom sizes for sw600dp and sw720dp screen densities."
ZacSweers,2015-07-31 20:40:26,https://api.github.com/repos/Flipboard/bottomsheet/git/commits/bd5ae6c984c002403108168e722586d4c55792a0,bd5ae6c984c002403108168e722586d4c55792a0,Update support libs
ZacSweers,2015-07-30 20:47:11,https://api.github.com/repos/Flipboard/bottomsheet/git/commits/069454b24a6d3154885403b9bd75229c4fd15353,069454b24a6d3154885403b9bd75229c4fd15353,"Merge pull request #36 from Flipboard/z/mixins

Add support for custom mixins to picker sheet"
ZacSweers,2015-07-29 01:38:41,https://api.github.com/repos/Flipboard/bottomsheet/git/commits/b5ee74e3af0640483093fbbd9bd1dcd6c3d70113,b5ee74e3af0640483093fbbd9bd1dcd6c3d70113,"Add support for custom mixins to picker sheet

This is useful for when you want to add your own custom targets for the picker sheet."
davideas,2015-07-28 23:45:52,https://api.github.com/repos/Flipboard/bottomsheet/git/commits/0eb8b748a7b8c69157ddfdb4b2212a4e80f5a36e,0eb8b748a7b8c69157ddfdb4b2212a4e80f5a36e,Moved out from getPeekSheetTranslation the default calculation for peek translation
