frege,Frege is a Haskell for the JVM. It brings purely functional programing to the Java platform.
username,timestamp,url,sha,message
Ingo60,2019-09-08 21:57:24,https://api.github.com/repos/Frege/frege/git/commits/753613d84ea689df57517bc322be55b0c86731ff,753613d84ea689df57517bc322be55b0c86731ff,"Merge pull request #380 from badbadboy/nonempty-improvements

Improvements to Data.NonEmpty"
badbadboy,2019-09-07 21:29:52,https://api.github.com/repos/Frege/frege/git/commits/7c3f659f5e0a69a44bdb606c644c2b8e197ad315,7c3f659f5e0a69a44bdb606c644c2b8e197ad315,Use Haskell definitions that do not need unsafeToNonEmpty
badbadboy,2019-09-07 21:00:30,https://api.github.com/repos/Frege/frege/git/commits/3eec7db5290497e48d6d0bd781580acaa8d5da4d,3eec7db5290497e48d6d0bd781580acaa8d5da4d,Fixed typo in the function name
badbadboy,2019-09-07 20:21:40,https://api.github.com/repos/Frege/frege/git/commits/05a5dd55c79598331f2db11069fb8015c4818085,05a5dd55c79598331f2db11069fb8015c4818085,Use the same symbols for NonEmpty operators as in Haskell
badbadboy,2019-09-07 20:19:58,https://api.github.com/repos/Frege/frege/git/commits/cc13e086c50691879cb7a27554a7ab59217485ce,cc13e086c50691879cb7a27554a7ab59217485ce,Moved NonEmpty data declaration to PreludeBase
Ingo60,2019-09-05 17:52:20,https://api.github.com/repos/Frege/frege/git/commits/823554a4ee571985ef48f09a8e54348297734b65,823554a4ee571985ef48f09a8e54348297734b65,"Merge pull request #379 from badbadboy/semigroup-improvements

Semigroup improvements"
Ingo60,2019-09-05 17:44:38,https://api.github.com/repos/Frege/frege/git/commits/58d7aeb7d79ff522105aca2d71b7fc84991a04cd,58d7aeb7d79ff522105aca2d71b7fc84991a04cd,try open jdk 11 in travis
Ingo60,2019-09-05 17:35:03,https://api.github.com/repos/Frege/frege/git/commits/dbca15f6d47dc487bccf0a547638a30b1d7a7045,dbca15f6d47dc487bccf0a547638a30b1d7a7045,Merge branch 'master' of https://github.com/Frege/frege
Ingo60,2019-09-05 17:33:53,https://api.github.com/repos/Frege/frege/git/commits/94a2ce4e977c8b57574e7e3e9907bbb64abd7c39,94a2ce4e977c8b57574e7e3e9907bbb64abd7c39,try open jdk in travis
badbadboy,2019-09-04 20:27:57,https://api.github.com/repos/Frege/frege/git/commits/cf794ecc7d6d9f52c39df52e30d54939cc9ab225,cf794ecc7d6d9f52c39df52e30d54939cc9ab225,"Use Haskell definition of sconcat, using NonEmpty. Fixes #378."
badbadboy,2019-09-04 18:44:20,https://api.github.com/repos/Frege/frege/git/commits/d52a08190f32bbe007ec527afb09d0b94c1a1e59,d52a08190f32bbe007ec527afb09d0b94c1a1e59,Improved naming
badbadboy,2019-09-04 18:28:58,https://api.github.com/repos/Frege/frege/git/commits/cbb0f1aefe8f7ed26982f3988eb973d6414c1a74,cbb0f1aefe8f7ed26982f3988eb973d6414c1a74,Use Haskell definition of traverse that does not need unsafeToNonEmpty
badbadboy,2019-09-04 18:11:34,https://api.github.com/repos/Frege/frege/git/commits/03f34dff8d3aeb8c534fb5a02063981ea15cef68,03f34dff8d3aeb8c534fb5a02063981ea15cef68,Made NonEmpty instance of ListSemigroup instead of ListMonoid
Dierk,2019-07-15 19:56:53,https://api.github.com/repos/Frege/frege/git/commits/991e20f23d7e2639acf9edf9b7f1050b40681428,991e20f23d7e2639acf9edf9b7f1050b40681428,"include a note about the online REPL

the online repl is temporarily unavailable"
Ingo60,2019-03-29 07:07:01,https://api.github.com/repos/Frege/frege/git/commits/a3c14fc5fc1292b1dc6ed852f586a8b3ea34d41b,a3c14fc5fc1292b1dc6ed852f586a8b3ea34d41b,Hopefully correct URL at last
Ingo60,2019-03-29 07:01:16,https://api.github.com/repos/Frege/frege/git/commits/ef907ca24089e19aec0167b163ff869d27eaad0d,ef907ca24089e19aec0167b163ff869d27eaad0d,compiler too old to do the job
Ingo60,2019-03-16 16:36:53,https://api.github.com/repos/Frege/frege/git/commits/b240ef99b603dfd090e062031d7d956b04597d64,b240ef99b603dfd090e062031d7d956b04597d64,field access in product types can be stricter
Ingo60,2019-02-22 23:08:27,https://api.github.com/repos/Frege/frege/git/commits/f6f66bb730068fb19c120e27585aa0fb67a29c82,f6f66bb730068fb19c120e27585aa0fb67a29c82,"add second form of poll with timeout, use as MVar.wait millis"
Ingo60,2019-02-17 11:27:29,https://api.github.com/repos/Frege/frege/git/commits/847e560567ebb9947beae617092b1d8469ab4413,847e560567ebb9947beae617092b1d8469ab4413,avoid introducing CASE through newtype pattern matches in inlining
Ingo60,2019-02-17 09:58:22,https://api.github.com/repos/Frege/frege/git/commits/e3f77afce41aa6efb4385553b3610f3f3618b4c1,e3f77afce41aa6efb4385553b3610f3f3618b4c1,inline all BitSet operations that map directly to one or two Java operations
Ingo60,2019-01-20 22:59:11,https://api.github.com/repos/Frege/frege/git/commits/2bf263ca616ffe6c4629d228665d88b827596845,2bf263ca616ffe6c4629d228665d88b827596845,"Merge pull request #373 from matil019/relax-jarray-constraint

Relax JArray constraints and add more consistent interface"
matil019,2019-01-15 15:41:45,https://api.github.com/repos/Frege/frege/git/commits/93510fa4044d2d2b40cb489fcd533124f53468bc,93510fa4044d2d2b40cb489fcd533124f53468bc,Make sure that genericFromIndexList ignores negative indexes
matil019,2019-01-15 06:29:37,https://api.github.com/repos/Frege/frege/git/commits/21d12ae7eefc7463829bbc9ad848fad0ac3d15c0,21d12ae7eefc7463829bbc9ad848fad0ac3d15c0,"Update the tests

Updated tests for the modified functions and new functions.
Made sure the functions don't require ArrayElement."
matil019,2019-01-15 06:09:39,https://api.github.com/repos/Frege/frege/git/commits/c7936024af16ef1598ec19b957b7870befae07b8,c7936024af16ef1598ec19b957b7870befae07b8,"Add JArray.genericFromMaybeList and genericFromIndexListLength

Found useful when writing tests"
matil019,2019-01-15 06:08:57,https://api.github.com/repos/Frege/frege/git/commits/e5cb7089793cc754cae2388387be698b539ec415,e5cb7089793cc754cae2388387be698b539ec415,"Reorder the arguments of JArray's methods

So that 'ArrayOf s a' can be used as a ""receiver""."
matil019,2019-01-14 03:00:52,https://api.github.com/repos/Frege/frege/git/commits/9684297d0c8930b2b9b8c7cbb4f333150a7a0fd2,9684297d0c8930b2b9b8c7cbb4f333150a7a0fd2,Update the comments
matil019,2019-01-14 02:54:37,https://api.github.com/repos/Frege/frege/git/commits/f13325bd52d44d58e22121d0e05ee5bc86e5acf6,f13325bd52d44d58e22121d0e05ee5bc86e5acf6,"Revise the other members of JArray

Added genericModifyAt, genericModifyElemAt, genericModifyElem and
genericFoldElem.
Modified genericModify and genericFold to work with non-nulls.

None of the functions require ArrayElement or JavaType."
matil019,2019-01-13 10:35:15,https://api.github.com/repos/Frege/frege/git/commits/528bf6840069fa5cd6ee3fb0345d4c09646955be,528bf6840069fa5cd6ee3fb0345d4c09646955be,Modify JArray.genericFromList not to require ArrayElement
matil019,2019-01-14 15:04:44,https://api.github.com/repos/Frege/frege/git/commits/21f414d21255d9fc4618c79be745d0c46bdeb15d,21f414d21255d9fc4618c79be745d0c46bdeb15d,Add property tests to test the functions before modifying them
Ingo60,2019-01-13 22:24:56,https://api.github.com/repos/Frege/frege/git/commits/5a34b1f57c5f3d28f56d13f61a226e41c720b9d4,5a34b1f57c5f3d28f56d13f61a226e41c720b9d4,"Merge pull request #372 from matil019/hashmap-instance-show

Modify instance Show HashMap not to depend on ToJSON"
matil019,2019-01-13 10:16:17,https://api.github.com/repos/Frege/frege/git/commits/6b784bf856320756f7e689f5e85baf05673fc358,6b784bf856320756f7e689f5e85baf05673fc358,"Modify instance Show HashMap not to depend on ToJSON

The shown string will have prefix ""fromList"", just like Haskell's one
does."
Ingo60,2018-12-08 12:45:54,https://api.github.com/repos/Frege/frege/git/commits/a58f84918b4ac099382aed088066801c3091d5cd,a58f84918b4ac099382aed088066801c3091d5cd,"Merge pull request #370 from josephcsible/patch-1

The first value of iterate is before the function is called"
josephcsible,2018-12-03 15:58:44,https://api.github.com/repos/Frege/frege/git/commits/bbb75a4ba06e94fd424471afac2f11ac31899641,bbb75a4ba06e94fd424471afac2f11ac31899641,The first value of iterate is before the function is called
Dierk,2018-11-09 15:10:49,https://api.github.com/repos/Frege/frege/git/commits/f59c47f7d6a0201df64874534389f2054eaced81,f59c47f7d6a0201df64874534389f2054eaced81,add haskellbook Frege examples to the home page
Dierk,2018-11-09 15:07:02,https://api.github.com/repos/Frege/frege/git/commits/b9b58be2640877345822a9883f32b7b485b426ba,b9b58be2640877345822a9883f32b7b485b426ba,add gitter channel to home page
Ingo60,2018-09-28 22:37:42,https://api.github.com/repos/Frege/frege/git/commits/f3ed06e634609f8c086571c75b3812a739f34279,f3ed06e634609f8c086571c75b3812a739f34279,"Merge pull request #369 from matil019/st-io-stream

Change Input/OutputStream and ""finally"" to ST"
Dierk,2018-09-24 19:46:55,https://api.github.com/repos/Frege/frege/git/commits/0448f3fdbbc1bd5a541e7aedcd5fd7c30d25fe85,0448f3fdbbc1bd5a541e7aedcd5fd7c30d25fe85,added conduit to the related projects
matil019,2018-09-21 15:45:26,https://api.github.com/repos/Frege/frege/git/commits/3753292bd5ce4a7b40befc7bb05b8a18bf080e0a,3753292bd5ce4a7b40befc7bb05b8a18bf080e0a,"Remove the description of ""mutable only"" types

because it no longer exists in the syntax."
matil019,2018-09-21 15:44:03,https://api.github.com/repos/Frege/frege/git/commits/d931034c94318813519a03c8ffdd5b1e04e7b188,d931034c94318813519a03c8ffdd5b1e04e7b188,Change PreludeIO.finally to work in ST monads
matil019,2018-09-21 15:39:18,https://api.github.com/repos/Frege/frege/git/commits/2b4949816472f2daab7e96ac0937bddd0eb6a719,2b4949816472f2daab7e96ac0937bddd0eb6a719,Add more native methods to the super classes in java.IO
matil019,2018-09-21 15:38:34,https://api.github.com/repos/Frege/frege/git/commits/ba7fb974affa0915335d8b39f012f2f68cc810d7,ba7fb974affa0915335d8b39f012f2f68cc810d7,"Change the members of the super classes in java.IO from IO to ST

where applicable."
Ingo60,2018-09-22 12:43:40,https://api.github.com/repos/Frege/frege/git/commits/168051195940204c281049a915b9be8d5dcafb2a,168051195940204c281049a915b9be8d5dcafb2a,"source for jline library, in case someone needs to download it"
Ingo60,2018-09-22 12:41:23,https://api.github.com/repos/Frege/frege/git/commits/b0f7356977fed83739ce22621b1dbd11320757d8,b0f7356977fed83739ce22621b1dbd11320757d8,use jline-2.14.6 for avoiding Ubuntu ionic bug
Ingo60,2018-09-22 10:33:47,https://api.github.com/repos/Frege/frege/git/commits/68d48a0db00f09bf48dae8155a5ee94bd18db444,68d48a0db00f09bf48dae8155a5ee94bd18db444,"Merge pull request #368 from Frege/pure-file

Change the native type File to pure native"
matil019,2018-09-21 16:16:20,https://api.github.com/repos/Frege/frege/git/commits/5600419251b0acfa8858b9725cbec7adbbc8130e,5600419251b0acfa8858b9725cbec7adbbc8130e,Fix the regression test
matil019,2018-09-21 14:42:33,https://api.github.com/repos/Frege/frege/git/commits/5c0b13c803f06ea587d2e7ede8ebab543e736817,5c0b13c803f06ea587d2e7ede8ebab543e736817,Change the native type File to pure native
Ingo60,2018-05-27 12:22:39,https://api.github.com/repos/Frege/frege/git/commits/028344b440eb6ae100010b9ce731da19a645f80d,028344b440eb6ae100010b9ce731da19a645f80d,Update README.md
Ingo60,2018-05-17 19:19:40,https://api.github.com/repos/Frege/frege/git/commits/d384bdf32152676e40955fde73b7e407c24a28d7,d384bdf32152676e40955fde73b7e407c24a28d7,don't zonk too early lest generic tyvars get lost. Fix #362
Ingo60,2018-05-17 19:18:49,https://api.github.com/repos/Frege/frege/git/commits/46932e5b47342e06fcf3940bf7562767cbf3ea6b,46932e5b47342e06fcf3940bf7562767cbf3ea6b,make a deep reduce in reducedTau as advertised
Ingo60,2018-05-17 19:17:23,https://api.github.com/repos/Frege/frege/git/commits/0affae5827ec6cb2de20ea650fe927082baee0d4,0affae5827ec6cb2de20ea650fe927082baee0d4,test case for #362
Ingo60,2018-05-13 09:13:12,https://api.github.com/repos/Frege/frege/git/commits/1a7c8c80c3283f4a7c2d3f0caba3bf924a632e75,1a7c8c80c3283f4a7c2d3f0caba3bf924a632e75,document previous vs. actual behaviour better
Ingo60,2018-05-13 08:24:20,https://api.github.com/repos/Frege/frege/git/commits/b703982d4851d2556f709c7c68a8062515d2069c,b703982d4851d2556f709c7c68a8062515d2069c,cover cases where x.m can only be resolved after some overload resolution and remove warning
Ingo60,2018-05-13 08:19:18,https://api.github.com/repos/Frege/frege/git/commits/cc67578e06d76074d6db0c321759e8d04114fe6e,cc67578e06d76074d6db0c321759e8d04114fe6e,cover cases where x.m can only be resolved after some overload resolution
Ingo60,2018-05-13 08:17:50,https://api.github.com/repos/Frege/frege/git/commits/74b60f8310a070243dc767ecc439cfb6adee0517,74b60f8310a070243dc767ecc439cfb6adee0517,test case for difficult TDNR that depends on overload resolution
Ingo60,2018-05-11 11:55:52,https://api.github.com/repos/Frege/frege/git/commits/eeb629a4b7db1232f8287b08c89005ea936311cc,eeb629a4b7db1232f8287b08c89005ea936311cc,forbid 'data Foo = mutable native Bar ...' syntax
Ingo60,2018-05-11 11:04:25,https://api.github.com/repos/Frege/frege/git/commits/1339154a27a6c1ea9845899716c8576693177ffe,1339154a27a6c1ea9845899716c8576693177ffe,remove unused import warning
Ingo60,2018-05-11 07:34:58,https://api.github.com/repos/Frege/frege/git/commits/262de1c4f2e4901b94d47f0a5f395f0506b0a73f,262de1c4f2e4901b94d47f0a5f395f0506b0a73f,simplify return kind checking
Ingo60,2018-05-11 07:34:21,https://api.github.com/repos/Frege/frege/git/commits/dd8edd6075961c5c0aab17a8e5bed7f0b70c1a5c,dd8edd6075961c5c0aab17a8e5bed7f0b70c1a5c,handle generic flexi types correctly in code generation
Ingo60,2018-05-10 17:08:25,https://api.github.com/repos/Frege/frege/git/commits/bd12988ab4cd46135cfb1757ac6488d267a68d76,bd12988ab4cd46135cfb1757ac6488d267a68d76,remove 3 flags from RFlag that are unused or have unclear semantics
Ingo60,2018-05-10 11:20:43,https://api.github.com/repos/Frege/frege/git/commits/1926a5e69ecd859a0ad01d85ef548357491f044f,1926a5e69ecd859a0ad01d85ef548357491f044f,fix #357
Ingo60,2018-05-10 11:20:09,https://api.github.com/repos/Frege/frege/git/commits/ed1d1be0300a821bea1278a3a7c8032c41f51784,ed1d1be0300a821bea1278a3a7c8032c41f51784,optimize mapMaybe manually lest it gets a layz return type
Ingo60,2018-05-10 10:13:12,https://api.github.com/repos/Frege/frege/git/commits/281407c7b3620149a3b5256c8141f674174c8965,281407c7b3620149a3b5256c8141f674174c8965,"if a tail call returns lazy, we must not evaluate it, but pass it on"
Ingo60,2018-05-10 08:44:48,https://api.github.com/repos/Frege/frege/git/commits/abc959b0dbde42cd3a6143a0e45f57644d72de57,abc959b0dbde42cd3a6143a0e45f57644d72de57,compile java deps only when needed and account for compilation status of java deps
Ingo60,2018-05-08 18:11:04,https://api.github.com/repos/Frege/frege/git/commits/12f4ecf4cf0231fc17e989386969b478563adfc4,12f4ecf4cf0231fc17e989386969b478563adfc4,non-verbose mode when making regression
Ingo60,2018-05-08 18:10:00,https://api.github.com/repos/Frege/frege/git/commits/968d26c8f9a5d356c48aa1626ea36d8c73b4f419,968d26c8f9a5d356c48aa1626ea36d8c73b4f419,don't recompile (library) sources whose up-to-date class files are not in the target directory
Ingo60,2018-05-06 12:39:40,https://api.github.com/repos/Frege/frege/git/commits/07b2914728282fb47f74c7418a09b8c963e47a8e,07b2914728282fb47f74c7418a09b8c963e47a8e,don't generate unneeded classes and local variables
Ingo60,2018-05-06 10:52:12,https://api.github.com/repos/Frege/frege/git/commits/4cdb95a8b0162947dfc0ce35485d2b6cdf63708c,4cdb95a8b0162947dfc0ce35485d2b6cdf63708c,remove sample/ POC subdirectory from master
Ingo60,2018-05-04 20:09:54,https://api.github.com/repos/Frege/frege/git/commits/2a9f201d590f30fdae0009664f3cc1cbf2cefa7b,2a9f201d590f30fdae0009664f3cc1cbf2cefa7b,"Merge pull request #361 from matil019/implement-interface

PoC: Implement Java pure interface with Frege record"
matil019,2018-05-04 03:00:07,https://api.github.com/repos/Frege/frege/git/commits/0ae720436b31452ee2497e070e1d13db872af8bc,0ae720436b31452ee2497e070e1d13db872af8bc,"Detect strictness of arguments so that they can be wrapped in lazy()

The code was refactored so that I can understand"
matil019,2018-05-04 02:08:14,https://api.github.com/repos/Frege/frege/git/commits/25e0a47169445973d8a4ab25942c6d106ec5a2d8,25e0a47169445973d8a4ab25942c6d106ec5a2d8,[nomerge] Add overloaded methods
matil019,2018-05-04 02:06:26,https://api.github.com/repos/Frege/frege/git/commits/2bf196670cedc22e4d2ee9a4b4accb39b7240231,2bf196670cedc22e4d2ee9a4b4accb39b7240231,Call methods with arguments
matil019,2018-05-04 01:24:14,https://api.github.com/repos/Frege/frege/git/commits/ca1de78dc4d881bc77005f6d6ed422f5e4bc49b7,ca1de78dc4d881bc77005f6d6ed422f5e4bc49b7,[nomerge] Add a method that takes parameters
matil019,2018-05-04 01:20:31,https://api.github.com/repos/Frege/frege/git/commits/59833451972550d4281105a808cb4ebe05692040,59833451972550d4281105a808cb4ebe05692040,Use return types of native members
matil019,2018-05-04 01:00:30,https://api.github.com/repos/Frege/frege/git/commits/d55b6ecd309d0b57797fa06982d7af0b32ee1d3d,d55b6ecd309d0b57797fa06982d7af0b32ee1d3d,[nomerge] Add a non-int-returning method
matil019,2018-05-04 00:58:59,https://api.github.com/repos/Frege/frege/git/commits/7b6485471038c06051a74939a499f2e9659b5a19,7b6485471038c06051a74939a499f2e9659b5a19,Call native names to work with aliased members
matil019,2018-05-04 00:27:54,https://api.github.com/repos/Frege/frege/git/commits/785534b3dadcafd0d412f95c28d8781263478852,785534b3dadcafd0d412f95c28d8781263478852,[nomerge] Add aliasing case
matil019,2018-05-04 00:18:39,https://api.github.com/repos/Frege/frege/git/commits/242c0a157ad3de2a2310495c417a55e819effaab,242c0a157ad3de2a2310495c417a55e819effaab,Iterate over fields
matil019,2018-05-03 15:57:06,https://api.github.com/repos/Frege/frege/git/commits/e3954acc66855e0d68eeffdc737640d96b4b7c6d,e3954acc66855e0d68eeffdc737640d96b4b7c6d,Rename NINewClass to NIExtends
matil019,2018-05-03 15:55:32,https://api.github.com/repos/Frege/frege/git/commits/d67adba6aaf53b992da907995e7e7ea6004afc9a,d67adba6aaf53b992da907995e7e7ea6004afc9a,Obtain the record field name
matil019,2018-05-03 15:55:09,https://api.github.com/repos/Frege/frege/git/commits/61c9403e77e517111abe9e5e85996e446da2a827,61c9403e77e517111abe9e5e85996e446da2a827,Obtain the Java class of the record type
matil019,2018-05-03 13:47:27,https://api.github.com/repos/Frege/frege/git/commits/8283d58c2997c06615c79f209f04580a9dabda19,8283d58c2997c06615c79f209f04580a9dabda19,"Use the ""receiver"" parameter"
matil019,2018-01-31 21:38:24,https://api.github.com/repos/Frege/frege/git/commits/97136a3acef83f394bc5675876c13a90f2e31619,97136a3acef83f394bc5675876c13a90f2e31619,Make the compiled code work
matil019,2018-01-21 18:39:36,https://api.github.com/repos/Frege/frege/git/commits/434f37c6d3bedde45350681ab54d15a0b6939dc8,434f37c6d3bedde45350681ab54d15a0b6939dc8,[nomerge] Add a sample program to test the new feature
matil019,2018-01-29 12:39:02,https://api.github.com/repos/Frege/frege/git/commits/fccbd05115b6cb42ec539cd9daf005ca583dd05a,fccbd05115b6cb42ec539cd9daf005ca583dd05a,"Add native _ ""extends"", generate dummy code

TODO consider non-exhaustive pattern matches"
Ingo60,2018-05-03 19:25:02,https://api.github.com/repos/Frege/frege/git/commits/e66eab7c569432cd07eb318525ccedeed01dbc54,e66eab7c569432cd07eb318525ccedeed01dbc54,"RM already has -rf, and separate JAVAC compilation of dependencies is not needed anymore."
Ingo60,2018-05-03 16:52:44,https://api.github.com/repos/Frege/frege/git/commits/bfa7f59aee556f9b331489ae48e4593a44ac4841,bfa7f59aee556f9b331489ae48e4593a44ac4841,"Merge pull request #359 from matil019/regression-dir

Compile regression tests in a dedicated directory"
matil019,2018-05-03 01:50:14,https://api.github.com/repos/Frege/frege/git/commits/589a4c17e8264ec4fa4bfc75381ad2aac364bc8e,589a4c17e8264ec4fa4bfc75381ad2aac364bc8e,"Compile regression tests in a dedicated directory

`make regression` re-compiles some classes for example
`frege/runtime/Meta.class`.
Since in the `regression` target `-target` is not specified to
fregec/javac, the classes are replaced with version 53.0 i.e. Java9
class files.

This commit avoids it by using a dedicated directory for the regression
tests."
Ingo60,2018-05-01 19:17:20,https://api.github.com/repos/Frege/frege/git/commits/59ab5d59e08e7db8ee45e1fbe96a4bb37725e36c,59ab5d59e08e7db8ee45e1fbe96a4bb37725e36c,compile REPL with the java used for everything else - contributors must use JDKs with JavaFX
Ingo60,2018-05-01 19:16:12,https://api.github.com/repos/Frege/frege/git/commits/7deb59b0c5c084e4a2b23303bf1202d635de6a2f,7deb59b0c5c084e4a2b23303bf1202d635de6a2f,fix unreachable case alternative warning
Ingo60,2018-05-01 07:25:34,https://api.github.com/repos/Frege/frege/git/commits/6f01376fc10e151a3c1bbcc46a613f52aa762494,6f01376fc10e151a3c1bbcc46a613f52aa762494,fix #358
Ingo60,2018-04-30 17:15:18,https://api.github.com/repos/Frege/frege/git/commits/1a531d0ba9bb902dfdc90c2c2ee786fccc1d925f,1a531d0ba9bb902dfdc90c2c2ee786fccc1d925f,generate names with uppercase ASCII suffix for overloaded methods
Ingo60,2018-04-29 11:44:13,https://api.github.com/repos/Frege/frege/git/commits/da59a36383254b74537440fd77a9e777519dd532,da59a36383254b74537440fd77a9e777519dd532,"remove 'mutable' from all types in frege.java.Util
This also concludes the refactoring of 'mutable'.
From this commit on, there are no 'mutable native' types
anymore in the Frege codebase, the Frege interpreter and repl."
Ingo60,2018-04-29 11:19:00,https://api.github.com/repos/Frege/frege/git/commits/3e43f6d3e05063e4a49a765a65b62765c9af5c67,3e43f6d3e05063e4a49a765a65b62765c9af5c67,remove 'mutable' from all types in frege.java.lang.Processes
Ingo60,2018-04-29 10:47:10,https://api.github.com/repos/Frege/frege/git/commits/5608e8b47ca5355faa4efa013b6b4f0fdd9ee43d,5608e8b47ca5355faa4efa013b6b4f0fdd9ee43d,remove 'mutable' from all types in frege.java.Net
Ingo60,2018-04-29 10:35:15,https://api.github.com/repos/Frege/frege/git/commits/fcec1c9ab3433edf58766e7aefeffd0de6fb1c42,fcec1c9ab3433edf58766e7aefeffd0de6fb1c42,remove 'mutable' from all types in frege.java.Lang
Ingo60,2018-04-28 17:22:18,https://api.github.com/repos/Frege/frege/git/commits/52987b4c7b87c5d0cdc01f6b870a5d838593368d,52987b4c7b87c5d0cdc01f6b870a5d838593368d,remove 'mutable' from all classes in frege.java.IO
Ingo60,2018-04-28 05:23:37,https://api.github.com/repos/Frege/frege/git/commits/d15a715af1e8107e0e174d7ca61a31a398951317,d15a715af1e8107e0e174d7ca61a31a398951317,remove 'mutable' from GroupLayout
Ingo60,2018-04-28 05:15:45,https://api.github.com/repos/Frege/frege/git/commits/355b6417f8d3cd90b1dd0acf1d21d20a2bacbc7c,355b6417f8d3cd90b1dd0acf1d21d20a2bacbc7c,remove 'mutable' from concurrent things
Ingo60,2018-04-28 05:00:14,https://api.github.com/repos/Frege/frege/git/commits/7c9fa09b0c1c3f36362f29df912ad7f89ddee4b8,7c9fa09b0c1c3f36362f29df912ad7f89ddee4b8,removed 'mutable' from AWT/Swing things
Ingo60,2018-04-28 04:25:21,https://api.github.com/repos/Frege/frege/git/commits/a34277b5c31adf9415ac2bde1b4ec954f474b19a,a34277b5c31adf9415ac2bde1b4ec954f474b19a,remove 'mutable' on OutputStreams
Ingo60,2018-04-28 03:44:31,https://api.github.com/repos/Frege/frege/git/commits/9814678aee8dda7678553d72a0f85a775f2875f2,9814678aee8dda7678553d72a0f85a775f2875f2,From here on work on 3.25
Ingo60,2018-04-27 21:33:51,https://api.github.com/repos/Frege/frege/git/commits/74abf7f7695b1444d3615969338ef4ee5476f4e2,74abf7f7695b1444d3615969338ef4ee5476f4e2,warn against 'mutable native' definitions (cleanup of the standard library follows)
Ingo60,2018-04-26 18:30:14,https://api.github.com/repos/Frege/frege/git/commits/252c5ce22aca61f4a4ab46e77cc1971f08085653,252c5ce22aca61f4a4ab46e77cc1971f08085653,more tests
Ingo60,2018-04-26 18:30:01,https://api.github.com/repos/Frege/frege/git/commits/5530ecc63bacbec78f2b4189455494b8df2dfb4d,5530ecc63bacbec78f2b4189455494b8df2dfb4d,increased precision of reciprocal
Ingo60,2018-04-22 20:53:02,https://api.github.com/repos/Frege/frege/git/commits/63b6cce26d868aafcfccb9c0fbc0228a051c96fd,63b6cce26d868aafcfccb9c0fbc0228a051c96fd,"more tests, enhanced accuracy"
Ingo60,2018-04-21 14:56:05,https://api.github.com/repos/Frege/frege/git/commits/bc10be90a8844d0276d9075412c314b906123342,bc10be90a8844d0276d9075412c314b906123342,p_negate doesn't hold when the coefficient is 'Decimal.minCoefficient'
Ingo60,2018-04-21 09:41:51,https://api.github.com/repos/Frege/frege/git/commits/72e023d4501a932021483159094e17598490c864,72e023d4501a932021483159094e17598490c864,make super and extends keywords
Ingo60,2018-04-21 09:41:32,https://api.github.com/repos/Frege/frege/git/commits/78e130a8fc599bd5233dc0ffaa4bdeb513528202,78e130a8fc599bd5233dc0ffaa4bdeb513528202,"support 'extends A, B, C'"
Ingo60,2018-04-21 09:38:39,https://api.github.com/repos/Frege/frege/git/commits/031a8eaac4788a30e62b749b20260a82ce14fd34,031a8eaac4788a30e62b749b20260a82ce14fd34,give regression test for #355 a main
Ingo60,2018-04-21 09:37:28,https://api.github.com/repos/Frege/frege/git/commits/9879ce2796deaad70891ed7adc2517a29d662e70,9879ce2796deaad70891ed7adc2517a29d662e70,add Dec64 to the standard library
Ingo60,2018-04-21 07:36:51,https://api.github.com/repos/Frege/frege/git/commits/81123e7b1f0caf56cc0264650d2abd7d80106a45,81123e7b1f0caf56cc0264650d2abd7d80106a45,improve reciprocal
Ingo60,2018-04-19 19:02:17,https://api.github.com/repos/Frege/frege/git/commits/bc33df3614af0f102b9ae6fd5677919270b7e280,bc33df3614af0f102b9ae6fd5677919270b7e280,"reciprocal, but still multiplication errors  9999999999999999z * 9679576963768376z = NaN?"
Ingo60,2018-04-14 15:56:35,https://api.github.com/repos/Frege/frege/git/commits/9545adf9c051c647f80a4c2ccfcc22680a2fb266,9545adf9c051c647f80a4c2ccfcc22680a2fb266,fix #355
Ingo60,2018-04-12 20:11:33,https://api.github.com/repos/Frege/frege/git/commits/7afcb9a15170166a27f63006c1292e048b369047,7afcb9a15170166a27f63006c1292e048b369047,more multiplication
Ingo60,2018-04-10 18:08:27,https://api.github.com/repos/Frege/frege/git/commits/5290712ace2b6a83cd7e38a5f8f79ba219b44468,5290712ace2b6a83cd7e38a5f8f79ba219b44468,better error messages for guards
