samhed,2016-04-28 15:41:48,https://api.github.com/repos/novnc/noVNC/git/commits/32df3fdbe1b289b06344902b72537d6dc3671afb,32df3fdbe1b289b06344902b72537d6dc3671afb,Add a threshold for viewport dragging (#600)
jp-bennett,2016-04-28 11:46:40,https://api.github.com/repos/novnc/noVNC/git/commits/27e77d468f041e91c717be37d48242d392e2a81a,27e77d468f041e91c717be37d48242d392e2a81a,Adds tap-to-click in viewport drag mode (#600)
samhed,2016-04-25 14:38:23,https://api.github.com/repos/novnc/noVNC/git/commits/f620259bc59dc18e91653918cdb513626a3af8dd,f620259bc59dc18e91653918cdb513626a3af8dd,Force clipping mode in Safari on all platforms
samhed,2016-04-25 14:35:49,https://api.github.com/repos/novnc/noVNC/git/commits/529c64e1036b622ff971b1a0cd13856837d3a9eb,529c64e1036b622ff971b1a0cd13856837d3a9eb,Re-arrange global UI variables
DirectXMan12,2016-04-13 19:02:48,https://api.github.com/repos/novnc/noVNC/git/commits/8b0a0f6637fbc5102da64e26ccaa52de8df7186c,8b0a0f6637fbc5102da64e26ccaa52de8df7186c,"Merge pull request #602 from oneru/typo-fix

Adds missed line from PR 597"
jp-bennett,2016-04-13 17:53:37,https://api.github.com/repos/novnc/noVNC/git/commits/3c9558444cf2fe76175b47a27cb9cbae3d6900f7,3c9558444cf2fe76175b47a27cb9cbae3d6900f7,Adds missed line from PR 597
DirectXMan12,2016-04-12 21:32:43,https://api.github.com/repos/novnc/noVNC/git/commits/bf0ce0ba3c6854372ba574b5521b1555baf610a2,bf0ce0ba3c6854372ba574b5521b1555baf610a2,"Merge pull request #597 from oneru/master

Handle missing leading slash in elem.pathname"
jp-bennett,2016-04-11 18:01:28,https://api.github.com/repos/novnc/noVNC/git/commits/c8294760b12fe5231e0c56b8ed1dc88d29668d57,c8294760b12fe5231e0c56b8ed1dc88d29668d57,"Handle missing leading slash in elem.pathname

IE11 with compat mode turned off has been observed displaying this behavior.  This commit checks for and corrects this broken behavior.

Fixes #591"
WardF,2016-04-11 20:42:42,https://api.github.com/repos/novnc/noVNC/git/commits/27a1f6cb9505171fef9f604941bf54a2e1f0abcb,27a1f6cb9505171fef9f604941bf54a2e1f0abcb,Tweaked message printed based on whether or not http is available.
WardF,2016-04-11 20:32:14,https://api.github.com/repos/novnc/noVNC/git/commits/c77d9fcc4e752047388a404d7eeed6db6af39b2a,c77d9fcc4e752047388a404d7eeed6db6af39b2a,"Added an '--ssl-only' option to noVNC launch script.  This will pass through to Websockify, allowing a user to specify that only ssl-secured connections will be allowed."
DirectXMan12,2016-02-24 21:52:55,https://api.github.com/repos/novnc/noVNC/git/commits/b403cb92fb8de82d04f305b4f14fa978003890d7,b403cb92fb8de82d04f305b4f14fa978003890d7,"Merge pull request #582 from kanaka/bug/render-queue-corruption

Make sure to copy arrays when using render queue"
DirectXMan12,2016-02-24 20:59:58,https://api.github.com/repos/novnc/noVNC/git/commits/7bc383e8b6f6da10cb3f335123fe561674a6723d,7bc383e8b6f6da10cb3f335123fe561674a6723d,"Make sure to copy arrays when using render queue

This commit ensures that input arrays are copied to new storage when
they are pushed onto the render queue.  This ensures that they are
not overwritten before they are eventually used.

Fixes #571"
tghw,2016-01-23 00:16:01,https://api.github.com/repos/novnc/noVNC/git/commits/a4ffd2d49ae7c4d364a43b2a4e6161efdc3f84a2,a4ffd2d49ae7c4d364a43b2a4e6161efdc3f84a2,"Map Util.[Debug|Info|Warn|Error] to console.[debug|info|warn|error].

This change will preserve file and line number reporting when Util.[Debug|Info|Warn|Error] is called, which should make development and debugging a lot easier."
DirectXMan12,2016-01-06 21:01:50,https://api.github.com/repos/novnc/noVNC/git/commits/670dbddb54264fd0082d0aca1b3acb0f1814b1d2,670dbddb54264fd0082d0aca1b3acb0f1814b1d2,"Merge pull request #568 from kanaka/refactor/remove-refs-to-jsunzip

Cleanup/fixup unused code

Remove jsunzip, remove unused vars, fix vnc_perf.html"
DirectXMan12,2016-01-06 20:57:04,https://api.github.com/repos/novnc/noVNC/git/commits/317042f8dbabd39e9b4244a3d8c4295e8770f1a7,317042f8dbabd39e9b4244a3d8c4295e8770f1a7,"Merge branch 'feature/token-in-url'

Injects token into the path element if it's passed to
the noVNC page.

Closes #537
Fixes #536"
DirectXMan12,2016-01-06 19:22:24,https://api.github.com/repos/novnc/noVNC/git/commits/28646d978fc5e0bcfdedabf25ddbc9e81ee6746c,28646d978fc5e0bcfdedabf25ddbc9e81ee6746c,"Merge pull request #547 from pigshell/hashargs

Add hash fragment as an optional method to supply config variables.

Closes #544"
DirectXMan12,2016-01-06 18:26:26,https://api.github.com/repos/novnc/noVNC/git/commits/4ee55e01266769ea0711f74464162ba190a7e3a9,4ee55e01266769ea0711f74464162ba190a7e3a9,"Fixed vnc_perf.html

This commit updates vnc_perf.html so that it works with the current
version of noVNC.  It also introduces a utility to convert noVNC session
recordings recorded in base64-mode to binary-mode recordings, since noVNC
no longer supports base64-mode.

Fixes #479."
DirectXMan12,2016-01-06 16:18:47,https://api.github.com/repos/novnc/noVNC/git/commits/464944844f039eea05fa19b0d1747d7ac28c4ac3,464944844f039eea05fa19b0d1747d7ac28c4ac3,"Remove unused variables in the TIGHT server init

This commit removes some unused variables in the TIGHT server init
section of the server init handler, replacing them with documenting
comments and calls to rQskipBytes.

Fixes #440."
DirectXMan12,2016-01-06 16:09:34,https://api.github.com/repos/novnc/noVNC/git/commits/0252c7f7664b5c8848aecd55b14f743122656a92,0252c7f7664b5c8848aecd55b14f743122656a92,"Remove remaining references to jsunzip.js

This commit removes remaining references to jsunzip.js,
which is no longer actually used in noVNC.

Closes #436."
DirectXMan12,2016-01-05 19:28:01,https://api.github.com/repos/novnc/noVNC/git/commits/7e4475fa928f810b4df30dfe4c8a5ecf753f839c,7e4475fa928f810b4df30dfe4c8a5ecf753f839c,"Merge pull request #565 from kanaka/bug/dynamic-rq-resize

Resize Receive Queue to Fit Incoming Messages"
DirectXMan12,2015-12-04 02:30:47,https://api.github.com/repos/novnc/noVNC/git/commits/40037b6a29d3f372b16073f7b2d06850c32a1cd9,40037b6a29d3f372b16073f7b2d06850c32a1cd9,"On-Demand Dynamic Receive Queue Resizing

This commit causes the receive queue to dynamically
resize to fit incoming messages.

Fixes #557"
DirectXMan12,2015-12-22 18:51:30,https://api.github.com/repos/novnc/noVNC/git/commits/c8f14d175bbfe00f69fde268bd10de2b80a089d9,c8f14d175bbfe00f69fde268bd10de2b80a089d9,"Disable copyWithin Use in Websock.js

the `copyWithin` function of typed arrays has performance issues
in some versions of Chromium, and doesn't doesn't have enough
of a performance impact to justify leaving it enabled."
kanaka,2015-11-24 03:32:31,https://api.github.com/repos/novnc/noVNC/git/commits/b2a813dc739c8b41dd647dc01c8f8f11d8996286,b2a813dc739c8b41dd647dc01c8f8f11d8996286,"Merge pull request #555 from maditnerd/patch-1

Small typo in launch.sh"
maditnerd,2015-11-23 12:08:05,https://api.github.com/repos/novnc/noVNC/git/commits/54e835eeac811ef826fea810378c7f1a98797a5d,54e835eeac811ef826fea810378c7f1a98797a5d,Small typo in launch.sh
ganeshv,2015-10-22 14:27:07,https://api.github.com/repos/novnc/noVNC/git/commits/494b407a0a54c43a395110f99141e8123c96e2a4,494b407a0a54c43a395110f99141e8123c96e2a4,"Add hash fragment as an optional method to supply config variables.

Any config variable like host, port, password, token may be
specified either in the query string (like now), or in the URL hash
fragment. In case a given variable is present in both, the value in the
fragment takes precedence. Supplying variables in the fragment avoids
leaking them to the web server hosting the noVNC viewer HTML."
DirectXMan12,2015-10-16 15:08:04,https://api.github.com/repos/novnc/noVNC/git/commits/6a90803feb124791960e3962e328aa3cfb729aeb,6a90803feb124791960e3962e328aa3cfb729aeb,"Merge pull request #543 from DvdGiessen/fix/vnc_sendpassword_auth

Fixes VNC standard auth using onPasswordRequired callback"
DvdGiessen,2015-10-16 14:38:35,https://api.github.com/repos/novnc/noVNC/git/commits/3e3df4dbb11b008d1a629dea1e576f976b4f8fe8,3e3df4dbb11b008d1a629dea1e576f976b4f8fe8,Added return to correctly wait for password input before proceeding. Fixes #542
DirectXMan12,2015-09-23 15:29:43,https://api.github.com/repos/novnc/noVNC/git/commits/a0e7ab43dca0ce11a713694ee4cf530bd3b17c5a,a0e7ab43dca0ce11a713694ee4cf530bd3b17c5a,"Merge pull request #532 from kanaka/bug/pako-issue

Make sure Pako always has enough room"
DirectXMan12,2015-09-22 20:19:52,https://api.github.com/repos/novnc/noVNC/git/commits/c802d9318930ab703d2a359dcf10fb5928f9029e,c802d9318930ab703d2a359dcf10fb5928f9029e,"Make sure Pako always has enough room

Previously, we used a fixed chunkSize of 100KiB for Pako's output
buffer.  Using a hardcoded size caused issues, since Pako would assume
we wanted to use multiple chunks, and we didn't deal with this.  Now,
`Inflator#inflate()` takes a new `expected` argument, which indicates
the expected output size.  If this is bigger than the current chunkSize,
Inflator allocates a new output buffer that's big enough to hold the
output.

Fixes #531"
samhed,2015-09-22 12:59:44,https://api.github.com/repos/novnc/noVNC/git/commits/045d922406678e0ea4167e09edabd89f25d3df0e,045d922406678e0ea4167e09edabd89f25d3df0e,"Moved resizeTimout to the UI object, no reason to have it outside anymore.."
DirectXMan12,2015-08-27 22:46:26,https://api.github.com/repos/novnc/noVNC/git/commits/40b35fa20d459c731a5de826f4bd17634101a1db,40b35fa20d459c731a5de826f4bd17634101a1db,"Merge pull request #524 from kanaka/bug/tight-buffer-overread

Fix buffer over-reads in handle_tight"
DirectXMan12,2015-08-26 18:28:10,https://api.github.com/repos/novnc/noVNC/git/commits/89bdc8ce488153ba3299695791d3d2309751e1e4,89bdc8ce488153ba3299695791d3d2309751e1e4,"Fix buffer over-reads in handle_tight

For performance reasons, the `handle_tight` function skips the
use of the receive queue API and uses the raw receive queue directly.
Because of the way that typed array receive queue gets reused, this
introduced the potential for buffer over-reads.

To address this, a new function, `rQwhole`, was introduced.
`rQwhole` simply returns a new view into the receive queue that
starts at 0 and ends at the current recorded end of the queue.

`handle_tight` now makes use of this function.

Fixes #522"
DirectXMan12,2015-08-24 23:34:30,https://api.github.com/repos/novnc/noVNC/git/commits/a369a80c2480af685b7bddacddae9cca3aea95f9,a369a80c2480af685b7bddacddae9cca3aea95f9,"Fix bug in non-true-color code

There was a bug caused by 38781d931ec18304f51ed3469faff8387e3cbc55
which prevented color map look-ups sent by rfb.js from working properly,
since display.js expected a single-item array, and rfb.js sent just them
item value itself (a number) instead.  This fixes that, and tweaks the
corresponding test to match that behavior."
DirectXMan12,2015-08-24 23:30:44,https://api.github.com/repos/novnc/noVNC/git/commits/bb180145c654c4bc1ab9eca15a7acaa494d9fa50,bb180145c654c4bc1ab9eca15a7acaa494d9fa50,"Tests: Fixed bug in displayed assertion

This `displayed` assertion had a bug that was causing it to not
actually check anything (it was using obj.length instead of
data_cl.length).  This fixes that."
DirectXMan12,2015-08-24 20:41:00,https://api.github.com/repos/novnc/noVNC/git/commits/340290fa1d6a53d30a38b6604bcacef5940c4c52,340290fa1d6a53d30a38b6604bcacef5940c4c52,"UI: Fix typo preventing reconnect after password

There was a typo in ui.js preventing the use of the connect button
after a password was entered."
DirectXMan12,2015-08-14 15:56:57,https://api.github.com/repos/novnc/noVNC/git/commits/abf2b09ea7ca59d006c250ea96c5f219f83ca7d0,abf2b09ea7ca59d006c250ea96c5f219f83ca7d0,"Merge pull request #488 from kanaka/feature/more-perf-improvements

Performance Improvements"
samhed,2015-08-14 15:02:00,https://api.github.com/repos/novnc/noVNC/git/commits/a825582196c69b5999032af00fd87590fc62fdc3,a825582196c69b5999032af00fd87590fc62fdc3,"Only work with integers when panning to avoid getting a blurry image.
Also disable image-smoothing to avoid bugs seen on Android which were
also causing a blurry image while panning."
DirectXMan12,2015-06-02 19:32:14,https://api.github.com/repos/novnc/noVNC/git/commits/f00193e08f7c55a7b0b55556ef96b10b41dd3bc3,f00193e08f7c55a7b0b55556ef96b10b41dd3bc3,"Skip unnecessary render queue object creation

This commit skips object creation for the render queue when not
needed.  Instead of pushing an object onto the queue, and then
immediately running the result, you call the function directly.
Then, if the render queue is not empty, an object is created and
pushed onto the queue.  Otherwise, the functionality is just run
directly."
DirectXMan12,2015-05-28 19:09:31,https://api.github.com/repos/novnc/noVNC/git/commits/b0b5fc55e1fe5c575855104e9ce6df79329a8db7,b0b5fc55e1fe5c575855104e9ce6df79329a8db7,"Fix multi-line assertion messages in test runner

This commit prevents multi-line error messages from being
truncated in the local test runner ('tests/run_from_console.js')."
DirectXMan12,2015-05-28 19:07:43,https://api.github.com/repos/novnc/noVNC/git/commits/07f514d887c27369f7675296a2cb1cb6d664cd91,07f514d887c27369f7675296a2cb1cb6d664cd91,"Allow the use of the PhantomJS remote debugger

This commit adds the '--debugger <port>' option, which triggers
the PhantomJS remote debugger.  The initial output of the terminal
when running the debugger gives more information on how to use
it."
DirectXMan12,2015-05-28 19:28:30,https://api.github.com/repos/novnc/noVNC/git/commits/9ff86fb718477515ede2d6457f06643935d76bcd,9ff86fb718477515ede2d6457f06643935d76bcd,"Use Typed Arrays for the send queue

This commit converts the send queue to use typed arrays, and converts
message creation functions in 'rfb.js' to create messages directly into
the socket's send queue.  This commit also removes the separate mouse array,
which is no longer needed."
DirectXMan12,2015-05-28 19:27:40,https://api.github.com/repos/novnc/noVNC/git/commits/d1800d0960ad9c3d2ff20c990f5886d2edf7f514,d1800d0960ad9c3d2ff20c990f5886d2edf7f514,"Avoid Creating Small Objects Frequently

Creating lots of small objects frequently can drastically decrease
performance.  This commit introduces three fixes which avoid this:

- Use a preallocated palette and indexed-to-rgb destination Typed Array
  (the destination typed array is currently allocated at `4 * width *
  height`).

- Inline `getTightCLength`, which returned a two-item array.

- Pass RGBX data directly in a Typed Array to the Display, which
  avoids an extra loop, and only creates a new Typed Array View,
  instead of a whole new ArrayBuffer."
DirectXMan12,2015-05-20 21:10:59,https://api.github.com/repos/novnc/noVNC/git/commits/38781d931ec18304f51ed3469faff8387e3cbc55,38781d931ec18304f51ed3469faff8387e3cbc55,"Use Typed Arrays for the Websock receive queue

**This commit removes Base64 (and Flash) support**

This commit converts websock.js to used Typed Arrays for the
receive queue (and tweaks rfb.js to ensure that it continues
to function, since only Firefox implements
`%TypedArray%.prototype.slice`).  Base64 support was removed
to simplify code paths, and pave the way for using Typed Arrays
for the send queue as well.

This provides two advantages: first, we allocate a buffer ahead
of time, meaning the browser doesn't have to do any work dynamically
increasing the receive queue size.  Secondly, we are now able to pass
around Typed Array Views (e.g. `Uint8Array`), which are lightweight, and
don't involve copying.

The downside is that we initially allocate more memory -- we currently
start out with 4 MiB, and then automatically double when it looks like
the amount unused is getting to small.

The commit also explicitly adds a check to the compacting logic that
avoids calling the copy functions if `_rQlen === _rQi`."
DirectXMan12,2015-05-19 20:49:39,https://api.github.com/repos/novnc/noVNC/git/commits/6c883653a23aec7220b7b8cd042c90554fcb28cc,6c883653a23aec7220b7b8cd042c90554fcb28cc,"Remove unecessarily nested loop

This commit removes a nested loop in indexedToRGB, converting it into a
plain loop without multiplication."
DirectXMan12,2015-05-18 23:01:58,https://api.github.com/repos/novnc/noVNC/git/commits/6940936ffcf3d39ee450bfc16f27722b2ece4fd1,6940936ffcf3d39ee450bfc16f27722b2ece4fd1,"WIP: Switch to Pako for zlib

This commit introduces an alternate implementation of the zlib
decompressor based on Pako (https://github.com/nodeca/pako)."
DirectXMan12,2015-08-04 19:50:20,https://api.github.com/repos/novnc/noVNC/git/commits/0442e153a1cad88e823926e596bcb3cff0aacabe,0442e153a1cad88e823926e596bcb3cff0aacabe,"Fix RFB.js JSHint Errors

This fixes a couple of JSHint errors in RFB.js caused
by using `==` instead of `===`."
DirectXMan12,2015-05-15 18:27:23,https://api.github.com/repos/novnc/noVNC/git/commits/efed2eeafd7f80f012fffbb18c05079db2bdbbd7,efed2eeafd7f80f012fffbb18c05079db2bdbbd7,"Fix up vnc_playback.html and playback.js

This commit fixes vnc_playback.html and playback.js
so that they work with the current version of noVNC."
DirectXMan12,2015-08-06 18:37:01,https://api.github.com/repos/novnc/noVNC/git/commits/bc4414f5b15c348bdc8a2abde0f4a34420c0c71c,bc4414f5b15c348bdc8a2abde0f4a34420c0c71c,"CI: Switch to Container-Based Travis

This commit switches the Travis tests over to Travis's new
container-based infrastructure.  It also tells Travis to
cache the node_modules directory for faster setup."
samhed,2015-07-01 11:16:53,https://api.github.com/repos/novnc/noVNC/git/commits/8f3c0f6b9b5e5c23a7dc7e90bd22901017ab4fc7,8f3c0f6b9b5e5c23a7dc7e90bd22901017ab4fc7,"Merge pull request #499 from samhed/fullscreen

Add option to toggle fullscreen mode"
samhed,2015-06-25 20:28:04,https://api.github.com/repos/novnc/noVNC/git/commits/a6357e827611aa5b0f2a6082372ab4e06af8cfe9,a6357e827611aa5b0f2a6082372ab4e06af8cfe9,"* Hide the fullscreen toggle button on Safari since alphanumerical
  keyboard input doesn't work in fullscreen.
* Force clipping mode in Internet Explorer while in fullscreen since
  scrollbars doesn't work in fullscreen."
samhed,2015-06-25 12:58:57,https://api.github.com/repos/novnc/noVNC/git/commits/6e296bfa8acbc19d8fd0d5ba5836f902e48ce09f,6e296bfa8acbc19d8fd0d5ba5836f902e48ce09f,Adapt display to be able to handle a changing clipping-setting while connected
samhed,2015-06-18 08:45:59,https://api.github.com/repos/novnc/noVNC/git/commits/7d1dc09ad0010924c6940832225e5eb2dc803f4f,7d1dc09ad0010924c6940832225e5eb2dc803f4f,Fixes #498 - Add the ability to toggle fullscreen mode
samhed,2015-06-25 20:34:44,https://api.github.com/repos/novnc/noVNC/git/commits/b098afc234528af8d3e6d708226d8839d8132d20,b098afc234528af8d3e6d708226d8839d8132d20,"Fix error from a previous commit, there is no data type called 'text'.."
samhed,2015-06-25 15:04:55,https://api.github.com/repos/novnc/noVNC/git/commits/74f2ac968d782318967d9162454ca945dcc8b3de,74f2ac968d782318967d9162454ca945dcc8b3de,"Renamed popupStatusPanel to popupStatus and removed the global variable
which kept track on if it was open or not (it automatically closes after
1.5 seconds anyway)."
samhed,2015-06-25 13:29:23,https://api.github.com/repos/novnc/noVNC/git/commits/30bfff81d977da82b37c99a6aa77d7ecb9b7f773,30bfff81d977da82b37c99a6aa77d7ecb9b7f773,"Clarified enableDisableClip (now called enableDisableViewClip) and
moved it to where the other clipping functions are."
samhed,2015-06-25 13:22:53,https://api.github.com/repos/novnc/noVNC/git/commits/4f19e5c697685f759771e2960d890a78cf5eae55,4f19e5c697685f759771e2960d890a78cf5eae55,Allow the popupStatusPanel to show any text but close it on a 1.5 second timer.
samhed,2015-06-24 14:20:03,https://api.github.com/repos/novnc/noVNC/git/commits/31ddaa1c7a4f2a8f211f53da1b53bfe294ad6a38,31ddaa1c7a4f2a8f211f53da1b53bfe294ad6a38,"Clarify code with regards to the viewport drag functionality
* Fixes #502 so that the viewport drag functionality can't get stuck"
samhed,2015-06-16 20:39:17,https://api.github.com/repos/novnc/noVNC/git/commits/29a0e6a8a3d091f075b1f1e941ee70651c245795,29a0e6a8a3d091f075b1f1e941ee70651c245795,"Always show the viewport drag button on touch devices to keep the GUI from
""jumping around"". Enable/disable the button instead of show/hide on these
devices."
DirectXMan12,2015-06-12 18:34:34,https://api.github.com/repos/novnc/noVNC/git/commits/539955ff2753b9bb40e958d4b4eaea3c1d743cb3,539955ff2753b9bb40e958d4b4eaea3c1d743cb3,"Merge pull request #497 from MOZGIII/MOZGIII-patch-vnc-auto-fix

Fixed incorrect UI usage and minor updateState params errors in vnc_auto.html"
MOZGIII,2015-06-12 17:41:41,https://api.github.com/repos/novnc/noVNC/git/commits/2bcfd58667d585fd8af36c8e525a7062a140bf6e,2bcfd58667d585fd8af36c8e525a7062a140bf6e,Fixed incorrect UI usage and minor updateState params errors in vnc_auto.html
samhed,2015-05-19 11:34:50,https://api.github.com/repos/novnc/noVNC/git/commits/1138bdd4b7e400833eb9cf444ae8daf8702eae7b,1138bdd4b7e400833eb9cf444ae8daf8702eae7b,Reverting most of commit cb3e4de. The issue was not related to using keyboardinputReset.. the issue was infact a typo which was introduced in 3b8ec46. I must be too tired..
samhed,2015-05-19 10:42:33,https://api.github.com/repos/novnc/noVNC/git/commits/cb3e4deb7365484c58d6fc7bddd345077db2381a,cb3e4deb7365484c58d6fc7bddd345077db2381a,"Stop using keyboardinputReset at the start of keyInput
* This fixes backspace when using the on-screen keyboard on Android"
samhed,2015-05-05 11:13:17,https://api.github.com/repos/novnc/noVNC/git/commits/613f05eea0a25d878c365f92bd2d71704087ca6a,613f05eea0a25d878c365f92bd2d71704087ca6a,"Update LICENSE.txt

Removed old no longer existing vnc.js and added playback.js"
samhed,2015-05-04 10:17:30,https://api.github.com/repos/novnc/noVNC/git/commits/8af9b6910c0094e3cf781fb011b475de97efc505,8af9b6910c0094e3cf781fb011b475de97efc505,"Merge pull request #483 from fabian-z/master

Make noVNC compatible with Content Security Policies"
fabian-z,2015-05-03 17:28:05,https://api.github.com/repos/novnc/noVNC/git/commits/48d26b2d474f0a7f91b0dba749272c51b471ee6a,48d26b2d474f0a7f91b0dba749272c51b471ee6a,Move #keyboardinput declarations to base.css/ui.js
samhed,2015-04-29 12:54:28,https://api.github.com/repos/novnc/noVNC/git/commits/8ce27ddb4bb51e7e67bfac91505da73c22b09a79,8ce27ddb4bb51e7e67bfac91505da73c22b09a79,"Re-fixes #428 which was broken by commit 58ded70
* Disable local cursor when the browser doesn't support data uri"
DirectXMan12,2015-04-07 18:29:46,https://api.github.com/repos/novnc/noVNC/git/commits/f9ffb21b6b60cf6d7c394a82d4801da5cc82ba04,f9ffb21b6b60cf6d7c394a82d4801da5cc82ba04,"Merge pull request #415 from jimdigriz/fixes

slip in PATH for 'npm test' as not everyone has karma"
DirectXMan12,2015-03-27 17:23:32,https://api.github.com/repos/novnc/noVNC/git/commits/cd1ab146bb60fa2d2c40abad5bb01b4273cbfa6e,cd1ab146bb60fa2d2c40abad5bb01b4273cbfa6e,"Merge pull request #474 from kanaka/bug/throw-error-from-constructor

Throw exceptions from RFB constructor"
DirectXMan12,2015-03-27 15:54:39,https://api.github.com/repos/novnc/noVNC/git/commits/245dc8669b82b60e010c31f80af05dbf5979f275,245dc8669b82b60e010c31f80af05dbf5979f275,"Merge pull request #475 from kanaka/bug/follow-symlinks-for-here

Follow symbolic links in launch.sh"
DirectXMan12,2015-03-24 20:02:53,https://api.github.com/repos/novnc/noVNC/git/commits/d9fc1c7be45f7be9f127636d5d63c3c224f05d1d,d9fc1c7be45f7be9f127636d5d63c3c224f05d1d,"Throw exceptions from RFB constructor

Previously, if an error was thrown from the Display constructor
in the RFB constructor, we would attempt to use `RFB#updateState`
to handle this.  However, `RFB#updateState` attempts to close
the WebSocket connection, which doesn't exist at this point.

In the constructor, it's probably just better to raise an exception
instead (making sure to clean up anything relevant).

Fixes #460"
DirectXMan12,2015-03-24 19:05:38,https://api.github.com/repos/novnc/noVNC/git/commits/58ded70d150c31df2fbd78c0320af6edc72610fc,58ded70d150c31df2fbd78c0320af6edc72610fc,"Create RFB object on connect

In e543525faa9cf0d683f41e183e89cd909f3dd229, we switched to creating
a new RFB object on disconnect.  This caused issues, however, since
any errors were only displayed briefly before the new ""loaded"" text
was displayed instead.

Now, we create the RFB object on connect.  This essentially removes
the usefulness of the ""loaded"" state, but prevents the aforementioned
problem.

To facilitate this, the code which does detection of cursor URI support
was moved from this Display constructor (which now calls the new
function) into its own function, `Util.browserSupportsCursorURIs()`.

Fixes #467"
DirectXMan12,2015-03-26 20:57:17,https://api.github.com/repos/novnc/noVNC/git/commits/2ace90e6d593fa0b38589239fe6ba6599d00d2b6,2ace90e6d593fa0b38589239fe6ba6599d00d2b6,"Follow symbolic links in launch.sh

Previously, in launch.sh, `$HERE` was the directory of `$0`.
However, if `$0` was actually a symlink, `$HERE` would be
wherever the symlink was, which could cause issues (for
example, the script wouldn't be able to local `$WEB` or
`$WEBSOCKIFY` properly).

Now, `$HERE` looks at whatever `$0` points at instead.

Closes #447."
samhed,2015-03-11 06:29:30,https://api.github.com/repos/novnc/noVNC/git/commits/16b3ef77d15179076144d45c9edfdb6d37beb41e,16b3ef77d15179076144d45c9edfdb6d37beb41e,Make getCanvasLimit more efficient by only calling getPosition once.
DirectXMan12,2015-03-10 21:13:21,https://api.github.com/repos/novnc/noVNC/git/commits/cefc9a917763c6548934c18a09cb4be98f6cddcf,cefc9a917763c6548934c18a09cb4be98f6cddcf,"Merge pull request #464 from kanaka/bug/firefoxresize

Fix resize in Firefox on Android"
