CendioOssman,2017-06-21 11:50:03,https://api.github.com/repos/novnc/noVNC/git/commits/9e99ce126ca8f6f350fa015c0e58d35103c62f7e,9e99ce126ca8f6f350fa015c0e58d35103c62f7e,"Fake key release for iOS hardware keyboards

iOS sends decent key down events, but junk key up events when a
hardware keyboard is used. This confuses the key tracking as a
corresponding release is then never detected. To work around this
we'll treat the hardware keyboard like the virtual ones and send
the key release right away."
CendioOssman,2017-06-15 11:49:27,https://api.github.com/repos/novnc/noVNC/git/commits/637a282be54f2c2e97aff6d94f4c2fe1a51e0b96,637a282be54f2c2e97aff6d94f4c2fe1a51e0b96,"Scroll error stack trace

Make sure we get the stack trace without distortions by wrapping, or
cropping because it flows out of the screen."
CendioOssman,2017-06-08 08:43:53,https://api.github.com/repos/novnc/noVNC/git/commits/55b459b47961e2ca2eb125408a1ddc60d0251457,55b459b47961e2ca2eb125408a1ddc60d0251457,Merge branch 'ios9' of https://github.com/CendioOssman/noVNC
DirectXMan12,2017-06-05 18:28:28,https://api.github.com/repos/novnc/noVNC/git/commits/a5c366b834cbeb8e89406e0374e2a0903cedfbe8,a5c366b834cbeb8e89406e0374e2a0903cedfbe8,"Merge pull request #838 from novnc/infra/fix-travis-sauce

Fix Travis-Sauce Connection"
DirectXMan12,2017-06-05 17:33:39,https://api.github.com/repos/novnc/noVNC/git/commits/b081ea72669e89ee9080292005778f20f2c7902f,b081ea72669e89ee9080292005778f20f2c7902f,"Fix Travis-Sauce Connection

Somethings got messed up in the Travis-Sauce tunnel setup.  This should
fix it by re-adding the Sauce credentials.  It also updates the config
to explicitly pass auth information instead of via environment
variables."
CendioOssman,2017-06-02 13:11:05,https://api.github.com/repos/novnc/noVNC/git/commits/858ea4a77422ab0d1c7cbbd92c28600bd29113ed,858ea4a77422ab0d1c7cbbd92c28600bd29113ed,"Avoid use of 'let' and 'const'

They are not supported on older browsers, e.g. iOS 9."
CendioOssman,2017-06-02 12:44:20,https://api.github.com/repos/novnc/noVNC/git/commits/493ad1a24b7932522bb4042a4911249a1811b231,493ad1a24b7932522bb4042a4911249a1811b231,"Avoid nested function declarations

Not supported in older browsers, e.g. iOS 9."
CendioOssman,2017-06-02 12:38:16,https://api.github.com/repos/novnc/noVNC/git/commits/844e98391689febb03ae5ea905eba15f12ed9d9e,844e98391689febb03ae5ea905eba15f12ed9d9e,"Limit use of keypress fallback

It was preventing key events for dead keys, so try to reduce it to
only cases where we must use it."
CendioOssman,2017-06-02 12:37:36,https://api.github.com/repos/novnc/noVNC/git/commits/459ed0083fae1a13ab35c096c47f57f0f39e3ce0,459ed0083fae1a13ab35c096c47f57f0f39e3ce0,"Allow key events without symbols

They can still be useful if the server makes use of the keycode instead."
CendioOssman,2017-06-01 10:50:00,https://api.github.com/repos/novnc/noVNC/git/commits/255fbe0c9e93d26b0edc6c33fdd99dd64e7bc976,255fbe0c9e93d26b0edc6c33fdd99dd64e7bc976,Fix traffic management in playback tests
CendioOssman,2017-06-01 08:29:19,https://api.github.com/repos/novnc/noVNC/git/commits/39193b28786faabc3da6f02454ec12f83d5bedfc,39193b28786faabc3da6f02454ec12f83d5bedfc,Merge branch 'record' of https://github.com/CendioOssman/noVNC
CendioOssman,2017-05-31 14:20:24,https://api.github.com/repos/novnc/noVNC/git/commits/dfa7826d728cf224196924768898e471fb880002,dfa7826d728cf224196924768898e471fb880002,"Get XT scan code mappings from the keycodemapdb project

This way we can work together with other projects that need this kind
of mapping."
samhed,2017-05-30 08:19:42,https://api.github.com/repos/novnc/noVNC/git/commits/beec05ce7a94acac3191c9b4ec2825b5503ac619,beec05ce7a94acac3191c9b4ec2825b5503ac619,"Merge pull request #831 from samhed/visualhint

Add hint that the control bar can be moved"
samhed,2017-05-22 06:24:41,https://api.github.com/repos/novnc/noVNC/git/commits/bbc1648c7ade238c168a69a719012ee347430a14,bbc1648c7ade238c168a69a719012ee347430a14,"Add hint that the control bar can be moved

The control bar can be dragged to the other side, this isn't obvious
however. This adds a hint on the opposite side in the form of a subtle
glowing half-ellipse."
CendioOssman,2017-05-22 12:01:44,https://api.github.com/repos/novnc/noVNC/git/commits/1433360ad904396ddb3efb7116ffdaf0052e8ccb,1433360ad904396ddb3efb7116ffdaf0052e8ccb,"Use one entry per file in transpile cache

This avoids any risk of the cache key and contents getting out
of sync."
CendioOssman,2017-05-22 11:48:59,https://api.github.com/repos/novnc/noVNC/git/commits/55d5353f90f1f9a9a8db6f4ea01e971e606f9525,55d5353f90f1f9a9a8db6f4ea01e971e606f9525,Remove #nocache system as it is unused
CendioOssman,2017-05-22 11:44:48,https://api.github.com/repos/novnc/noVNC/git/commits/7c1f1a9cef7cc183e9516f5335eee3cf45cf6819,7c1f1a9cef7cc183e9516f5335eee3cf45cf6819,"Revert recording file format changes

Change back to the old, non-modular recording file format. The new
method doesn't work reliably and there are existing recordings already
out there that we might want to handle."
samhed,2017-05-20 16:59:47,https://api.github.com/repos/novnc/noVNC/git/commits/c23665dd8254150f0581331e6a15acc8ff05606c,c23665dd8254150f0581331e6a15acc8ff05606c,"Clear the password input field

If a user disconnects but leaves the browser tab open, the password
input field would still contain the password for future connections.
We now clear the input field after reading the password into memory."
CendioOssman,2017-05-19 12:39:49,https://api.github.com/repos/novnc/noVNC/git/commits/aadcf47d6fccfa4b07f88db000580fe55b1588d5,aadcf47d6fccfa4b07f88db000580fe55b1588d5,"Handle loading web workers in any path

The URL is interpreted relative the current page, not relative
the current script. So we need to have some extra code in order to
allow the module loader to be agnostic to its path."
CendioOssman,2017-05-16 12:07:03,https://api.github.com/repos/novnc/noVNC/git/commits/777df7c274222806b5d66412058cabf71f5d4ca7,777df7c274222806b5d66412058cabf71f5d4ca7,"Don't fail on babel cache storage errors

It is just a cache after all, so failures are not fatal. Users will get longer
load times, but at least they'll get a page."
samhed,2017-05-15 12:57:33,https://api.github.com/repos/novnc/noVNC/git/commits/b0061a3c49dc25a71f7b0a9a1f31a8befe787cb4,b0061a3c49dc25a71f7b0a9a1f31a8befe787cb4,"Revert ""Remove shadow from logo""

This reverts commit 7c44f86dcd77bff811d9619fd5341938cfa8d69f."
CendioOssman,2017-05-15 12:40:28,https://api.github.com/repos/novnc/noVNC/git/commits/55988e7aec698e8f23af943fdc268f998fc4eba5,55988e7aec698e8f23af943fdc268f998fc4eba5,"Fix bootstart of input field

It wasn't working properly anymore because it expected to be triggered
by the ""load"". But we now register that event listener long after the
""load"" event has already fired."
samhed,2017-05-12 23:56:35,https://api.github.com/repos/novnc/noVNC/git/commits/afb621d577a9b90763761abdabeb9bfa8810981c,afb621d577a9b90763761abdabeb9bfa8810981c,Add missing semicolon
samhed,2017-05-12 23:45:23,https://api.github.com/repos/novnc/noVNC/git/commits/c464f47e964678f6142bcbd080d36dcea9caa9d1,c464f47e964678f6142bcbd080d36dcea9caa9d1,Remove trailing whitespace
samhed,2017-05-12 23:43:02,https://api.github.com/repos/novnc/noVNC/git/commits/7c44f86dcd77bff811d9619fd5341938cfa8d69f,7c44f86dcd77bff811d9619fd5341938cfa8d69f,Remove shadow from logo
samhed,2017-05-12 15:10:27,https://api.github.com/repos/novnc/noVNC/git/commits/69300d3c7c82e1b7074c1c34fe18e68346b7ab7e,69300d3c7c82e1b7074c1c34fe18e68346b7ab7e,Update readme with new screenshots
samhed,2017-05-12 10:52:05,https://api.github.com/repos/novnc/noVNC/git/commits/d4fc89d8b9f584fc251aa15c6c72d0b9a3e02dee,d4fc89d8b9f584fc251aa15c6c72d0b9a3e02dee,"Catch errors for when we can't play bell

Many browsers, for example Chrome on Android will not allow audio to
play unless it's initiated from a user action. It is not reasonable to
display an error for this. Fixes issue #821."
samhed,2017-05-12 07:01:20,https://api.github.com/repos/novnc/noVNC/git/commits/53f41f969228a47201ffe533f1ee550ff28d9041,53f41f969228a47201ffe533f1ee550ff28d9041,Add vnc_lite to npmignore
samhed,2017-05-12 06:57:23,https://api.github.com/repos/novnc/noVNC/git/commits/83391ffc38d91f6ceb5da6cf764a5411dc431543,83391ffc38d91f6ceb5da6cf764a5411dc431543,Rename vnc_auto to vnc_lite
samhed,2017-05-12 06:48:41,https://api.github.com/repos/novnc/noVNC/git/commits/7ca650b73d826d1111720ea67ff2c471aa2ba2b9,7ca650b73d826d1111720ea67ff2c471aa2ba2b9,Add missing semi colon
samhed,2017-05-11 11:34:43,https://api.github.com/repos/novnc/noVNC/git/commits/333ad45c7029d02e3660965953cc85d83ce9bec0,333ad45c7029d02e3660965953cc85d83ce9bec0,"Don't capture touch events

They are implicitly captured anyway, and we get problems if we try
to explicitly capture them."
samhed,2017-05-11 11:30:40,https://api.github.com/repos/novnc/noVNC/git/commits/4f1c81dca94ec228923caa42aeeabf3955f540b6,4f1c81dca94ec228923caa42aeeabf3955f540b6,"Stop tracking mouse capture state

Was a workaround for other bugs which are now fixed."
samhed,2017-05-11 11:27:10,https://api.github.com/repos/novnc/noVNC/git/commits/cb568ece8bb8546f7a4eb0fd85ffeab210d1f191,cb568ece8bb8546f7a4eb0fd85ffeab210d1f191,"Stop grabbing mouse events globally

Not necessary anymore since we have proper capture."
samhed,2017-05-09 09:59:23,https://api.github.com/repos/novnc/noVNC/git/commits/901a425a4f6fa58dde00a9a24de01209dc3b8dbf,901a425a4f6fa58dde00a9a24de01209dc3b8dbf,"Fix update-pot so that it can handle UTF-8

It crashed on non-ascii characters before, for example the """"
character."
lxp,2017-02-08 13:29:27,https://api.github.com/repos/novnc/noVNC/git/commits/8a0cbd742b2a1c0ce2d827341163afb321558de5,8a0cbd742b2a1c0ce2d827341163afb321558de5,"Update German translation

From Pull Request #771."
samhed,2017-05-08 08:38:06,https://api.github.com/repos/novnc/noVNC/git/commits/fbe13344fbf0b2311c80675f9a8bc6c47f243b10,fbe13344fbf0b2311c80675f9a8bc6c47f243b10,"Merge pull request #819 from martinpitt/master

Fix license name in package.json"
martinpitt,2017-05-08 07:46:38,https://api.github.com/repos/novnc/noVNC/git/commits/a9b483cd20f389a11871dd4af79592f13c60ff1d,a9b483cd20f389a11871dd4af79592f13c60ff1d,"Fix license name in package.json

It's spelled ""MPL-2.0"" according to https://spdx.org/licenses/."
CendioOssman,2017-05-04 13:13:33,https://api.github.com/repos/novnc/noVNC/git/commits/26586b9ddf3f5aa3c96c0f1090cb2134966a055f,26586b9ddf3f5aa3c96c0f1090cb2134966a055f,"Remove colour map support

It was broken and unused. Remove it so we can simplify the code."
CendioOssman,2017-05-04 12:52:05,https://api.github.com/repos/novnc/noVNC/git/commits/fb7e99e84bfe5827757acb17efa55dda9fabe5bc,fb7e99e84bfe5827757acb17efa55dda9fabe5bc,"Remove browser engine detection

It is out of date and not used anyway."
CendioOssman,2017-05-04 11:26:39,https://api.github.com/repos/novnc/noVNC/git/commits/099eb856cfa0f8affacfde91fbe508e66f907584,099eb856cfa0f8affacfde91fbe508e66f907584,"Skip some keyboard tests on IE and Edge

IE and Edge has some broken behaviour for keyboard events that
prevent the standard tests from running properly."
CendioOssman,2017-05-04 11:13:02,https://api.github.com/repos/novnc/noVNC/git/commits/38170d2442568ee96905d51756d165e67af643e8,38170d2442568ee96905d51756d165e67af643e8,Merge branch 'png_cursor' of https://github.com/CendioOssman/noVNC
CendioOssman,2017-05-04 10:18:55,https://api.github.com/repos/novnc/noVNC/git/commits/545442afc35c649b40482c3e996ba4e1fc5354e4,545442afc35c649b40482c3e996ba4e1fc5354e4,Merge branch 'keyboard' of https://github.com/CendioOssman/noVNC
CendioOssman,2017-04-13 12:49:42,https://api.github.com/repos/novnc/noVNC/git/commits/5a3e9d3da89d854131396aceca1881487abded26,5a3e9d3da89d854131396aceca1881487abded26,Error.error can be null in some cases
CendioOssman,2017-04-13 12:50:55,https://api.github.com/repos/novnc/noVNC/git/commits/9782d4a324d24179f42f381080699a20eb164d06,9782d4a324d24179f42f381080699a20eb164d06,"Use KeyboardEvent.key too look up keysyms

And emulate it on browsers where it is missing or incorrect. This
makes the code more future oriented as it primarily uses the standardised
fields."
CendioOssman,2017-05-04 09:52:40,https://api.github.com/repos/novnc/noVNC/git/commits/634cc1ba46222125c7680472a234126e875cfc3d,634cc1ba46222125c7680472a234126e875cfc3d,"Handle CapsLock on macOS

Modifiers behave a bit oddly on macOS, causing weird CapsLock events
to be sent by the browsers."
CendioOssman,2017-01-27 11:52:24,https://api.github.com/repos/novnc/noVNC/git/commits/bf43c26319a7bfea989a2306c9423feac0509c32,bf43c26319a7bfea989a2306c9423feac0509c32,"Clean up AltGraph handling

It doesn't need to be this general as the issue is mostly about
Windows. Also use the same modifier shuffle that RealVNC and
TigerVNC uses to get macOS working well."
CendioOssman,2017-01-27 11:26:55,https://api.github.com/repos/novnc/noVNC/git/commits/ae82053366bdf91c6cbcb459f92101ec4e693f0a,ae82053366bdf91c6cbcb459f92101ec4e693f0a,"Simplify pressed key handling

Prefer avoid having the server simulate multiple key presses by
refusing to use multiple keysyms for the same physical key."
CendioOssman,2017-01-27 11:24:20,https://api.github.com/repos/novnc/noVNC/git/commits/9fce233d51c803b08b6779bc8e906334de6916cf,9fce233d51c803b08b6779bc8e906334de6916cf,"Simplify handling of keypress

Use a dedicated variable to track a two stage key rather than
piggy-backing on the key state array."
CendioOssman,2017-01-27 09:36:10,https://api.github.com/repos/novnc/noVNC/git/commits/f7363fd26dd7d9fced3bce4c629f5119d8b476ae,f7363fd26dd7d9fced3bce4c629f5119d8b476ae,"Move keyboard handling in to Keyboard class

Replace the multi stage pipeline system with something simpler.
That level of abstraction is not needed."
CendioOssman,2017-01-27 09:49:04,https://api.github.com/repos/novnc/noVNC/git/commits/9e6f71cb753405507f8977ed8cb64f11189ac4c2,9e6f71cb753405507f8977ed8cb64f11189ac4c2,"Remove modifier synchronisation

The fields provided cannot tell us if it is the left or right
version of the key that's pressed, so they are inherently unreliable.
It is also not a huge problem in practice as we'll get in sync on
the next press or release of the modifier."
CendioOssman,2017-01-26 17:20:19,https://api.github.com/repos/novnc/noVNC/git/commits/a784a9cabc4aef667e9ea2ea1f942a3a5f0d0ddd,a784a9cabc4aef667e9ea2ea1f942a3a5f0d0ddd,"Remove QEMU key event handler

The normal event handler provides all the necessary information
now, so it is no longer needed."
CendioOssman,2017-01-26 17:09:40,https://api.github.com/repos/novnc/noVNC/git/commits/d0703d1bdebe610261bc492e2c23877d359e5eb3,d0703d1bdebe610261bc492e2c23877d359e5eb3,"Simplify keyboard event API

No need for an object for three static fields."
CendioOssman,2017-01-26 16:59:25,https://api.github.com/repos/novnc/noVNC/git/commits/94f5cf05f37191ec028781bd486fbf22a460e515,94f5cf05f37191ec028781bd486fbf22a460e515,"Send keyboard events from single place

This makes it easier to handle any needed variations, like different
types of messages."
CendioOssman,2017-01-24 16:18:43,https://api.github.com/repos/novnc/noVNC/git/commits/f714f7deae1f883b9d1e70815c50267bedacc767,f714f7deae1f883b9d1e70815c50267bedacc767,"Improve lookup of special keys

Look up keys that are independent of layout and state first,
followed by keys that are only mild variations in layouts.
This is more robust as there might be multiple physical keys
generating the same symbols, and Keysyms don't map directly to
Unicode in all cases.

At the same time switch over to using the modern, standardised
'code' field for lookup."
CendioOssman,2017-01-25 10:29:08,https://api.github.com/repos/novnc/noVNC/git/commits/bfa1b237b9caec28380f3bb3e03f409eadc7f2b0,bfa1b237b9caec28380f3bb3e03f409eadc7f2b0,"Improve character keysym lookup

Use the more modern 'key' field, and remove some legacy fallbacks
that are no longer required. This also removes the ""stall"" mechanism
as it is not needed with current browsers."
CendioOssman,2017-01-24 14:16:10,https://api.github.com/repos/novnc/noVNC/git/commits/80cb8ffddd49d828fe3b9c94b556ad154381b225,80cb8ffddd49d828fe3b9c94b556ad154381b225,Use standard DOM identifiers for physical keys
samhed,2017-05-03 11:57:23,https://api.github.com/repos/novnc/noVNC/git/commits/1c5702b0b5dbc6a2d8e4eb9afd909fc26e855310,1c5702b0b5dbc6a2d8e4eb9afd909fc26e855310,"Merge pull request #817 from univention/master

Remove double unescaping of title"
pmhahn,2017-05-03 10:01:05,https://api.github.com/repos/novnc/noVNC/git/commits/08cd672e404244ef2b4b925043716aa933fcbb27,08cd672e404244ef2b4b925043716aa933fcbb27,"Remove double unescaping of title

Commit fa5b334dcbe7a5dab21580b54cc2f5f142600379 by Joel Martin changed
getQueryVal() to always decode the value using decodeURIComponent(), but
unescape() is still used for extracting the title, leading to
double-unescaping.

As unescape() is deprecated anyway, remove the last user.

Cc: Joel Martin <github@martintribe.org>
Cc: Anthony Young <sleepsonthefloor@gmail.com>"
CendioOssman,2017-04-28 12:38:59,https://api.github.com/repos/novnc/noVNC/git/commits/36bdf136541599c0b7620cdece2cd6639d4b90e3,36bdf136541599c0b7620cdece2cd6639d4b90e3,"Only load ES6 module loader polyfill if needed

Safari now has native support for modules, so we need to make sure
we only load our polyfill when actually needed."
samhed,2017-04-21 13:23:18,https://api.github.com/repos/novnc/noVNC/git/commits/0613d18894280549133315ee1251bd350d1ec872,0613d18894280549133315ee1251bd350d1ec872,"Fix panning test for high DPI devices

There is a drag-threshold in the panning code which the tests didn't
account for. This caused the tests to fail when window.devicePixelRatio
was higher than 1."
samhed,2017-04-19 13:34:16,https://api.github.com/repos/novnc/noVNC/git/commits/e4290d8c00969eb321486e124cbc7ab91c786c43,e4290d8c00969eb321486e124cbc7ab91c786c43,Add Pierre as contributor in package.json
samhed,2017-04-19 13:33:42,https://api.github.com/repos/novnc/noVNC/git/commits/101ff12736d979b9df2dd6d7abfe72cf8b8e73d3,101ff12736d979b9df2dd6d7abfe72cf8b8e73d3,Update url's
samhed,2017-04-11 08:53:06,https://api.github.com/repos/novnc/noVNC/git/commits/41c958d450973c642733efda10a1a6fe3aedde5e,41c958d450973c642733efda10a1a6fe3aedde5e,"Properly restore the default style

Setting a style to null does restore it in FF, Chrome, Safari and Edge.
But it does not work in Internet Explorer. The proper way to restore to
default values is to set it to the empty string. This works in all
browsers. Fixes issue #808."
soichih,2017-04-03 16:31:19,https://api.github.com/repos/novnc/noVNC/git/commits/dd44a8ead8e614dbeaa4014900b6e74ee9f70f62,dd44a8ead8e614dbeaa4014900b6e74ee9f70f62,Fixed the issue where novnc can't be relocated
samhed,2017-04-05 12:00:59,https://api.github.com/repos/novnc/noVNC/git/commits/270bdbd7fbf3ce24893fa81f22cdfb3d68e91c49,270bdbd7fbf3ce24893fa81f22cdfb3d68e91c49,"Always send mouseUp events properly

If down is false we can't just toggle the current internal state, even
though this is correct most of the time. There are cases where we don't
get the down event and thus won't have a correct internal state. For
example, when clicking in the session after using the clipboard
textarea.

If down is false, we always want to send a mouse event with the button
in 'up'-state."
samhed,2017-04-03 06:18:48,https://api.github.com/repos/novnc/noVNC/git/commits/f4ae0a1402ec2e77a653f25d0b73f426680b8fcf,f4ae0a1402ec2e77a653f25d0b73f426680b8fcf,"Merge pull request #801 from CendioOssman/errors

Improve fallback error handler"
CendioOssman,2017-03-02 14:49:43,https://api.github.com/repos/novnc/noVNC/git/commits/f7c620d34e7df12e25bb36b688c8c5c0dfe81bdf,f7c620d34e7df12e25bb36b688c8c5c0dfe81bdf,"Generate source map for ES module loader rollup

Makes it easier to debug things as you get the original source and
proper line numbers."
CendioOssman,2017-03-02 14:48:47,https://api.github.com/repos/novnc/noVNC/git/commits/36efb9783c6e111bce83a9a98285fd52ff2afa5a,36efb9783c6e111bce83a9a98285fd52ff2afa5a,Handle uncaught WebWorker exceptions
CendioOssman,2017-03-02 14:48:13,https://api.github.com/repos/novnc/noVNC/git/commits/5d00fd9bf0d1f250292b94e4cbf147b5cca9c05a,5d00fd9bf0d1f250292b94e4cbf147b5cca9c05a,Try to populate error location on Promise errors
CendioOssman,2017-03-02 14:47:22,https://api.github.com/repos/novnc/noVNC/git/commits/999b5da75323d195a8a2dea4b962c607184117a0,999b5da75323d195a8a2dea4b962c607184117a0,Only use unhandledrejection fallback when needed
CendioOssman,2017-03-02 14:46:05,https://api.github.com/repos/novnc/noVNC/git/commits/36653517a52f2ea3341f2e6be46a394240ae9d0d,36653517a52f2ea3341f2e6be46a394240ae9d0d,Use common code to handle Promise errors
CendioOssman,2017-03-02 14:44:30,https://api.github.com/repos/novnc/noVNC/git/commits/732233eda0817dd611dda16e430375be116edfcf,732233eda0817dd611dda16e430375be116edfcf,"Handle partial error location information

We might not get line or column number, but the file is still
useful information."
CendioOssman,2017-03-02 13:22:15,https://api.github.com/repos/novnc/noVNC/git/commits/5da03103a35d1d441648cb98ceba1409ba695696,5da03103a35d1d441648cb98ceba1409ba695696,"ErrorEvent.error isn't always set

It's not just a matter of the browser lacking support."
CendioOssman,2017-03-02 13:21:29,https://api.github.com/repos/novnc/noVNC/git/commits/13c558e3a0d9a56db98923ce3f08310ae1852bf7,13c558e3a0d9a56db98923ce3f08310ae1852bf7,"Limit fallback error width to window width

Change the layout a bit to make sure the entire message can be read."
CendioOssman,2017-03-02 13:20:03,https://api.github.com/repos/novnc/noVNC/git/commits/c361080be8e4275d4b74a79193f02e0cf25b0348,c361080be8e4275d4b74a79193f02e0cf25b0348,"Use monospace font for unhandled errors

The browsers uses crude layout formatting that expects this."
DirectXMan12,2017-03-25 00:40:15,https://api.github.com/repos/novnc/noVNC/git/commits/5abbdf5a5159fa863f8d5fd26d8ec435e78239a7,5abbdf5a5159fa863f8d5fd26d8ec435e78239a7,"Merge pull request #738 from patrakov/master

Changed the default compression level to 2"
CendioOssman,2017-01-24 12:36:31,https://api.github.com/repos/novnc/noVNC/git/commits/a5c8a755e8b024c3584121132d68936a7d74f2c4,a5c8a755e8b024c3584121132d68936a7d74f2c4,"Hide internal keyboard functions

These may change and are not part of a stable API.

This also reindents the object functions to make sure they can
access private functions."
CendioOssman,2017-01-24 11:55:54,https://api.github.com/repos/novnc/noVNC/git/commits/0a865e15ff9f43c1d697ab1f996cb5e145d0ea16,0a865e15ff9f43c1d697ab1f996cb5e145d0ea16,"Remove character substitution

We can handle any Unicode codepoint now, so stop replacing symbols."
CendioOssman,2017-01-24 11:49:29,https://api.github.com/repos/novnc/noVNC/git/commits/278a5e7fbd922e930c4c9df8f50b545ede17e39f,278a5e7fbd922e930c4c9df8f50b545ede17e39f,"Simplify keysymdef.js

Some Unicode to Keysym mappings can be computed and can therefore
be left out of the huge lookup table."
CendioOssman,2017-01-24 11:39:21,https://api.github.com/repos/novnc/noVNC/git/commits/041568bd3110d01582a031a1c8467323b72b279b,041568bd3110d01582a031a1c8467323b72b279b,Clean up keysymdef
CendioOssman,2017-01-24 11:07:26,https://api.github.com/repos/novnc/noVNC/git/commits/524d67f2834bfd41aad58b28a69d3c4d841f4ca2,524d67f2834bfd41aad58b28a69d3c4d841f4ca2,"Remove keysym names from keysymdef.js

They were incomplete and turned off in most cases so they served
little use besides adding complexity."
CendioOssman,2017-03-24 09:49:00,https://api.github.com/repos/novnc/noVNC/git/commits/9076defaca9b25749f2526406b6c2d8756f97329,9076defaca9b25749f2526406b6c2d8756f97329,"Get parse.js in sync with generated code

The generated keysymdef.js was recently converted to ES modules,
but the generating script was overlooked."
CendioOssman,2017-03-23 16:53:09,https://api.github.com/repos/novnc/noVNC/git/commits/7e19216368665378c44d5f42b17b289915178879,7e19216368665378c44d5f42b17b289915178879,"Define an initial shadow for spinner

IE and Edge refuse to animate attributes that weren't present in
the static definition."
DirectXMan12,2017-03-22 22:28:13,https://api.github.com/repos/novnc/noVNC/git/commits/dd7068984dedbfc00522784fb796715f4f514512,dd7068984dedbfc00522784fb796715f4f514512,"Merge pull request #774 from novnc/refactor/es6-module-loader

[Refactor] ES6 Modules"
DirectXMan12,2017-03-02 02:10:09,https://api.github.com/repos/novnc/noVNC/git/commits/d6c17390f0e4199d094e4af3a8a5e97c98f2c579,d6c17390f0e4199d094e4af3a8a5e97c98f2c579,"Make vnc_playback.html functional once more

This commit makes vnc_playback.html functional once more, and completely
refactors tests/playback.js to make it usable in other scenarios.

In order for vnc_playback.js to properly load playback files now, they
must `export` their variables."
DirectXMan12,2017-03-01 21:26:15,https://api.github.com/repos/novnc/noVNC/git/commits/7569cdc21edafe6c43308242055cedd674e6661d,7569cdc21edafe6c43308242055cedd674e6661d,"Fix vnc_auto.html

This commit fixes `vnc_auto.html` to work with the new changes.
Note that it is not translated over when `--with-app` is used
on `util/use_require.js`.  We'll probably want to deprecate it,
or do some longer-term cleanup."
DirectXMan12,2017-03-01 16:17:44,https://api.github.com/repos/novnc/noVNC/git/commits/152c399513e250aecda206ce38e2cf934d918c6c,152c399513e250aecda206ce38e2cf934d918c6c,"Vendor in an IE11 polyfill for Promises

This commit introduces a polyfill to add support for Promises in IE11.
This means IE11 can be tested without first running
`utils/as_require.js`."
