olivernn,2017-07-09 19:39:56,https://api.github.com/repos/olivernn/lunr.js/git/commits/e2031f44f3b852f5821156cc2d966b972802e649,e2031f44f3b852f5821156cc2d966b972802e649,Build version 2.1.2
olivernn,2017-07-09 19:34:32,https://api.github.com/repos/olivernn/lunr.js/git/commits/ae53f515b4d856a812ba93441b7a3e3f17cb2a89,ae53f515b4d856a812ba93441b7a3e3f17cb2a89,"Clone token metadata to prevent mutation

When creating instances of lunr.MatchData the token metadata must be
cloned to prevent mutation of the metadata stored in the inverted index.

Without cloning, combining match data instances for the same term can
lead to the original metadata in the inverted index from being mutated."
olivernn,2017-07-06 17:25:44,https://api.github.com/repos/olivernn/lunr.js/git/commits/c0e2de9a2ead955452d2e752f0e9cb718e11c8d8,c0e2de9a2ead955452d2e752f0e9cb718e11c8d8,Build version 2.1.1
petebacondarwin,2017-07-06 07:21:00,https://api.github.com/repos/olivernn/lunr.js/git/commits/4d8afd3a946078108b9841c7c33c5d5c4e18a278,4d8afd3a946078108b9841c7c33c5d5c4e18a278,"Use prototype free object for `fieldTerms` hash

Previously terms that collided with standard Object properties we breaking
the calculation of frequencies - leading to NaN scores for queries."
olivernn,2017-06-12 17:08:36,https://api.github.com/repos/olivernn/lunr.js/git/commits/789aa68c375278e38127451da6a2699f98fc5a3c,789aa68c375278e38127451da6a2699f98fc5a3c,"Update bower and component package definitions

Apparantly they are still a thing..."
olivernn,2017-06-11 15:32:59,https://api.github.com/repos/olivernn/lunr.js/git/commits/cf96052b82426eb84302b64797e498aabb681e59,cf96052b82426eb84302b64797e498aabb681e59,Build version 2.1.0
olivernn,2017-06-11 15:25:06,https://api.github.com/repos/olivernn/lunr.js/git/commits/12577a6cdeca9144bc759733985ec437d42ffb58,12577a6cdeca9144bc759733985ec437d42ffb58,Update docs for wildcards and escape chars
olivernn,2017-06-11 14:50:08,https://api.github.com/repos/olivernn/lunr.js/git/commits/985a4fe467c5fcee246d4e688e3becf2124e1909,985a4fe467c5fcee246d4e688e3becf2124e1909,Improve query parser error messages
olivernn,2017-06-04 17:29:32,https://api.github.com/repos/olivernn/lunr.js/git/commits/30af8b289c310cfdcdb7d8d1ac86f95501d578e4,30af8b289c310cfdcdb7d8d1ac86f95501d578e4,Build version 2.1.0-alpha.2
olivernn,2017-06-04 17:09:22,https://api.github.com/repos/olivernn/lunr.js/git/commits/889a2f9f77ffbb966e3a59cfc6f3aeea7d490e73,889a2f9f77ffbb966e3a59cfc6f3aeea7d490e73,Fix some spelling mistakes
olivernn,2017-06-04 16:56:29,https://api.github.com/repos/olivernn/lunr.js/git/commits/1f2cca2df1ed3acd1ccee2303a81c9b667f8f7de,1f2cca2df1ed3acd1ccee2303a81c9b667f8f7de,"Create a query vector per field for scoring

Previously a single query vector was created for use in scoring
documents against a query. This could lead to some incorrect results
when performing queries with boost specific to certain fields.

If a query term has different boost for different fields the approach of
using a single vector will mean that the same boost is used for both
fields.

Instead we create a vector per field, this prevents a boost from being
applied to terms in different fields."
olivernn,2017-06-01 18:44:35,https://api.github.com/repos/olivernn/lunr.js/git/commits/43e6ddbf2d0c4114af903ca1d63a0d5b1261d800,43e6ddbf2d0c4114af903ca1d63a0d5b1261d800,"Add support for escape sequence in query string

Before it was not possible to escape the reserverd characters when
performing a search using a query string. This allows searching for
literal reserved characters using lunr.Index#search. Using backslash ""\""
as the escape character."
olivernn,2017-05-22 18:07:41,https://api.github.com/repos/olivernn/lunr.js/git/commits/85bdd999e22814fae1fc9b6a0509f2e9a31e664f,85bdd999e22814fae1fc9b6a0509f2e9a31e664f,Build version 2.1.0-alpha.1
olivernn,2017-05-11 18:14:44,https://api.github.com/repos/olivernn/lunr.js/git/commits/57f9efc8136aabdc9d7822c728f07a22797a193d,57f9efc8136aabdc9d7822c728f07a22797a193d,"Add support for adding wildcards to clause term

Introduces a lunr.Query.wildcard property with flags for defining
whether to add leading or trailing wildcards to a clause term. Flags can
be combined to add leading and trailing wildcards.

The term is checked for existing wildcards to prevent double wildcards
and by default the wildcard property is set to none."
olivernn,2017-05-15 16:17:52,https://api.github.com/repos/olivernn/lunr.js/git/commits/db3a016abd7507b4540a4a67c09a5245c1b2c261,db3a016abd7507b4540a4a67c09a5245c1b2c261,"Split document vectors into field vectors

To be able to support accurate field based search the smallest unit of
data within the index needs to be the field, not the document. This
change changes lunr from being document centric to being field centric.

This means changing the stored vectors to be by document/field tuple,
rather than just by document.

Additionally, when querying, the query vector can be greatly simplified,
treating each query term as similarly important (plus any boosts). This
allows us to remove some of the index properties that were only present
to aid calculating query term weights."
olivernn,2017-05-23 17:36:39,https://api.github.com/repos/olivernn/lunr.js/git/commits/72b61ae127affd7bc74f20b8c95ff35d0d6416cd,72b61ae127affd7bc74f20b8c95ff35d0d6416cd,Build version 2.0.4
olivernn,2017-05-16 20:13:21,https://api.github.com/repos/olivernn/lunr.js/git/commits/0f8c76c419a68b830c1a1514e2c1eec0f91421f3,0f8c76c419a68b830c1a1514e2c1eec0f91421f3,"Fix IDF calculation

Missing logarithm meant very common words were not being properly
normalised."
olivernn,2017-04-24 19:31:58,https://api.github.com/repos/olivernn/lunr.js/git/commits/0eb51f26e433272da26c0a269650dafb4fb9fdb0,0eb51f26e433272da26c0a269650dafb4fb9fdb0,Build version 2.0.3
olivernn,2017-04-24 19:21:51,https://api.github.com/repos/olivernn/lunr.js/git/commits/6471ebe163917973e5b58657622d4b98c04e98e7,6471ebe163917973e5b58657622d4b98c04e98e7,"Add lunr.Vector#upsert method

Before lunr.Vector only supported insert, and this method would fail if
trying to insert a value with a duplicate index. When building the
document vectors this is the correct behaviour, however, for query
vectors there may be duplicate query terms in the query. Instead of
failing, the values should be combined.

In the future there should probably be some kind of query optimisation
that runs to execute queries in a smarter way, e.g. not querying for the
same term twice, but this is more complex than I want to tackle right
now.

Instead this change unblocks some current usecases for lunr and doesn't
close any doors to further query optimisations."
olivernn,2017-04-18 17:26:12,https://api.github.com/repos/olivernn/lunr.js/git/commits/7612f7f094fb6b8a63bd75645a79e722ad2af8af,7612f7f094fb6b8a63bd75645a79e722ad2af8af,Build version 2.0.2
olivernn,2017-04-18 17:07:08,https://api.github.com/repos/olivernn/lunr.js/git/commits/5114f6c764a8346cce96dc1a7498ab2a0d31d2d0,5114f6c764a8346cce96dc1a7498ab2a0d31d2d0,"Reduce term score precision in vectors

This change reduces the number of decimal places used to represent the
score of a term within a document vector. Through testing this has been
seen to not have any impact to the relevance of the search results but
does lead to a ~15% size reduction when serialising indexes, before and
after compression with gzip."
olivernn,2017-04-18 16:35:37,https://api.github.com/repos/olivernn/lunr.js/git/commits/356d25a98c5d67548c9c65799e151cc5b6e524d3,356d25a98c5d67548c9c65799e151cc5b6e524d3,"Make separator used in lexing match tokeniser

Previously only a space "" "" was considered a term separator when lexing
and parsing a search string. This did not match the tokenisers idea of
what was considered a token separator. This lead to issues where it was
not possible to search for some terms within an index. Specifically a
document containing a hyphenated token, e.g. ""foo-bar"" could not be
searched for as the query parser would convert this to two separate
terms ""foo"" and ""bar"" where as in the index this would be a single term
""foo-bar"".

This commit adds a property on the lunr.QueryLexer for the correct
separator to use, it currently points to lunr.tokenizer.separator so
that if a user changes the global separator for tokenising it will be
reflected when parsing queries. It may be required to make this more
configurable in the future, but for now this should suffice."
olivernn,2017-04-10 19:37:12,https://api.github.com/repos/olivernn/lunr.js/git/commits/2415207828a651a4661173a69adef0b152c63b49,2415207828a651a4661173a69adef0b152c63b49,Build version 2.0.1
olivernn,2017-04-10 19:25:35,https://api.github.com/repos/olivernn/lunr.js/git/commits/d624a2c25a5884cb4c0a5c36b4df361bfd58ae05,d624a2c25a5884cb4c0a5c36b4df361bfd58ae05,"Use objects without prototypes in lieu of HashMap

Lunr makes heavy use of objects in place of a native HashMap. In most
cases this is fine, but can cause problems when the keys to be stored
clash with properties in Object.prototype.

This change swaps the instances where we check for the existance of a
key within an object to use an object without prototype, created using
Object.create.

This has some implications for support in old browsers, they would need
to use a library that provides a polyfil for this behaviour of
Object.create. Most browsers now seem to support this so I think it is a
trade off worth making."
juanpicado,2017-04-09 20:46:10,https://api.github.com/repos/olivernn/lunr.js/git/commits/546bcfdbc47e48cf78fa8d0e88c78fbc51c265d8,546bcfdbc47e48cf78fa8d0e88c78fbc51c265d8,"Update README.mdown

Fix broken links"
olivernn,2017-04-09 14:30:44,https://api.github.com/repos/olivernn/lunr.js/git/commits/01a0241f637b75c0cc8a89d879e377561a37e59a,01a0241f637b75c0cc8a89d879e377561a37e59a,Build version 2.0.0
olivernn,2017-04-09 14:10:34,https://api.github.com/repos/olivernn/lunr.js/git/commits/86b1e525fc4400518912f619508ed9c1b8ba89e8,86b1e525fc4400518912f619508ed9c1b8ba89e8,Add some missing documentation to lunr.Builder.
olivernn,2017-04-05 18:58:34,https://api.github.com/repos/olivernn/lunr.js/git/commits/a390f8a4633d818d34765746ecc7bbc21ee3754f,a390f8a4633d818d34765746ecc7bbc21ee3754f,"Remove old example app

It served us well over the last few years, but the example now lives at
https://olivernn.github.io/moonwalkers/"
olivernn,2017-04-05 18:53:01,https://api.github.com/repos/olivernn/lunr.js/git/commits/b3ea607656a8a43b6a77eab39e00cd3a07797b40,b3ea607656a8a43b6a77eab39e00cd3a07797b40,Update README.mdown
olivernn,2017-04-03 18:30:10,https://api.github.com/repos/olivernn/lunr.js/git/commits/984c7a9be423e98b78f336da96f661264f627f1b,984c7a9be423e98b78f336da96f661264f627f1b,"Build and upload docs as part of travis build

Docs are a build artifact, and the current documentation build produces
tons of artifacts. This commit removes the docs from the repository and
moves the building and deployment of the documentation to travis."
olivernn,2017-03-13 17:34:26,https://api.github.com/repos/olivernn/lunr.js/git/commits/adb9e2242da5306f72d74ca6391adc82f8842eb0,adb9e2242da5306f72d74ca6391adc82f8842eb0,Remove accidental global from test
olivernn,2017-02-16 20:33:14,https://api.github.com/repos/olivernn/lunr.js/git/commits/3134c3c4a70671407aaa8a1659e7773b4c9f1f05,3134c3c4a70671407aaa8a1659e7773b4c9f1f05,Build version 2.0.0-alpha.5
olivernn,2017-02-16 20:24:38,https://api.github.com/repos/olivernn/lunr.js/git/commits/79e7d7bfb300bebfa7ceb564799e330c960a522c,79e7d7bfb300bebfa7ceb564799e330c960a522c,"Fix bug that allowed extra entries in token sets.

TokenSet#toString is used to identify candidates during minimisation.
Previously this was a recursive function that incorporated the finality
of a TokenSet, its edges and the toString of all its children.

This lead to a bug where TokenSets were minimised incorrectly, leading
to extraneous entries in the TokenSet. When these were looked up in the
inverted index, there was no corresponding entry, leading to no method
errors.

By giving each token set an auto incrementing id we can be sure when we
are referring to the same TokenSet during minimsation.

This issue was detected in https://github.com/olivernn/lunr.js/issues/68"
olivernn,2017-02-15 19:55:03,https://api.github.com/repos/olivernn/lunr.js/git/commits/bdd98d63d09294e1b57d8697b998e0ba361f3613,bdd98d63d09294e1b57d8697b998e0ba361f3613,Build version 2.0.0-alpha.4
olivernn,2017-02-15 19:51:07,https://api.github.com/repos/olivernn/lunr.js/git/commits/7e3f88764764984b766000d2b646a06b6b203dd9,7e3f88764764984b766000d2b646a06b6b203dd9,"Ensure that query terms are lower case.

The index stores all tokens as lower case, this is handled by the
tokeniser. Queries are not passed through the tokeniser though, instead
they are parsed by the QueryParser.

In this change the QueryParser is modified to down case all query terms,
this leaves any up case fields untouched.

Before this change a search term that in upper case would result in no
matches, even if a document contained that term. This is especially
confusing if the original document had the term in upper case."
olivernn,2017-02-12 18:58:01,https://api.github.com/repos/olivernn/lunr.js/git/commits/c6076d6fc3f4afecc4556b21a0edf93bf825b062,c6076d6fc3f4afecc4556b21a0edf93bf825b062,Build version 2.0.0-alpha.3
olivernn,2017-02-12 18:55:38,https://api.github.com/repos/olivernn/lunr.js/git/commits/53ea70cfb7e5095251764c5454ffbba1337b7147,53ea70cfb7e5095251764c5454ffbba1337b7147,"Add `use` method for applying plugins.

This is identical to the `use` method in previous versions of lunr."
olivernn,2017-01-18 17:33:27,https://api.github.com/repos/olivernn/lunr.js/git/commits/2db8cb7827bfd7f72e99e63abb6ee734498df174,2db8cb7827bfd7f72e99e63abb6ee734498df174,Build version 2.0.0-alpha.2
olivernn,2017-01-18 17:29:10,https://api.github.com/repos/olivernn/lunr.js/git/commits/2f940e0d8758b26340c822abda93187cbe68a2e6,2f940e0d8758b26340c822abda93187cbe68a2e6,Expose the version of lunr.
olivernn,2017-01-18 17:28:26,https://api.github.com/repos/olivernn/lunr.js/git/commits/e01318a6dc50a916488f3144631cbc0201597471,e01318a6dc50a916488f3144631cbc0201597471,"Yield builder to config function.

Fixes a regression from the previous version."
olivernn,2017-01-04 10:00:20,https://api.github.com/repos/olivernn/lunr.js/git/commits/7c9287f359fe7480f20e49a00fea7f2c9e11769d,7c9287f359fe7480f20e49a00fea7f2c9e11769d,Build version 2.0.0-alpha.1
olivernn,2017-01-04 09:50:40,https://api.github.com/repos/olivernn/lunr.js/git/commits/f8ce10004b84597cc0f21a75c86db39d62fd18d5,f8ce10004b84597cc0f21a75c86db39d62fd18d5,"Remove empty message detail from QueryParseError.

When there are problems parsing a boost or edit distance from a query
the lexeme found is a zero length string. The previous error messages
for these errors tried to indicate what was found by the parser, a zero
length string is not useful in these cases.

Arguably the parsing/lexing process could provide what was found instead
of the expected numbers, this is a larger change though."
olivernn,2017-01-04 09:50:40,https://api.github.com/repos/olivernn/lunr.js/git/commits/0f766754fbefb71d548fc70aadcbe5db45b0e71b,0f766754fbefb71d548fc70aadcbe5db45b0e71b,"Change structure of MatchData metadata.

Before it was not possible to know which term some metadata was
associated to. With this change the metadata is collection of metadata
addressable by term and field, e.g. metadata[term][field][key].

Specifically without this it made highlighting matches difficult as the
positions were not in order, after this change matches are grouped by
term and field and therefore are always in order.

This might make it slightly more hardwork for consumers to use the data
but as common access patters arise convinience methods can be added."
olivernn,2017-01-04 09:50:40,https://api.github.com/repos/olivernn/lunr.js/git/commits/748bd6bbb0674c022c398d02add801fb40779307,748bd6bbb0674c022c398d02add801fb40779307,"Fix bug when combining match data objects

If a match was found in multiple fields the metadata object of the
MatchData class would not have a key for the other field being combined.
This change adds checks and ensures that matches across multiple fields
are supported."
olivernn,2017-01-04 09:50:40,https://api.github.com/repos/olivernn/lunr.js/git/commits/97e777fbe126bbf7070767a9218446e63149dda2,97e777fbe126bbf7070767a9218446e63149dda2,Fix the test build.
olivernn,2016-09-25 17:13:20,https://api.github.com/repos/olivernn/lunr.js/git/commits/d0e503a11f8474fbdf6ee1fd34b07a99c49104d8,d0e503a11f8474fbdf6ee1fd34b07a99c49104d8,Only build on recent versions of node.
olivernn,2016-09-25 16:55:49,https://api.github.com/repos/olivernn/lunr.js/git/commits/484abdd4113738817e839bce70fd055c341aa99e,484abdd4113738817e839bce70fd055c341aa99e,"Ignore term index when calculating IDF.

The terms index is stored in the posting for a term. This is a special
field in the posting and shouldn't be treated as a document field."
olivernn,2016-09-25 16:31:30,https://api.github.com/repos/olivernn/lunr.js/git/commits/2a57c5334f2df69c8d41bceae1e5b6c66502342d,2a57c5334f2df69c8d41bceae1e5b6c66502342d,Remove build artifacts from version control.
olivernn,2016-09-25 16:21:28,https://api.github.com/repos/olivernn/lunr.js/git/commits/f102494581e021c41c030398d027ba364ab9ed73,f102494581e021c41c030398d027ba364ab9ed73,Update travis build definition.
olivernn,2016-09-13 19:07:55,https://api.github.com/repos/olivernn/lunr.js/git/commits/89914dc15e30c309a7e9698fc48ae94ce46eeb8d,89914dc15e30c309a7e9698fc48ae94ce46eeb8d,"Replace homebrew static server with node-static.

The old server.js static file server has been around since almost the
beginning, but its time to move on..."
olivernn,2016-09-13 19:01:26,https://api.github.com/repos/olivernn/lunr.js/git/commits/c2749abef10dcc597b11aebf812869ad806e903b,c2749abef10dcc597b11aebf812869ad806e903b,"Fix a lot of spelling mistakes.

I should really learn to spell :("
olivernn,2016-09-13 18:17:13,https://api.github.com/repos/olivernn/lunr.js/git/commits/da066368555bedf42cda663222d102e4b1778696,da066368555bedf42cda663222d102e4b1778696,"Add check for lunr version when deserialising.

There is no guarantee that an index serialised with one version of lunr
will correctly be de-serialised in another. Print a warning message in
these cases to help the user."
olivernn,2016-09-13 18:10:40,https://api.github.com/repos/olivernn/lunr.js/git/commits/5de4ef306458c61338df2d3936785650a4630a8d,5de4ef306458c61338df2d3936785650a4630a8d,"Ensure tokenization of arrays returns lunr.Token[].

This clears up a TODO that has been hanging around since the move to
lunr.Token over simple strings."
olivernn,2016-09-13 18:10:21,https://api.github.com/repos/olivernn/lunr.js/git/commits/c7e98b0db1a309c5f8d50a6e2f557f1c3626bd03,c7e98b0db1a309c5f8d50a6e2f557f1c3626bd03,Remove redundant TODO.
olivernn,2016-09-13 18:04:19,https://api.github.com/repos/olivernn/lunr.js/git/commits/6dd25bc2f12473835347b38d0da0b0aadcbe63e1,6dd25bc2f12473835347b38d0da0b0aadcbe63e1,"Tweak scoring calculation.

A few subtle tweaks to the scoring calculation. Also, adding setters on
the builder for the tuning parameters to ensure that they are within the
correct range."
olivernn,2016-09-13 17:03:17,https://api.github.com/repos/olivernn/lunr.js/git/commits/2fd406d7326cfcc8889c8ece6be91c8d29bbad2a,2fd406d7326cfcc8889c8ece6be91c8d29bbad2a,"Remove while(true) when lexing digit runs.

By removing a while(true) and replacing it with a loop that has a
condition as its terminator there is a noticeable performance boost for
queries with modifiers."
olivernn,2016-09-12 20:44:44,https://api.github.com/repos/olivernn/lunr.js/git/commits/144f9b2234ed167bb2db28cb8e4f01a17f63a64f,144f9b2234ed167bb2db28cb8e4f01a17f63a64f,"Dry IDF calculation.

Centralise the calculation of inverse document frequency, a single
function is shared between the builder and the index.

This also stops storing the IDF in the inverted index. This stored value
was never actually being used. By removing it we get a slight speed up
in the builder as well as a noticeable speed up in searching. A small
amount of space will also be saved when serialising and keeping the
index in memory."
olivernn,2016-09-06 17:05:55,https://api.github.com/repos/olivernn/lunr.js/git/commits/92965dc3efd5050f88c6cd35b7677381778df67c,92965dc3efd5050f88c6cd35b7677381778df67c,"Add search pipeline.

A default search pipeline contains just a stemmer. When searching terms
are passed through the search pipeline and the resulting strings are
used for lookups in the token set.

Some terms will not be passed through the pipeline, primarily those
which contain a wildcard, but any term can bypass the pipeline by
setting the relevant option on the query term."
olivernn,2016-08-28 17:25:01,https://api.github.com/repos/olivernn/lunr.js/git/commits/802bdd06090883949aafe83013a5379c924fe85c,802bdd06090883949aafe83013a5379c924fe85c,Adding documentation.
olivernn,2016-08-14 11:23:42,https://api.github.com/repos/olivernn/lunr.js/git/commits/7451357522dfad91de4b645e111af021b907aefd,7451357522dfad91de4b645e111af021b907aefd,Add support for dumping and loading indexes
olivernn,2016-08-13 20:07:29,https://api.github.com/repos/olivernn/lunr.js/git/commits/1d2c767c040b0b2a8c03caefbc3c5b81b5a10795,1d2c767c040b0b2a8c03caefbc3c5b81b5a10795,"Improve performance of lunr.TokenSet.fromArray

Caches the string representation of a token set once we know it has been
finalised, prevents continually recalculating the value when it will
never change. This leads to an order of magnitude increase in
performance when creating a TokenSet from an array."
olivernn,2016-08-13 20:05:38,https://api.github.com/repos/olivernn/lunr.js/git/commits/db80ca72698dbc2f8f4beb3cae5a43d452853150,db80ca72698dbc2f8f4beb3cae5a43d452853150,"Replace for-in with Object.keys and for loop.

To avoid de-optmisiation of the function under V8 this change removes
the for-in loop. The inverted index is likely to enter hash mode with
enough terms added."
olivernn,2016-08-13 17:27:32,https://api.github.com/repos/olivernn/lunr.js/git/commits/312ff52dd07d0ac3b1ef4575da458a109c30e19b,312ff52dd07d0ac3b1ef4575da458a109c30e19b,"Update benchmark tests for latest version.

Old benchmark tests were no longer relevant, this adds perf tests for
the new objects in this version of lunr.

It also improves the runner and allows them to be run in node."
olivernn,2016-07-31 17:58:59,https://api.github.com/repos/olivernn/lunr.js/git/commits/ada3d9d5116469a0a7d0d417a0a922ebf64df449,ada3d9d5116469a0a7d0d417a0a922ebf64df449,"Add linting and fix lint errors.

Enforce code style and check fo some bugs and issues."
olivernn,2016-07-31 17:57:07,https://api.github.com/repos/olivernn/lunr.js/git/commits/a2b2b2d924e1d0e1fcb5abfbc41c43e6e5466f49,a2b2b2d924e1d0e1fcb5abfbc41c43e6e5466f49,"Remove lunr.SortedSet.

It is no longer being used and should have been removed before."
olivernn,2016-07-31 14:50:29,https://api.github.com/repos/olivernn/lunr.js/git/commits/e8b899c790a2d6d144c9290feb602e466a06a5b9,e8b899c790a2d6d144c9290feb602e466a06a5b9,Replace Qunit with Mocha/Chai
olivernn,2016-07-31 10:17:34,https://api.github.com/repos/olivernn/lunr.js/git/commits/bbcba1fa4697419c184e0d6c080579fffa8d2cce,bbcba1fa4697419c184e0d6c080579fffa8d2cce,Fix leaking globals.
olivernn,2016-07-31 10:11:03,https://api.github.com/repos/olivernn/lunr.js/git/commits/f06af9cbceb4dbb4fb0d1b8a237b8a0a323ca0b1,f06af9cbceb4dbb4fb0d1b8a237b8a0a323ca0b1,Tests working in a browser.
olivernn,2016-07-30 20:59:03,https://api.github.com/repos/olivernn/lunr.js/git/commits/59621f564d7d1589091a4399d17b817cbb88d7f8,59621f564d7d1589091a4399d17b817cbb88d7f8,Convert search tests to Mocha/Chai
olivernn,2016-07-25 17:40:46,https://api.github.com/repos/olivernn/lunr.js/git/commits/016b50d2b3c845b0e697899dc1409a8be18aef79,016b50d2b3c845b0e697899dc1409a8be18aef79,Convert QueryParser test to mocha/chai.
olivernn,2016-07-24 16:11:10,https://api.github.com/repos/olivernn/lunr.js/git/commits/2064ee7c546ed5df1967180135f595e61a7f8643,2064ee7c546ed5df1967180135f595e61a7f8643,Simpler Mocha reporter and remove colour.
olivernn,2016-07-24 16:10:46,https://api.github.com/repos/olivernn/lunr.js/git/commits/71caf069da1c2e49670265c89dd1658cf871d03b,71caf069da1c2e49670265c89dd1658cf871d03b,Convert query lexer test to Mocha/Chai.
olivernn,2016-07-21 19:50:03,https://api.github.com/repos/olivernn/lunr.js/git/commits/5e070fab25e7a0122f562cd53e3b68071ca6e077,5e070fab25e7a0122f562cd53e3b68071ca6e077,Convert match data test to mocha/chai.
olivernn,2016-07-21 19:38:39,https://api.github.com/repos/olivernn/lunr.js/git/commits/6f556c87c4f69fe983e8d0232d832bf0a3e9fa89,6f556c87c4f69fe983e8d0232d832bf0a3e9fa89,Convert pipeline test to mocha/chai.
olivernn,2016-07-19 21:50:20,https://api.github.com/repos/olivernn/lunr.js/git/commits/7633c10e23f1e2a88186577c537f61c1b8542a0d,7633c10e23f1e2a88186577c537f61c1b8542a0d,Convert trimmer test to mocha/chai.
olivernn,2016-07-19 21:37:51,https://api.github.com/repos/olivernn/lunr.js/git/commits/fb65038c97a8ded28d34f7ea2bc32387395293d7,fb65038c97a8ded28d34f7ea2bc32387395293d7,Convert stopword filter test to mocha/chai.
olivernn,2016-07-19 21:31:58,https://api.github.com/repos/olivernn/lunr.js/git/commits/abdbe2046f641fbff193a05f9d548e0706d6cd0b,abdbe2046f641fbff193a05f9d548e0706d6cd0b,Convert stemming test to mocha/chai.
olivernn,2016-07-19 18:25:20,https://api.github.com/repos/olivernn/lunr.js/git/commits/b78550b2a49397f63ae9a831bb05d0b43db7cc56,b78550b2a49397f63ae9a831bb05d0b43db7cc56,Convert Vector test to mocha/chai.
olivernn,2016-07-16 20:58:46,https://api.github.com/repos/olivernn/lunr.js/git/commits/15dfbb2a8c1e120e4f19ba6966098d88bf3a5b95,15dfbb2a8c1e120e4f19ba6966098d88bf3a5b95,Translate pipeline tests.
