olivernn,2016-07-16 16:35:46,https://api.github.com/repos/olivernn/lunr.js/git/commits/93dd6bbb94153e27c6b65f5a75ccf4138fca8bbf,93dd6bbb94153e27c6b65f5a75ccf4138fca8bbf,wip! start migrating test files to mocha
olivernn,2016-07-16 16:35:07,https://api.github.com/repos/olivernn/lunr.js/git/commits/4f7f4bcd5827fccbb1fdcbc1d8f4aaf256785ff6,4f7f4bcd5827fccbb1fdcbc1d8f4aaf256785ff6,Add mocha and chai as dev dependencies.
olivernn,2016-07-16 16:31:04,https://api.github.com/repos/olivernn/lunr.js/git/commits/709fc29b964d9c59824da634068b404268a04372,709fc29b964d9c59824da634068b404268a04372,"Makefile fixes.

Start using the correct list of sources for this version."
olivernn,2016-07-11 17:27:10,https://api.github.com/repos/olivernn/lunr.js/git/commits/648bcadcf9009a16da740732fd4cfb88a778b646,648bcadcf9009a16da740732fd4cfb88a778b646,Apply term boosts when performing a search.
olivernn,2016-07-11 17:04:46,https://api.github.com/repos/olivernn/lunr.js/git/commits/ba286686367d0fd0f68393826de26ab128aef3e5,ba286686367d0fd0f68393826de26ab128aef3e5,Adding search tests.
olivernn,2016-07-09 17:00:28,https://api.github.com/repos/olivernn/lunr.js/git/commits/a5e664af1d61b9899094baaae4b634de001cecdf,a5e664af1d61b9899094baaae4b634de001cecdf,Provide an easy way to search by a query string.
olivernn,2016-07-09 16:59:27,https://api.github.com/repos/olivernn/lunr.js/git/commits/5ffbb19f4e2b031ad20cb5e637a8171c61c6eaf0,5ffbb19f4e2b031ad20cb5e637a8171c61c6eaf0,"TokenSet can be created from a query clause.

Convinience function for creating a token set from the query clause,
takes into account any edit distance attached to the clause and
delegates to either the edit distance or plain string constructor."
olivernn,2016-07-09 16:55:40,https://api.github.com/repos/olivernn/lunr.js/git/commits/0eb8c2771046a08a504894443a4b1cf6ec756b35,0eb8c2771046a08a504894443a4b1cf6ec756b35,"Provide an interface for adding clauses to query.

Allows the parser to ensure the right fields are attached to each query,
and allows end users some more control also."
olivernn,2016-07-09 16:17:33,https://api.github.com/repos/olivernn/lunr.js/git/commits/822fb782c014a930860fb2c04d16c669b47da04e,822fb782c014a930860fb2c04d16c669b47da04e,wip! working query parser.
olivernn,2016-05-02 13:03:19,https://api.github.com/repos/olivernn/lunr.js/git/commits/ef29e11f52ccab51ff213f2b508fde8be6441f72,ef29e11f52ccab51ff213f2b508fde8be6441f72,WIP: first implementation of query lexer.
olivernn,2016-05-02 10:26:35,https://api.github.com/repos/olivernn/lunr.js/git/commits/71ee154fe7060b01028f1043938883747c01130b,71ee154fe7060b01028f1043938883747c01130b,Tests for MatchData.
olivernn,2016-05-02 10:25:07,https://api.github.com/repos/olivernn/lunr.js/git/commits/2eab116f5c1b555bf364f4e56262a60b1ed2ccae,2eab116f5c1b555bf364f4e56262a60b1ed2ccae,"Remove some per-field data.

We are scoring the entire document all the time, so we only need
document vectors for the whole document, not each individual field. This
also simplifies the average length data and idf calculation."
olivernn,2016-05-02 08:23:52,https://api.github.com/repos/olivernn/lunr.js/git/commits/4277cdef3fa3383c35949d0f93774bbb7812f22c,4277cdef3fa3383c35949d0f93774bbb7812f22c,Basis of runnng more complex queries.
olivernn,2016-04-25 19:00:13,https://api.github.com/repos/olivernn/lunr.js/git/commits/a3459002245eb2883020d72cdf5d0fc70ce35c62,a3459002245eb2883020d72cdf5d0fc70ce35c62,Adding metadata about a token to inverse index.
olivernn,2016-04-25 18:59:46,https://api.github.com/repos/olivernn/lunr.js/git/commits/49e3437ad49f48d2c614ee5a5e4fddaf98114225,49e3437ad49f48d2c614ee5a5e4fddaf98114225,Remove the use of arguments from tokenizer.
olivernn,2016-04-25 18:23:19,https://api.github.com/repos/olivernn/lunr.js/git/commits/9032fb97c3810f8592cf283ce6cc0099f30154bd,9032fb97c3810f8592cf283ce6cc0099f30154bd,Storing token position and index.
olivernn,2016-04-25 17:50:46,https://api.github.com/repos/olivernn/lunr.js/git/commits/9b377abb42612b2e762683633343fd1613a9c384,9b377abb42612b2e762683633343fd1613a9c384,Integrate lunr.Token into pipeline.
olivernn,2016-04-18 21:11:08,https://api.github.com/repos/olivernn/lunr.js/git/commits/0386b479919da400bbd1b76b726e2bf189482779,0386b479919da400bbd1b76b726e2bf189482779,Add transpose support for fuzzy strings.
olivernn,2016-04-17 16:40:58,https://api.github.com/repos/olivernn/lunr.js/git/commits/ca3d78225e285893d3dcc2c7ba62680206ef09e4,ca3d78225e285893d3dcc2c7ba62680206ef09e4,"Add Levenshtein automaton to TokenSet.

Allows for 'fuzzy' searches by representing a set of tokens which are a
specified edit distance away from a given string. This token set can be
intersected against any other token set as before.

Currently the following edits are considered at unit cost:
* insertion
* deletion
* substitution"
olivernn,2016-04-14 20:00:08,https://api.github.com/repos/olivernn/lunr.js/git/commits/8fba0584b5b4930871ff1a29bb11614c1a991937,8fba0584b5b4930871ff1a29bb11614c1a991937,"Out with the old, in with the new..."
olivernn,2016-04-12 20:51:09,https://api.github.com/repos/olivernn/lunr.js/git/commits/ed4bd61938de43dc245857be1c521a2ad5661ed8,ed4bd61938de43dc245857be1c521a2ad5661ed8,More hash like object iteration tweaks.
olivernn,2016-04-12 20:06:35,https://api.github.com/repos/olivernn/lunr.js/git/commits/3cd1527420063cfa3e1af787f7d7f60c28ef6481,3cd1527420063cfa3e1af787f7d7f60c28ef6481,"Prevent Builder#idf from being deoptimised.

Must not shadow a non local variable when using a for-in loop."
olivernn,2016-04-12 20:03:23,https://api.github.com/repos/olivernn/lunr.js/git/commits/b113639e548379b89da9d5559ab250ae322a1346,b113639e548379b89da9d5559ab250ae322a1346,"Performance tweaks for TokenSet#intersect.

More changes related to objects entering 'hash' mode and defeating V8s
optimisations. Iterating over these hash like objects is more performant
when using Object.keys and a for loop rather than the more vanilla
for-in loop."
olivernn,2016-04-11 20:23:32,https://api.github.com/repos/olivernn/lunr.js/git/commits/42f87975b4d3d54ab6d25050027614aaad9c7964,42f87975b4d3d54ab6d25050027614aaad9c7964,"Allow TokenSet#toString to be optimised by V8.

The token set object contains an object `edges` that is being used as a
hash. This prevents V8 from optimising the function [1]. Knowing that
the `edges` object is always 'hash like' we get all its keys using
Object.keys and iterate this list using a regular for loop.

Some quick benchmarks showed a small increase in performance from this,
but the function is now being optimised, which means that we should be
able to get 'free' performance improvements from V8, and possibly other
JavaScript engines, in the future.

[1]
http://stackoverflow.com/questions/24414809/iterating-through-javascript-hashtable-without-causing-optimization-loss"
olivernn,2016-03-21 10:45:53,https://api.github.com/repos/olivernn/lunr.js/git/commits/027dc4867eb0fc59b240a5e351a5f9da90c5f6d7,027dc4867eb0fc59b240a5e351a5f9da90c5f6d7,"Small performance improvement in search method.

Only iterate over the matching document refs one less time."
olivernn,2016-03-21 10:44:54,https://api.github.com/repos/olivernn/lunr.js/git/commits/54fb3f48b65e98100c2f12b996ea1e14609f057d,54fb3f48b65e98100c2f12b996ea1e14609f057d,Adding some tests for the builder object.
olivernn,2016-03-20 19:16:58,https://api.github.com/repos/olivernn/lunr.js/git/commits/c2a25f20e989d7d6ef8c15b49788972da026a225,c2a25f20e989d7d6ef8c15b49788972da026a225,Add some tests for the token set object.
olivernn,2016-03-20 19:13:39,https://api.github.com/repos/olivernn/lunr.js/git/commits/cfb3e0b44ceac1b9afe43a6028eae5ac19ecb9e7,cfb3e0b44ceac1b9afe43a6028eae5ac19ecb9e7,Rename FSA to TokenStore.
olivernn,2016-03-20 19:07:13,https://api.github.com/repos/olivernn/lunr.js/git/commits/a8e22a8ea7c06f800081c4e811ff4856fb5e3044,a8e22a8ea7c06f800081c4e811ff4856fb5e3044,Fixes for the FSA object.
olivernn,2016-03-20 19:04:54,https://api.github.com/repos/olivernn/lunr.js/git/commits/94b2000687af1b07e7e96b118bdb67fd1552d115,94b2000687af1b07e7e96b118bdb67fd1552d115,"Change the way an FSA is created.

Convinience constructor for creating FSA from an Array. This delegates
the actual construction to the FSABuilder object."
olivernn,2016-03-20 19:01:03,https://api.github.com/repos/olivernn/lunr.js/git/commits/a8cdde57b1dfc1e98ced9950837656dc0000605a,a8cdde57b1dfc1e98ced9950837656dc0000605a,"Remove prototype search from the builder class.

This was only here whilst putting together the prototype of the index
builder, search will be a responsibility of the index class."
olivernn,2016-03-16 19:27:36,https://api.github.com/repos/olivernn/lunr.js/git/commits/cf4efe771bd2435c4a07057bc3ddccab12038f7c,cf4efe771bd2435c4a07057bc3ddccab12038f7c,fix! fix a bug where idf was calculated to be NaN.
olivernn,2016-03-15 20:31:08,https://api.github.com/repos/olivernn/lunr.js/git/commits/5d6dcd6be5b0a9c2170414696ec80df37265f537,5d6dcd6be5b0a9c2170414696ec80df37265f537,"wip! inverted index does not contain ALL

Can also search by field.

Still need to clean things up quite a bit here though."
olivernn,2016-03-14 20:48:46,https://api.github.com/repos/olivernn/lunr.js/git/commits/ec0f0e25bc5db2c14b3c2d6317c48124a236fffc,ec0f0e25bc5db2c14b3c2d6317c48124a236fffc,"Refactor Vector implementation.

Instead of using a linked list we use a flat array where the odd
elements are the indexes and the even elements are the values.

This roughly halves the amount of space required for the vector,
sacrificing a very small amount of performance. The _very_ small
performance drop during calculating the dot product surprised me, I
would have thought it would have been quicker, calculating the magniture
is about twice as quick though with this implementation."
olivernn,2016-03-13 19:11:03,https://api.github.com/repos/olivernn/lunr.js/git/commits/9a6dd9be98a996226a2e443ca4279d081d204f57,9a6dd9be98a996226a2e443ca4279d081d204f57,wip! almost at parity with 0.x branch
olivernn,2016-03-13 13:58:07,https://api.github.com/repos/olivernn/lunr.js/git/commits/da36e00c448d2a8eaaf8d1f541a6804bdc139a3f,da36e00c448d2a8eaaf8d1f541a6804bdc139a3f,wip! New index is now searchable.
olivernn,2016-03-13 13:09:52,https://api.github.com/repos/olivernn/lunr.js/git/commits/1c493fa0873d01a33a53af07b2bb5f1ebb4d95b7,1c493fa0873d01a33a53af07b2bb5f1ebb4d95b7,Add fsa storing the entire corpus terms.
olivernn,2016-03-13 12:05:59,https://api.github.com/repos/olivernn/lunr.js/git/commits/27945dd6059a82e3c0b0a4d8ac95b5b166255c6a,27945dd6059a82e3c0b0a4d8ac95b5b166255c6a,wip! re-structuring the index building
olivernn,2016-03-08 17:02:24,https://api.github.com/repos/olivernn/lunr.js/git/commits/be602d77e3efca2048fa6c7849fedda33bcfc344,be602d77e3efca2048fa6c7849fedda33bcfc344,wip! implementing basic search and scoring.
olivernn,2016-02-24 19:20:57,https://api.github.com/repos/olivernn/lunr.js/git/commits/6e2bd7a5e0bae75d6fbae9c86a71341b9080ac48,6e2bd7a5e0bae75d6fbae9c86a71341b9080ac48,wip! calculating term weights in builder
olivernn,2016-02-23 16:55:48,https://api.github.com/repos/olivernn/lunr.js/git/commits/510a57d06c284f26a1aac7edb5e29ac90f29bc6c,510a57d06c284f26a1aac7edb5e29ac90f29bc6c,wip! beginings of the builder.
olivernn,2016-02-20 10:24:21,https://api.github.com/repos/olivernn/lunr.js/git/commits/0320a0ec3ab43ab02caf557775593a6a6aa1c49b,0320a0ec3ab43ab02caf557775593a6a6aa1c49b,"Add lunr.Token

lunr.Token encapsulates a token, and its metadata, whilst it is passing
through the processing pipeline. A token can be modified, whilst
maintaining any metadata present. It can also be cloned when a token
needs to be expanded into multiple tokens."
olivernn,2016-02-20 10:02:53,https://api.github.com/repos/olivernn/lunr.js/git/commits/e5a0ba8391e2d4d0018b699b922c5ab62f2849a4,e5a0ba8391e2d4d0018b699b922c5ab62f2849a4,"Pipeline functions can expand tokens.

A pipeline function can expand a token into multiple tokens that will be
passed to following pipeline functions as regular tokens."
olivernn,2017-02-21 18:59:17,https://api.github.com/repos/olivernn/lunr.js/git/commits/20789e26f3732188216d7faf6dafb0a3656f4703,20789e26f3732188216d7faf6dafb0a3656f4703,Build version 1.0.0
olivernn,2017-02-21 18:52:37,https://api.github.com/repos/olivernn/lunr.js/git/commits/364cedaabd3c1674484f2898cb42e4dfaaab1c65,364cedaabd3c1674484f2898cb42e4dfaaab1c65,"Remove incorrectly spelt lunr.tokenizer.separator.

This completes the deprecation started in release 0.7.2 introduced by
this commit c1686768f93ff73ebb08f82bc245e850face0554."
olivernn,2017-01-04 09:42:02,https://api.github.com/repos/olivernn/lunr.js/git/commits/5aeff2b1c8fbfa352be30e67401a2959c7e0cfc4,5aeff2b1c8fbfa352be30e67401a2959c7e0cfc4,Add npm package install details.
olivernn,2016-10-18 20:44:32,https://api.github.com/repos/olivernn/lunr.js/git/commits/6a978d1ebf1a0c08e1a76cd4f7f74ad5490e5937,6a978d1ebf1a0c08e1a76cd4f7f74ad5490e5937,Fix package.json version.
olivernn,2016-10-18 20:37:02,https://api.github.com/repos/olivernn/lunr.js/git/commits/b9cc6b97e7a1f0e3855867544195ebdfc3a8198f,b9cc6b97e7a1f0e3855867544195ebdfc3a8198f,Build version 0.7.2
olivernn,2016-10-18 20:32:45,https://api.github.com/repos/olivernn/lunr.js/git/commits/f4cd3b0031f8bcd777644d3b2fe96566019eb648,f4cd3b0031f8bcd777644d3b2fe96566019eb648,"Fix bug when loading a serialised tokenizer.

Instead of loading the serialised tokenizer the setter property was
being set."
olivernn,2016-10-18 20:30:46,https://api.github.com/repos/olivernn/lunr.js/git/commits/00111124c783569dd4c4f71c3ebf4634b7f74ee3,00111124c783569dd4c4f71c3ebf4634b7f74ee3,"Upgrade PhantomJS.

Yes, the previous version was probably very old, but it worked. A fresh
install of the dependencies failed trying to install phantomjs. I don't
know how this happens, but it's pretty borked and I don't have time to
fix this now.

Instead upgrading to the next minor version resolves the problem."
olivernn,2016-10-18 20:00:06,https://api.github.com/repos/olivernn/lunr.js/git/commits/c1686768f93ff73ebb08f82bc245e850face0554,c1686768f93ff73ebb08f82bc245e850face0554,"Correct spelling of separator.

So, I cannot spell :(

Sadly this mispelling was in the public API for customising the
separator for the tokenizer. Backwards compatibility is retained by
keeping the misspelt property, but preferring the correctly spelt
separator property.

Integrations that make use of the old property will still work, but this
property is now deprecated and will be removed in the next major version
release. Customising the tokenizer should be done by setting the new
property - lunr.tokenizer.separator.

On the plus side maybe this will help me remember to spell separator
correctly from now on!"
olivernn,2016-05-18 17:57:08,https://api.github.com/repos/olivernn/lunr.js/git/commits/0676ef9f0bacbc30aebf0a2f3bf016d35287b841,0676ef9f0bacbc30aebf0a2f3bf016d35287b841,Build version 0.7.1
olivernn,2016-05-18 17:35:33,https://api.github.com/repos/olivernn/lunr.js/git/commits/ee098eb9913a41d378b09eb4901eed43d61c573d,ee098eb9913a41d378b09eb4901eed43d61c573d,Specify the license when using jsdoc @license tag.
olivernn,2016-03-08 18:14:04,https://api.github.com/repos/olivernn/lunr.js/git/commits/660055baff47aef36720d7cf798901d09972d069,660055baff47aef36720d7cf798901d09972d069,Build version 0.7.0
olivernn,2016-03-08 18:08:06,https://api.github.com/repos/olivernn/lunr.js/git/commits/16ec62e4bb56c54ec218af48408f0857723fa09d,16ec62e4bb56c54ec218af48408f0857723fa09d,Update perf test fixtures.
olivernn,2016-02-23 18:30:50,https://api.github.com/repos/olivernn/lunr.js/git/commits/fa28620689e2050b92923d420413203db6c5a03f,fa28620689e2050b92923d420413203db6c5a03f,"Make tokenizer a property of an index.

Before this change the tokenizer was a global property of lunr, every
index would use the same tokenizer. It was possible to change the
tokenizer but not on a per index basis.

This change gives each instance of lunr.Index its own tokenzier,
defaulting to the existing lunr.tokenizer implementation. Each index can
change the tokenizer it uses without affecting any other index instance.

To ensure that indexes with custom tokenizers can be serialied and
de-serialised custom tokenizers can be regsitered in much the same way
as a custom text processing function is registered in lunr.Pipeline."
d0ugal,2016-03-04 21:01:14,https://api.github.com/repos/olivernn/lunr.js/git/commits/d396ad666bd14cc068db8da818320e00fcfa24c3,d396ad666bd14cc068db8da818320e00fcfa24c3,"Improve the performance of Index.add.

The loops in Index.add can easily be called hundreds of thousands of times for
large documents. Larger documents can perform particularly badly[1] under
Chrome. Removing the usage of reduce and filter in favour of inline native for
loops can lead to a 20-30% performance increase in Chrome. Firefox also sees a
similar but much smaller impovement (~5%).

[1]: https://github.com/mkdocs/mkdocs/issues/859#issuecomment-192187096"
olivernn,2015-10-26 17:55:57,https://api.github.com/repos/olivernn/lunr.js/git/commits/c0e5def0dfc46ca4c8ba33a6c1831e4de0fb7544,c0e5def0dfc46ca4c8ba33a6c1831e4de0fb7544,Build version 0.6.0
olivernn,2015-10-26 17:44:04,https://api.github.com/repos/olivernn/lunr.js/git/commits/73397871425ee0905c624888d559d2cf6d7c1732,73397871425ee0905c624888d559d2cf6d7c1732,Fix error message in release script.
olivernn,2015-10-26 17:28:07,https://api.github.com/repos/olivernn/lunr.js/git/commits/ab45a589806d866b0f41f4638f9cfc022be555e1,ab45a589806d866b0f41f4638f9cfc022be555e1,"Parameterise the tokenizer string seperator.

Make it easier to change the boundaries on which strings are split into
tokens."
olivernn,2015-10-25 13:02:44,https://api.github.com/repos/olivernn/lunr.js/git/commits/de93eae6b8f7731bf06285212ae7e01d9d8a4b85,de93eae6b8f7731bf06285212ae7e01d9d8a4b85,"Allow tokenization of arrays with null values.

If the array passed to the tokenizer contains some null or undefined
values the tokenizer should not explode. Instead an empty string should
be returned."
olivernn,2015-10-25 13:00:51,https://api.github.com/repos/olivernn/lunr.js/git/commits/599d6935e53fbb182f42ed52959c85cc4b2632a3,599d6935e53fbb182f42ed52959c85cc4b2632a3,"Add lunr.utils.asString function.

Delegates to `Object.prototype.toString` on all object except for null
and undefined which return an empty string. This behaviour is more
deisreable (to me) than having `undefined` and `null` converted to the
strings `""undefined""` and `""null""`"
olivernn,2015-10-25 11:37:47,https://api.github.com/repos/olivernn/lunr.js/git/commits/f2e8f97cb31dc5749720bebaff2f8f7ec9081951,f2e8f97cb31dc5749720bebaff2f8f7ec9081951,"Move empty token filter from trimmer to pipeline.

The pipeline should ensure that the index gets clean data to work with,
in this case clean data means that no token should be empty. The
pipeline already included logic to filter out tokens that are undefined.
The pipeline function lunr.trimmer contained logic to exclude empty
strings.

The implementation of trimmer is not generic enough to be used with all
languages, specifically non latin character languages are not well
handled by the current implementation, and therefore in some cases users
choose to omit the trimmer from their pipeline. This can lead to issues
where empty tokens are introduced into the index.

This change moves the logic for filtering out empty tokens from the
trimmer to the pipeline itself, in the same way that the pipeline
removes undefined tokens, it now also removes empty tokens. With this
change the pipeline will guarantee that the index sees clean data,
regardless of whether the trimmer is part of the pipeline, it also
allows the trimmer function to be more focused on just trimming
whitespace."
jkellerer,2015-10-19 16:06:08,https://api.github.com/repos/olivernn/lunr.js/git/commits/700f9cb6329b9f007378f9b5729f0468d4dccbd2,700f9cb6329b9f007378f9b5729f0468d4dccbd2,Replaced array-like String access with ES3 compatible counterpart String.charAt(idx)
olivernn,2015-09-28 17:15:14,https://api.github.com/repos/olivernn/lunr.js/git/commits/2575d428aa8a642bd1be4b275044f84d68b06383,2575d428aa8a642bd1be4b275044f84d68b06383,"Add lunr.generateStopWordFilter function.

Provide a stopWordFiter generator that returns a pipeline compatible
function that can act as a stopWordFilter. This generator is used to
generate the default, English, stopWordFilter for lunr."
olivernn,2015-08-24 16:01:47,https://api.github.com/repos/olivernn/lunr.js/git/commits/555e99e032887dd96ab2328a7e17fc86740f3eeb,555e99e032887dd96ab2328a7e17fc86740f3eeb,"Ensure doc refs are not returned as strings.

Object properties are kept as strings so just using those for the doc
refs means all returned refs are strings. To return the same type of key
as was passed we must look at the ref property from the token store."
olivernn,2015-08-09 10:19:30,https://api.github.com/repos/olivernn/lunr.js/git/commits/8f59978e1b0973b0882f2f56abba9b79ac6b18d2,8f59978e1b0973b0882f2f56abba9b79ac6b18d2,Build version 0.5.12
janeisklar,2015-07-29 13:28:15,https://api.github.com/repos/olivernn/lunr.js/git/commits/900bad2d05f2c4ddb8023fb0be308c9a91e0bd99,900bad2d05f2c4ddb8023fb0be308c9a91e0bd99,"Trimmer should filter out empty tokens.

Adding empty tokens to the index will cause errors. This was prevented
by the stop word filter but in some use cases the stop word filter is
removed. In these cases the trimmer must ensure that it does not
introduce empty tokens."
bvaughn,2015-08-02 17:45:32,https://api.github.com/repos/olivernn/lunr.js/git/commits/6540a6ce2435be81ea90a9e33b8cfc80e44d4d7c,6540a6ce2435be81ea90a9e33b8cfc80e44d4d7c,"Convert stop word filter from SortedSet to Object.

All stop words tests pass after this change. This change improves
performance of the stop word filter as demonstrated by the following
benchmarks:

* http://jsperf.com/lunr-stop-words-object/4"
olivernn,2015-07-08 17:09:27,https://api.github.com/repos/olivernn/lunr.js/git/commits/c06ac7851d20dc54d8cfd0dbc043fc2dd1f82d7f,c06ac7851d20dc54d8cfd0dbc043fc2dd1f82d7f,Build version 0.5.11
olivernn,2015-07-08 17:08:16,https://api.github.com/repos/olivernn/lunr.js/git/commits/31e53678892a0acdb020f78cfd7a434832979f87,31e53678892a0acdb020f78cfd7a434832979f87,"Use git describe to get the previous tag.

Tags do not sort numerically, so when the patch version is greater than
9 it messes up the checking of what has changed."
olivernn,2015-07-08 17:02:30,https://api.github.com/repos/olivernn/lunr.js/git/commits/4a7ba88bdd83e35f7f6e54b3d5c5eacb560da90b,4a7ba88bdd83e35f7f6e54b3d5c5eacb560da90b,"Add semicolon around unminified build.

Semicolons appear in the minified build but not as part of the
unminified build, this breaks some projects that use the unminified
build as part of their own build system. Fixes #162."
olivernn,2015-06-14 12:25:09,https://api.github.com/repos/olivernn/lunr.js/git/commits/b1ca7b945b0edb82593c10600f65083c7ce6f3d4,b1ca7b945b0edb82593c10600f65083c7ce6f3d4,Build version 0.5.10
olivernn,2015-06-14 12:16:09,https://api.github.com/repos/olivernn/lunr.js/git/commits/c02425ee09ece6405b8f9a4a599cbb0ef1876a9a,c02425ee09ece6405b8f9a4a599cbb0ef1876a9a,Add latest node version on travis.
olivernn,2015-06-14 12:08:23,https://api.github.com/repos/olivernn/lunr.js/git/commits/8a98a39cf7bb7913e32d45fac4a96eb15b9325ec,8a98a39cf7bb7913e32d45fac4a96eb15b9325ec,Update link for augment.js
cvan,2014-09-22 23:38:59,https://api.github.com/repos/olivernn/lunr.js/git/commits/3997412858b87e8500bcd2ee04fff938b278e725,3997412858b87e8500bcd2ee04fff938b278e725,rename `handler` to `fn` in `event_emitter`/`index` comments
kkirsche,2015-06-11 01:02:44,https://api.github.com/repos/olivernn/lunr.js/git/commits/fd22e30cbf3430ea4017c491203b7eac052bba60,fd22e30cbf3430ea4017c491203b7eac052bba60,"Remove moot `version` property from bower.json

Per bower/bower.json-spec@a325da3"
olivernn,2015-06-14 11:58:24,https://api.github.com/repos/olivernn/lunr.js/git/commits/463055f49044d3ef52762a7c8fae86ff3742c28e,463055f49044d3ef52762a7c8fae86ff3742c28e,"Fix bug in IDF calculation.

Before the total number of tokens was being used instead of the total
number of documents."
olivernn,2015-04-28 19:45:07,https://api.github.com/repos/olivernn/lunr.js/git/commits/ce9f8ba1eac4d2d1b8d942d26c8730908aab073b,ce9f8ba1eac4d2d1b8d942d26c8730908aab073b,Build version 0.5.9
olivernn,2015-04-28 19:39:40,https://api.github.com/repos/olivernn/lunr.js/git/commits/e3c4409e16ba192cef6d79058909876c7496a07f,e3c4409e16ba192cef6d79058909876c7496a07f,Merge branch 'pr/149'
weixsong,2015-04-28 02:01:30,https://api.github.com/repos/olivernn/lunr.js/git/commits/4e84147ec15729aa85d87c186a992c059acffe7c,4e84147ec15729aa85d87c186a992c059acffe7c,"issue 147, fix pipeline issue, add test cases"
olivernn,2015-04-28 19:35:05,https://api.github.com/repos/olivernn/lunr.js/git/commits/950e96ec4817f87205dd1985f84f7af4603a914e,950e96ec4817f87205dd1985f84f7af4603a914e,"Cut recursion in SortedSet#indexOf & locationFor.

Reduce the overhead of recursive function calls from SortedSet#indexOf
and SortedSet#locationFor. On their own these changes make a
considerable performance gain, this improvement is more modest in the
context of the public Index#search and Index#add interface but is still
noticeable.

As well as the speed performance this change should also prevent these
methods blowing the stack on very large SortedSets."
olivernn,2015-04-09 20:01:35,https://api.github.com/repos/olivernn/lunr.js/git/commits/303fecccca3619b111d5cc421d090dc5300eee47,303fecccca3619b111d5cc421d090dc5300eee47,"Merge pull request #144 from gitter-badger/gitter-badge

Add a Gitter chat badge to README.mdown"
gitter-badger,2015-04-09 19:58:10,https://api.github.com/repos/olivernn/lunr.js/git/commits/76210db8a6a45ca148cdaf4d0dfbdb2c7c41fc35,76210db8a6a45ca148cdaf4d0dfbdb2c7c41fc35,Added Gitter badge
