danmosemsft,2015-07-16 06:22:47,https://api.github.com/repos/sokolovstas/SublimeWebInspector/git/commits/c50e209ce7741de8cb75eab57210f85d34c08b83,c50e209ce7741de8cb75eab57210f85d34c08b83,Fix issue where toggling a BP on a nameless view corrupted BPs
danmosemsft,2015-07-16 04:51:33,https://api.github.com/repos/sokolovstas/SublimeWebInspector/git/commits/9e7622945f0120e762da8c385dcd881872dced89,9e7622945f0120e762da8c385dcd881872dced89,Remove more unnecessary set timeouts
danmosemsft,2015-07-16 04:39:14,https://api.github.com/repos/sokolovstas/SublimeWebInspector/git/commits/86f2cd92a3c16803b5e2ffe9bd50e5fbf76a00aa,86f2cd92a3c16803b5e2ffe9bd50e5fbf76a00aa,Move error msg to main thread
danmosemsft,2015-07-16 04:36:56,https://api.github.com/repos/sokolovstas/SublimeWebInspector/git/commits/a2236c3df3d7ae09edbea6eb946bdb60fb435c2c,a2236c3df3d7ae09edbea6eb946bdb60fb435c2c,Move open and close callbacks to main thread
danmosemsft,2015-07-16 02:40:21,https://api.github.com/repos/sokolovstas/SublimeWebInspector/git/commits/c622a3d59d21abab5410c7449020d0bf7694d9a6,c622a3d59d21abab5410c7449020d0bf7694d9a6,"Change the callbacks from the channel (in Protocol.py) to call
the implementations (in swi.py) using set_timeout.
This ensures the call is on the main thread, not the websocket thread.
Can now remove most of the set_timeouts in swi.py."
danmosemsft,2015-07-16 00:47:34,https://api.github.com/repos/sokolovstas/SublimeWebInspector/git/commits/583f3ae827004341df5130b5d9c79cf65b8734a7,583f3ae827004341df5130b5d9c79cf65b8734a7,Fix reload page
danmosemsft,2015-07-15 21:39:42,https://api.github.com/repos/sokolovstas/SublimeWebInspector/git/commits/a0255ca389556fd2305331e34fac946f06a8024b,a0255ca389556fd2305331e34fac946f06a8024b,remove dead function
danmosemsft,2015-07-15 19:56:36,https://api.github.com/repos/sokolovstas/SublimeWebInspector/git/commits/1ffb84f40fec1284435dbd0504942e0abaddb0ea,1ffb84f40fec1284435dbd0504942e0abaddb0ea,fix typo
danmosemsft,2015-07-15 19:52:46,https://api.github.com/repos/sokolovstas/SublimeWebInspector/git/commits/c1943197f217f58bdbd54d4c03d95e9e41d805cb,c1943197f217f58bdbd54d4c03d95e9e41d805cb,Make F5 start Chrome if it's not already started
danmosemsft,2015-07-15 18:30:47,https://api.github.com/repos/sokolovstas/SublimeWebInspector/git/commits/0e034aa2f2f802559bc79653415f8468b8e55828,0e034aa2f2f802559bc79653415f8468b8e55828,Update key maps for new function name
danmosemsft,2015-07-15 18:12:09,https://api.github.com/repos/sokolovstas/SublimeWebInspector/git/commits/471c07ef84e66963274a6be2a41de5e041a2467f,471c07ef84e66963274a6be2a41de5e041a2467f,"Close any 'file mappings' window on
* launch chrome
* start debugging
* end debugging

I want to also close it on plugin_loaded (as soon as possible after
Sublime starts) but it doesn't work in plugin_loaded. I don't know
how to attach a debugger before plugin_loaded so I haven't solved
that yet."
danmosemsft,2015-07-15 17:16:52,https://api.github.com/repos/sokolovstas/SublimeWebInspector/git/commits/e352169ff40ce6ed0245ca64afafb245cb57e77e,e352169ff40ce6ed0245ca64afafb245cb57e77e,Extract Protocol class from swi.py
danmosemsft,2015-07-15 04:16:06,https://api.github.com/repos/sokolovstas/SublimeWebInspector/git/commits/ebc11f0b7a741b2b2a4ca2ddf132180af1303d05,ebc11f0b7a741b2b2a4ca2ddf132180af1303d05,Fix resume button. Overlooked in rename
danmosemsft,2015-07-15 04:14:40,https://api.github.com/repos/sokolovstas/SublimeWebInspector/git/commits/75a6ee690ec5dbb9506a97af1346cd35e70f0fa2,75a6ee690ec5dbb9506a97af1346cd35e70f0fa2,Space debugging buttons
danmosemsft,2015-07-15 03:50:52,https://api.github.com/repos/sokolovstas/SublimeWebInspector/git/commits/5fbc1fb62a7a506632784a7d1aaa012d71716d68,5fbc1fb62a7a506632784a7d1aaa012d71716d68,Some commenting and minor refactoring
danmosemsft,2015-07-15 02:41:52,https://api.github.com/repos/sokolovstas/SublimeWebInspector/git/commits/db678b02a684daa1c93c22af5930aa22f4331726,db678b02a684daa1c93c22af5930aa22f4331726,"Update tokens in tmLanguage files to be actual tokens
that exist at last in the default Monokai theme.
What the tokens should be isn't clear as each theme is different
(for example error won't always be red in other themes) but it's
useful to at least differentiate the tokens rather than just
use foreground.

For future reference, the default themes are zipped inside
Sublime Text 3\Packages\Color Scheme - Default.sublime-package
these can be viewed as text or in http://tmtheme-editor.herokuapp.com/.

To update the tmLanguage files, edit the JSON and then use the
AAAPackageDev sublime plugin to convert them from JSON to PList format
(which is the format that Sublime reads)"
danmosemsft,2015-07-15 01:18:47,https://api.github.com/repos/sokolovstas/SublimeWebInspector/git/commits/cd2fb631fc2381fa43d72c77c4c863c0dc09c38e,cd2fb631fc2381fa43d72c77c4c863c0dc09c38e,"When changing the console line prefixes I forgot to update the syntax
file so that they are tokenized correctly.
They aren't getting their own color though."
danmosemsft,2015-07-11 22:26:13,https://api.github.com/repos/sokolovstas/SublimeWebInspector/git/commits/2c93c5edc5d93c0b7d82e1321c30ec0f8ff2683c,2c93c5edc5d93c0b7d82e1321c30ec0f8ff2683c,Remove byte order marks
danmosemsft,2015-07-10 00:50:28,https://api.github.com/repos/sokolovstas/SublimeWebInspector/git/commits/bf5464e728fd17761911690a0566e47bd0f31b95,bf5464e728fd17761911690a0566e47bd0f31b95,"Clear file mapping pane on load and when writing to it.
Fix spelling"
danmosemsft,2015-07-10 00:34:04,https://api.github.com/repos/sokolovstas/SublimeWebInspector/git/commits/8563ec3ab0989b43e62f65da707c5fa3decc66f7,8563ec3ab0989b43e62f65da707c5fa3decc66f7,Fix spelling
danmosemsft,2015-07-10 00:29:30,https://api.github.com/repos/sokolovstas/SublimeWebInspector/git/commits/55cae808b780366243dfe5e9a622a9df786debbc,55cae808b780366243dfe5e9a622a9df786debbc,"Some users use query strings as cache breakers
We don't want these to mess up our url mapping.
Strip on url from debuggee, restore on url to debugger, so
this is invisible to our implemention.

Note IE and Chrome tools do show the query string in the tab title,
we could do more work if that is important.

Fix #59"
danmosemsft,2015-07-09 22:46:24,https://api.github.com/repos/sokolovstas/SublimeWebInspector/git/commits/92df223d891197431220fe016c7338e9a5c8cdb5,92df223d891197431220fe016c7338e9a5c8cdb5,Merge branch 'removedead' into ST3
danmosemsft,2015-07-09 22:42:45,https://api.github.com/repos/sokolovstas/SublimeWebInspector/git/commits/e81655e32ad646b4254e87a7dbfc761175ee529b,e81655e32ad646b4254e87a7dbfc761175ee529b,Fix exception when opening sublime without WI windows in workspace
danmosemsft,2015-07-09 22:41:02,https://api.github.com/repos/sokolovstas/SublimeWebInspector/git/commits/6a468648b3c193c116149177eee82c51d20df7d1,6a468648b3c193c116149177eee82c51d20df7d1,remove dead
danmosemsft,2015-07-09 07:34:33,https://api.github.com/repos/sokolovstas/SublimeWebInspector/git/commits/d801049acdf9c03eb2f703730caacd624d5b2c15,d801049acdf9c03eb2f703730caacd624d5b2c15,"Improve responsiveness of clicking on clickable regions (eg ""step into)
Clicking multiple times on the same ""button"" should work. However, Sublime
tends to fire on_selection_modified aggressively, so some throttling is
necessary.
Removed the check that rejected repeated clicks in the same place as this
is exactly what you want when clicking on a button several times.
Instead rely on throttling. 0.1 seconds seems reasonable.

The ideal solution here is some kind of 'mouse up' and 'mouse down'
notifications (or 'key up' and 'key down').

This might possibly help:
https://github.com/SublimeText/MouseEventListener/blob/master/mouse_event_listener.py"
danmosemsft,2015-07-09 07:29:29,https://api.github.com/repos/sokolovstas/SublimeWebInspector/git/commits/c4ee4480affe6592edb415cfc104dc67c5ebe2a0,c4ee4480affe6592edb415cfc104dc67c5ebe2a0,Fix clickable regions
danmosemsft,2015-07-09 06:40:28,https://api.github.com/repos/sokolovstas/SublimeWebInspector/git/commits/cd8902402000a5b5afbff8f7ff00822dcb4ca5cb,cd8902402000a5b5afbff8f7ff00822dcb4ca5cb,Clear scope (locals) on resume
danmosemsft,2015-07-09 06:31:43,https://api.github.com/repos/sokolovstas/SublimeWebInspector/git/commits/f40a93c0c80d5cefe1a1773c3a4c3bdd44579484,f40a93c0c80d5cefe1a1773c3a4c3bdd44579484,"Clarify console prefixes, cleaner standard window titles, and clear windows on reopening Sublime"
danmosemsft,2015-07-09 05:53:46,https://api.github.com/repos/sokolovstas/SublimeWebInspector/git/commits/b31e9a97c9fe2041f98e53c92eac2918d7a9d132,b31e9a97c9fe2041f98e53c92eac2918d7a9d132,Copy keyboard shortcuts into OSX and Linux keymaps
danmosemsft,2015-07-09 05:51:47,https://api.github.com/repos/sokolovstas/SublimeWebInspector/git/commits/41ad27deb30dd85c80dd33d23cff19cc6bcc9e18,41ad27deb30dd85c80dd33d23cff19cc6bcc9e18,Remove dead file
danmosemsft,2015-07-09 05:49:49,https://api.github.com/repos/sokolovstas/SublimeWebInspector/git/commits/4064da183b8a719b22ad17ee7bbe1dcc29bdd149,4064da183b8a719b22ad17ee7bbe1dcc29bdd149,Remove unnecessary messages folder. Refer to release descriptions on GitHub
danmosemsft,2015-07-09 05:44:01,https://api.github.com/repos/sokolovstas/SublimeWebInspector/git/commits/213638fb1d328ad6b2ef247b7f188a0d22767571,213638fb1d328ad6b2ef247b7f188a0d22767571,"Add common debugging shortcuts:

F5 Resume
F8 Toggle pause/resume (also Ctrl+\)
F10 Step over
F11 Step into
Shift+F11 Step out (also Ctrl+Shift+;)

The shortcuts were chosen to correspond to current behavior of the Chrome
developer tools and the Internet Explorer developer tools, excluding any
shortcuts that are already defined in the default Sublime mappings, with
these exceptions:

Ctrl+Shift+R  Already defined, overrides 'goto symbol'
F11 overrides Toggle full screen
Shift+F11 overrides Toggle distraction free

If the overrides are bothersome, we can change them."
danmosemsft,2015-07-09 05:06:30,https://api.github.com/repos/sokolovstas/SublimeWebInspector/git/commits/e879dcd3c7012f284d0777c626bfab4d977d4108,e879dcd3c7012f284d0777c626bfab4d977d4108,Add stub for timeline domain
danmosemsft,2015-07-09 05:01:01,https://api.github.com/repos/sokolovstas/SublimeWebInspector/git/commits/4177f723d6f447e56065460feb8bd958f733c170,4177f723d6f447e56065460feb8bd958f733c170,Rename WIP to WebKit for clarity
danmosemsft,2015-07-09 04:26:20,https://api.github.com/repos/sokolovstas/SublimeWebInspector/git/commits/15a7f3320a24e81e0bf290f6f44d4f512d80558f,15a7f3320a24e81e0bf290f6f44d4f512d80558f,Rename add/remove breakpoint to the more intuitive Toggle
danmosemsft,2015-06-11 07:09:57,https://api.github.com/repos/sokolovstas/SublimeWebInspector/git/commits/acd4dd555a41f982bc2d5d7ba645ac68378fe4bb,acd4dd555a41f982bc2d5d7ba645ac68378fe4bb,"Remove dead function.
Change current_line to only be set on break; it indicates the instruction
pointer, which is only set on a break. Just jumping from the stack or console
should not cause a highlight."
danmosemsft,2015-06-11 06:49:45,https://api.github.com/repos/sokolovstas/SublimeWebInspector/git/commits/44f6f2f86ca840c3509532156cf7ea3f27f7b702,44f6f2f86ca840c3509532156cf7ea3f27f7b702,"Uncomment step in, step out, and step over in the command list.
They work fine."
danmosemsft,2015-06-11 06:41:05,https://api.github.com/repos/sokolovstas/SublimeWebInspector/git/commits/e26dedebc2cb41ceb7557e3d8cf6c44ca64b8fde,e26dedebc2cb41ceb7557e3d8cf6c44ca64b8fde,"Support optional ""chrome_url"" setting in the user's settings that causes
the launch of Chrome to start on the page of interest rather than need
navigating.

I notice that for some reason, Chrome will sometimes still open a second tab,
which navigates to its own install directory. I can't figure out how to avoid
that, but the only effect is that it means Sublime gives you an extra URL to
pick from when you do ""Start Debugging"""
danmosemsft,2015-06-11 05:48:08,https://api.github.com/repos/sokolovstas/SublimeWebInspector/git/commits/b9079e06aba8bcf3c8316f688f09e274fa298714,b9079e06aba8bcf3c8316f688f09e274fa298714,"Fixed cases of no breakpoints, and of no current line."
danmosemsft,2015-06-11 05:24:14,https://api.github.com/repos/sokolovstas/SublimeWebInspector/git/commits/2b930894ca62ce8d8aefe308eeb5314dc969c1db,2b930894ca62ce8d8aefe308eeb5314dc969c1db,"Fix #89. Enable 'toggle breakpoint' when paused, including toggling the
breakpoint at the current location without losing the highlight."
danmosemsft,2015-06-11 03:21:35,https://api.github.com/repos/sokolovstas/SublimeWebInspector/git/commits/bbff20dfe99669f459277cb39b8a1e947accd1d7,bbff20dfe99669f459277cb39b8a1e947accd1d7,Fix #75 Chrome not found on 64 bit Windows
danmosemsft,2015-06-11 02:00:29,https://api.github.com/repos/sokolovstas/SublimeWebInspector/git/commits/71a9856e59d2a9e61623e17c0bd904ae42df799f,71a9856e59d2a9e61623e17c0bd904ae42df799f,Fix nondeterministic mapping from server to client paths. Issue #87
danmosemsft,2015-06-10 03:02:19,https://api.github.com/repos/sokolovstas/SublimeWebInspector/git/commits/f2edc8536cfb81a87ae4591bae77ae6c6d743ea9,f2edc8536cfb81a87ae4591bae77ae6c6d743ea9,Change Debugger.setOverlayMessage to Page.setOverlayMessage. Fix #84
sokolovstas,2015-06-10 03:51:39,https://api.github.com/repos/sokolovstas/SublimeWebInspector/git/commits/466e5358236ee102af35ae18d60b74055bce70c2,466e5358236ee102af35ae18d60b74055bce70c2,Added license
sokolovstas,2015-01-30 09:54:54,https://api.github.com/repos/sokolovstas/SublimeWebInspector/git/commits/62bf39e11b4dd8d9dc23e53ac52298bac980b47b,62bf39e11b4dd8d9dc23e53ac52298bac980b47b,Settings path fixed
sokolovstas,2014-08-21 14:40:08,https://api.github.com/repos/sokolovstas/SublimeWebInspector/git/commits/d7d4c10787734fc9ce856506bcc8b82d53513923,d7d4c10787734fc9ce856506bcc8b82d53513923,"Merge pull request #72 from enapupe/ST3

Fixed syntax on swi.py"
enapupe,2014-08-21 12:03:17,https://api.github.com/repos/sokolovstas/SublimeWebInspector/git/commits/31fe8939b712314895aa92dbcfaeeb02da22b1d3,31fe8939b712314895aa92dbcfaeeb02da22b1d3,"Fixed syntax on swi.py

removed ;"
sokolovstas,2014-08-21 04:42:36,https://api.github.com/repos/sokolovstas/SublimeWebInspector/git/commits/92c1c23d100e81f211a9a7d03d45c3b0b0264ce2,92c1c23d100e81f211a9a7d03d45c3b0b0264ce2,Added proxy support
sokolovstas,2014-08-20 17:30:56,https://api.github.com/repos/sokolovstas/SublimeWebInspector/git/commits/4e9adee403d5c46f8060633f9f4ee102856b6c2a,4e9adee403d5c46f8060633f9f4ee102856b6c2a,Fix paths and read me
sokolovstas,2013-10-23 15:03:08,https://api.github.com/repos/sokolovstas/SublimeWebInspector/git/commits/11c41c8d16c36138b1dff8603f1dca3cc7f54b04,11c41c8d16c36138b1dff8603f1dca3cc7f54b04,"Merge pull request #58 from ithcy/ST3

Implemented architecture detection for Windows chrome executable"
ithcy,2013-10-23 14:50:06,https://api.github.com/repos/sokolovstas/SublimeWebInspector/git/commits/cd43d9b9e2aaa52df781e98ef006b2d8e8be3533,cd43d9b9e2aaa52df781e98ef006b2d8e8be3533,"Restored chrome executable path for 32-bit windows to ""windows"" key to maintain backwards compatibility. x64 windows uses ""windows_x64""."
ithcy,2013-10-23 14:29:02,https://api.github.com/repos/sokolovstas/SublimeWebInspector/git/commits/77296345f81e6ea394621df1847453ebd8137bdb,77296345f81e6ea394621df1847453ebd8137bdb,"Implemented architecture detection for Windows chrome executable, so that 32-bit and 64-bit windows each have their own (hopefully correct) path.

This will break existing user settings if the user has a custom path to Chrome. Users must use the key ""windows_x64"" or ""windows_x32"" instead of ""windows"" in their user settings file."
sokolovstas,2013-10-23 13:53:39,https://api.github.com/repos/sokolovstas/SublimeWebInspector/git/commits/99e76c0b4e87a7a1d6119d294a826ffde0975616,99e76c0b4e87a7a1d6119d294a826ffde0975616,"Merge pull request #57 from ithcy/ST3

Updated Chrome executable path for Windows"
ithcy,2013-10-23 13:30:38,https://api.github.com/repos/sokolovstas/SublimeWebInspector/git/commits/9918a4deb7f36f61ea0df2866b6f1a5c0a06a115,9918a4deb7f36f61ea0df2866b6f1a5c0a06a115,Updated Chrome executable path for Windows
sokolovstas,2013-03-22 08:03:55,https://api.github.com/repos/sokolovstas/SublimeWebInspector/git/commits/e1c3857ceb8a5b20608a40f36f017a2bb9ff8ef5,e1c3857ceb8a5b20608a40f36f017a2bb9ff8ef5,Added overlay message
sokolovstas,2013-03-22 08:03:38,https://api.github.com/repos/sokolovstas/SublimeWebInspector/git/commits/92550a0f15dd6a4a989a92e2fb84bc6853a70920,92550a0f15dd6a4a989a92e2fb84bc6853a70920,Fix line number issue on pause
sokolovstas,2013-03-22 07:28:17,https://api.github.com/repos/sokolovstas/SublimeWebInspector/git/commits/42e3dd46220ce72170114807ec044ef2213f9d02,42e3dd46220ce72170114807ec044ef2213f9d02,Added -1 to add breakpoint line
sokolovstas,2013-03-21 12:08:29,https://api.github.com/repos/sokolovstas/SublimeWebInspector/git/commits/aae8105d587c3d487a48fac0082a266262a13d81,aae8105d587c3d487a48fac0082a266262a13d81,Fix path and file name issues fix #26
sokolovstas,2013-03-21 11:13:43,https://api.github.com/repos/sokolovstas/SublimeWebInspector/git/commits/75bc2f8a0023a2d5f2b8473449f7e4e8b7ed8c22,75bc2f8a0023a2d5f2b8473449f7e4e8b7ed8c22,"Add pause on exception support
Add debug mode to plugin
Add comments to settings"
sokolovstas,2013-03-21 10:23:38,https://api.github.com/repos/sokolovstas/SublimeWebInspector/git/commits/2cea46309a65868e78641ae5ac51820e17703e0f,2cea46309a65868e78641ae5ac51820e17703e0f,Imporved file search patter
sokolovstas,2013-03-21 09:40:52,https://api.github.com/repos/sokolovstas/SublimeWebInspector/git/commits/e50c27c54bd4e9c0db9cca8c1044542f800f97fb,e50c27c54bd4e9c0db9cca8c1044542f800f97fb,"Added evaluate on global object fix#14
Changed readme"
sokolovstas,2013-03-21 07:48:39,https://api.github.com/repos/sokolovstas/SublimeWebInspector/git/commits/5e78fbf90bb6c4064fb08d9b5be16764bd5d6fbc,5e78fbf90bb6c4064fb08d9b5be16764bd5d6fbc,Added Show mapping command
sokolovstas,2013-03-20 10:32:39,https://api.github.com/repos/sokolovstas/SublimeWebInspector/git/commits/234571dc494fda097ae97bd1c7c41447cb81c165,234571dc494fda097ae97bd1c7c41447cb81c165,Massive fix of script_to_file array and setting breakpoints
sokolovstas,2013-03-20 07:51:57,https://api.github.com/repos/sokolovstas/SublimeWebInspector/git/commits/896af45065f143608d366d85c73d333400f979ff,896af45065f143608d366d85c73d333400f979ff,Fixed issue with change script source and removed debug print
sokolovstas,2013-03-20 07:26:19,https://api.github.com/repos/sokolovstas/SublimeWebInspector/git/commits/a94e6d15d4cd4358371806746558b92f3e5f2f8d,a94e6d15d4cd4358371806746558b92f3e5f2f8d,Fixed menu entries
sokolovstas,2013-03-20 06:43:16,https://api.github.com/repos/sokolovstas/SublimeWebInspector/git/commits/3c8268475814dfa52389b089db750bc1ba8d0337,3c8268475814dfa52389b089db750bc1ba8d0337,Fixed repeat message
sokolovstas,2013-03-20 06:10:48,https://api.github.com/repos/sokolovstas/SublimeWebInspector/git/commits/931d764dda3bb906731e032272d908b1349c9940,931d764dda3bb906731e032272d908b1349c9940,Path changed to Web Inspector 3
sokolovstas,2013-03-19 22:07:03,https://api.github.com/repos/sokolovstas/SublimeWebInspector/git/commits/90205fbc36059b5d11e5a1d1a22915487d295923,90205fbc36059b5d11e5a1d1a22915487d295923,"Ported to ST3 fix #12
Added time delay 'reload_timeout' fix #21
Added user agent override 'user_agent' fix #22

Minor fixes with scriptId and paths"
sokolovstas,2013-03-19 14:05:53,https://api.github.com/repos/sokolovstas/SublimeWebInspector/git/commits/69c98ef5c4d1c9c78ce0a1423519a7da3f2709f2,69c98ef5c4d1c9c78ce0a1423519a7da3f2709f2,"Merge pull request #23 from buzzedword/patch-1

Update README.markdown"
buzzedword,2013-03-19 14:01:07,https://api.github.com/repos/sokolovstas/SublimeWebInspector/git/commits/76e5fe6f4a0bb4d50f90296579c268bce8aa2953,76e5fe6f4a0bb4d50f90296579c268bce8aa2953,"Update README.markdown

Edited for content, grammer, and spelling."
sokolovstas,2013-03-18 13:48:36,https://api.github.com/repos/sokolovstas/SublimeWebInspector/git/commits/74192362474c754b74757712e2096afc9b57daaf,74192362474c754b74757712e2096afc9b57daaf,"Merge pull request #20 from Jlaird/patch-1

Update README.markdown"
Jlaird,2013-03-18 13:46:44,https://api.github.com/repos/sokolovstas/SublimeWebInspector/git/commits/c8388a2cda82fde32b4b1ff6ec3dd9a978c578ff,c8388a2cda82fde32b4b1ff6ec3dd9a978c578ff,"Update README.markdown

Updated typos Inpsector to Inspector"
sokolovstas,2013-03-18 09:44:50,https://api.github.com/repos/sokolovstas/SublimeWebInspector/git/commits/9e16b22a02743ad2a7d653999f479e9a9202598c,9e16b22a02743ad2a7d653999f479e9a9202598c,"Merge pull request #15 from grrowl/master

Allow setting to specify which Chrome profile to load"
grrowl,2013-03-18 00:43:35,https://api.github.com/repos/sokolovstas/SublimeWebInspector/git/commits/9efe48088e859b62f15b24b5b05876bf4d0b9357,9efe48088e859b62f15b24b5b05876bf4d0b9357,Added setting to specify Chrome profile to load
sokolovstas,2013-03-17 15:26:16,https://api.github.com/repos/sokolovstas/SublimeWebInspector/git/commits/1b5190e48040a63a721ce08f2441ce15da625387,1b5190e48040a63a721ce08f2441ce15da625387,"Merge pull request #10 from TheHippo/patch-1

Update Linux Google Chrome path"
TheHippo,2013-03-17 11:10:36,https://api.github.com/repos/sokolovstas/SublimeWebInspector/git/commits/94dcb45e94cfebee8c67d55397472df425365f13,94dcb45e94cfebee8c67d55397472df425365f13,"Update Linux Google Chrome path

Update path of Google Chrome for Linux. This is were Google Chrome is installed via its officially installer."
sokolovstas,2013-03-15 06:08:54,https://api.github.com/repos/sokolovstas/SublimeWebInspector/git/commits/732542d2d15eb5893a5ab023c417f87ad483682a,732542d2d15eb5893a5ab023c417f87ad483682a,1.4
sokolovstas,2013-03-15 06:06:32,https://api.github.com/repos/sokolovstas/SublimeWebInspector/git/commits/6fe6e5fb76b27d3ad007157501b8a969647dc29f,6fe6e5fb76b27d3ad007157501b8a969647dc29f,updated to 1.3 version
sokolovstas,2013-03-14 20:31:13,https://api.github.com/repos/sokolovstas/SublimeWebInspector/git/commits/abb8d430bf805964972745e752c776d8cb294db3,abb8d430bf805964972745e752c776d8cb294db3,Fix reload_on_save flag
sokolovstas,2013-03-13 09:18:14,https://api.github.com/repos/sokolovstas/SublimeWebInspector/git/commits/b49aee1cd527ea0da7c679d611aed9c39812777b,b49aee1cd527ea0da7c679d611aed9c39812777b,"Fixed breakpoints after page refresh
Fixed crash on ""resume"" click"
sokolovstas,2013-03-11 15:46:53,https://api.github.com/repos/sokolovstas/SublimeWebInspector/git/commits/f8616699ad88297f8461ee3a1385058926e671c6,f8616699ad88297f8461ee3a1385058926e671c6,"Added os.getenv('GOOGLE_CHROME_PATH', '') for path to start Chrome"
sokolovstas,2013-03-11 14:23:06,https://api.github.com/repos/sokolovstas/SublimeWebInspector/git/commits/c62fdf6b7e7a0778a70279b8ae951c89dafb650d,c62fdf6b7e7a0778a70279b8ae951c89dafb650d,Added sass and scss files to reload styles only
sokolovstas,2013-03-01 10:09:45,https://api.github.com/repos/sokolovstas/SublimeWebInspector/git/commits/efa051a5ddd1d733a3b23f25219353b1ff669c5d,efa051a5ddd1d733a3b23f25219353b1ff669c5d,Added custom packages.json
sokolovstas,2013-03-01 09:23:13,https://api.github.com/repos/sokolovstas/SublimeWebInspector/git/commits/3dc1c8b58c84b4008e8d64bb9c37a72eba4fbff8,3dc1c8b58c84b4008e8d64bb9c37a72eba4fbff8,"Stack trace now printed in console
Fix print message in console
Close debug on protocol disconnect"
sokolovstas,2013-02-26 11:45:58,https://api.github.com/repos/sokolovstas/SublimeWebInspector/git/commits/73a51e3cc3e87979c755041d204aa984b865a492,73a51e3cc3e87979c755041d204aa984b865a492,Added evaluate on call frame
sokolovstas,2013-02-26 10:05:38,https://api.github.com/repos/sokolovstas/SublimeWebInspector/git/commits/1173271a4b372f7eccde1806e894b77f4e4339bb,1173271a4b372f7eccde1806e894b77f4e4339bb,"Runtime script changing if user set ""set_script_source"" to true. After saving js file debugger will be set script source without reload page."
sokolovstas,2013-02-26 10:02:58,https://api.github.com/repos/sokolovstas/SublimeWebInspector/git/commits/2e33f9cb2b372d7bbc619cfa0ca3615c88eb2f2b,2e33f9cb2b372d7bbc619cfa0ca3615c88eb2f2b,"Added wip prefix
Removed unwanted mapping"
sokolovstas,2013-02-26 10:01:49,https://api.github.com/repos/sokolovstas/SublimeWebInspector/git/commits/a0816d4d19bc22a0f61d12afb6bffbcc2050471d,a0816d4d19bc22a0f61d12afb6bffbcc2050471d,After script parsed just change scriptId of exist script array
sokolovstas,2013-02-25 10:41:20,https://api.github.com/repos/sokolovstas/SublimeWebInspector/git/commits/4f8e0b8fec517b78f66acbf37f4be954293f555a,4f8e0b8fec517b78f66acbf37f4be954293f555a,Fixed path for new google chrome
sokolovstas,2013-02-25 07:30:37,https://api.github.com/repos/sokolovstas/SublimeWebInspector/git/commits/bbeaf7d43760f5aa0d4cdcb2c8936bec8efcf712,bbeaf7d43760f5aa0d4cdcb2c8936bec8efcf712,Fixed readme
sokolovstas,2013-02-25 07:27:54,https://api.github.com/repos/sokolovstas/SublimeWebInspector/git/commits/6aec762b26a693e0034b14322f62cb9cf91d867e,6aec762b26a693e0034b14322f62cb9cf91d867e,Move breaks to user settings of Web Inspector plugin
sokolovstas,2013-02-14 04:52:20,https://api.github.com/repos/sokolovstas/SublimeWebInspector/git/commits/7674a9ad1f0d8160319b9f1539a379c12eb2ddf3,7674a9ad1f0d8160319b9f1539a379c12eb2ddf3,Added css reload on file save without external scripts
sokolovstas,2013-01-30 15:32:34,https://api.github.com/repos/sokolovstas/SublimeWebInspector/git/commits/4a8c8bcee2a08704176df3c712ee0a99d922c6da,4a8c8bcee2a08704176df3c712ee0a99d922c6da,Removed prints
sokolovstas,2013-01-30 15:25:25,https://api.github.com/repos/sokolovstas/SublimeWebInspector/git/commits/3e612c07f59f319051672ef684a1782fc6b1f0c6,3e612c07f59f319051672ef684a1782fc6b1f0c6,"Fixed some click handlers
Better Object displaying
Move reading breaks in try-catch"
