api-samples,"Code samples for YouTube APIs, including the YouTube Data API, YouTube Analytics API, and YouTube Live Streaming API. The repo contains language-specific directories that contain the samples."
username,timestamp,url,sha,message
AndyDiamondstein,2018-04-26 20:10:32,https://api.github.com/repos/youtube/api-samples/git/commits/07263305b59a7c3275bc7e925f9ce6cabf774022,07263305b59a7c3275bc7e925f9ce6cabf774022,Add .py sample for calling YT Analytics API (v2)
AndyDiamondstein,2018-04-26 19:43:49,https://api.github.com/repos/youtube/api-samples/git/commits/cdf1f87f5ede7dce8a17f14471f986d8821e68de,cdf1f87f5ede7dce8a17f14471f986d8821e68de,Add JS sample for calling YT Analytics API (v2)
AndyDiamondstein,2018-03-06 21:16:56,https://api.github.com/repos/youtube/api-samples/git/commits/53a12c02961c47a24ca32777e7af8b0e4e07d967,53a12c02961c47a24ca32777e7af8b0e4e07d967,Remove duplicate print statement
AndyDiamondstein,2018-03-06 20:49:28,https://api.github.com/repos/youtube/api-samples/git/commits/32f087d172e601cd02ecdcf207b5d076f603f1ac,32f087d172e601cd02ecdcf207b5d076f603f1ac,"Update nodejs quickstart example

- update code sample to address breaking changes in google-api-nodejs-client
- fs asynchronous functions display an error without a callback"
AndyDiamondstein,2017-10-27 21:10:37,https://api.github.com/repos/youtube/api-samples/git/commits/3732e66c11d5f2691bdac629226c501fc73e2277,3732e66c11d5f2691bdac629226c501fc73e2277,"Handle error case

When listing localizations, handle case where the channel section doesn't have any yet."
AndyDiamondstein,2017-10-27 21:09:25,https://api.github.com/repos/youtube/api-samples/git/commits/31bee48eb139164eafc35b35e12d67846672ba83,31bee48eb139164eafc35b35e12d67846672ba83,"Handle error case

For list action, the channel might not have localizations."
AndyDiamondstein,2017-10-27 21:07:40,https://api.github.com/repos/youtube/api-samples/git/commits/9e0a102355ea427655a4beafc3b666c7cc5b5b3d,9e0a102355ea427655a4beafc3b666c7cc5b5b3d,"For list action, video may not have localizations"
AndyDiamondstein,2017-10-27 21:01:03,https://api.github.com/repos/youtube/api-samples/git/commits/f1b9f38f5a5bdcd0dfe02292fb71f084fe01fdbe,f1b9f38f5a5bdcd0dfe02292fb71f084fe01fdbe,"Update auth libraries and make script improvements

The oauth2client library is deprecated. This update changes the sample to use the google-auth and google-auth-oauthlib libraries instead.

In addition, the code now has more flexible support for command-line arguments. For example, it does not set a default language by default ... you need to specify that on the command line. In addition, you can now add a localization without setting a default language or set a default language without adding a localization. (You cannot add localizations if the playlist doesn't have a default language at all, but once it does have a default language, you do not need to set it every subsequent time you run the script.)"
AndyDiamondstein,2017-10-27 20:12:41,https://api.github.com/repos/youtube/api-samples/git/commits/2fa8d26e895940b05d02f2c26fdcef8fbc0feaa9,2fa8d26e895940b05d02f2c26fdcef8fbc0feaa9,"Support more options, update auth flow

Add command line options for setting content owner (for onBehalfOfContentOwner parameter) and for whether the script should list system-managed reports when listing reports.

Instead of making --name a required command line argument, prompt the user to enter a name if one isn't set. This prompt occurs after the user selects a report type.

Allow user to set report type on command line and thereby bypass the report type selection.

The oauth2client library is deprecated. This update changes the sample to use the google-auth and google-auth-oauthlib libraries instead."
AndyDiamondstein,2017-10-27 19:12:36,https://api.github.com/repos/youtube/api-samples/git/commits/e084e3eff22376014aa28f82300d24250f4bd514,e084e3eff22376014aa28f82300d24250f4bd514,Delete obsolete code sample
AndyDiamondstein,2017-10-27 19:09:38,https://api.github.com/repos/youtube/api-samples/git/commits/d45d4fe55abb3b23b8e94bd07edf0ce317c24b7c,d45d4fe55abb3b23b8e94bd07edf0ce317c24b7c,"Update auth libs, default privacy status

The oauth2client library is deprecated. This update changes the sample to use the google-auth and google-auth-oauthlib libraries instead.

This update also updates the default privacy status for videos uploaded via this script to ""private"". The privacy status can be changed using the --privacyStatus command line argument."
AndyDiamondstein,2017-10-27 18:04:11,https://api.github.com/repos/youtube/api-samples/git/commits/b374c1ecf1279bb79c8d9bf0ae163f56f1236eab,b374c1ecf1279bb79c8d9bf0ae163f56f1236eab,Fix typos in comments
AndyDiamondstein,2017-10-27 18:00:29,https://api.github.com/repos/youtube/api-samples/git/commits/a0e45b621f6f6d516b13bc8960050a954e7f4624,a0e45b621f6f6d516b13bc8960050a954e7f4624,"Update script options, functionality, docs, auth

Functionality updates:
  - Add ability to run script for channel ID or content owner
  - Add option to set filters
  - Change default metrics, remove default max results
  - Remove additional call to YouTube Data API to get channel ID and just set ids=channel==MINE
  - Add function to properly set ""ids"" parameter depending on whether content-owner or channel-id command-line arguments are set
  - Pass API request parameters as keyword arguments (**args) rather than listing them line by line

The functionality in the script is more thoroughly documented. Also see the Prerequisites section of the README file for more information about running this sample.

Finally, the oauth2client library is deprecated. This update changes the sample to use the google-auth and google-auth-oauthlib libraries instead."
AndyDiamondstein,2017-10-27 15:47:52,https://api.github.com/repos/youtube/api-samples/git/commits/d598fb3634820fbf91696f13cc8d4282a5f4c857,d598fb3634820fbf91696f13cc8d4282a5f4c857,"Update auth libraries and make script improvements

The oauth2client library is deprecated. This update changes the sample to use the google-auth and google-auth-oauthlib libraries instead.

In addition, the code now has more flexible support for command-line arguments. For example, it does not set a default language by default ... you need to specify that on the command line. In addition, you can now add a localization without setting a default language or set a default language without adding a localization.

Finally, the --mine argument lets you list all of your channel's sections and their localized values, making it easier to then use the script to add a localization for a single channel section."
AndyDiamondstein,2017-10-27 15:14:46,https://api.github.com/repos/youtube/api-samples/git/commits/c8e98d8da316a9d45b1a15082145a1710b4ec444,c8e98d8da316a9d45b1a15082145a1710b4ec444,"Update auth libraries, add options, documentation

The oauth2client library is deprecated. This update changes the sample to use the google-auth and google-auth-oauthlib libraries instead.

The updated script has improved options, allowing the user to set a content owner ID, job ID, report URL, and/or local filename using command-line arguments. The logic also now bypasses certain functions depending on the command-line arguments set. For example, if you specify the URL of the report that you want to download, the script doesn't prompt you to select a job and a report (since you've already done that).

The prerequisites section in the README file explains how to run this sample (and others in this directory)."
AndyDiamondstein,2017-10-27 15:13:18,https://api.github.com/repos/youtube/api-samples/git/commits/dfd5cfdf63716f704a3bf0876dae90f78122f0a5,dfd5cfdf63716f704a3bf0876dae90f78122f0a5,Add prerequisites
AndyDiamondstein,2017-10-26 21:25:31,https://api.github.com/repos/youtube/api-samples/git/commits/7a7aa3e2d69e4d1b7f71ec91b6ad23864eeb1661,7a7aa3e2d69e4d1b7f71ec91b6ad23864eeb1661,"Update auth libraries, add title/description args

The oauth2client library is deprecated. This update changes the sample to use the google-auth and google-auth-oauthlib libraries instead.

The changes also add --title and --description arguments for the playlist title and description.

A final note is that this script seems to be misnamed. This change did not change the functionality of the script, but it's likely a future change will either make this script update a playlist rather than insert one or provide an option for selecting an operation to perform for a playlist."
AndyDiamondstein,2017-10-24 13:43:38,https://api.github.com/repos/youtube/api-samples/git/commits/2ac0c7e9d8ac2e1b1b923d1a67ffd9422159835b,2ac0c7e9d8ac2e1b1b923d1a67ffd9422159835b,"Update auth libraries, add snippet metadata opts

The oauth2client library is deprecated. This update changes the sample to use the google-auth and google-auth-oauthlib libraries instead.

In addition, the code now supports other arguments for updating snippet metadata (title, description, tags). The --tags argument replaces the existing tags, while the --add_tag argument appends a tag to the current list."
AndyDiamondstein,2017-10-23 15:29:49,https://api.github.com/repos/youtube/api-samples/git/commits/f9ea8bfa59aa2c2068b0dbd648d627996842469d,f9ea8bfa59aa2c2068b0dbd648d627996842469d,"Update auth libraries

The oauth2client library is deprecated. This update changes the sample to use the google-auth and google-auth-oauthlib libraries instead."
AndyDiamondstein,2017-10-23 15:22:35,https://api.github.com/repos/youtube/api-samples/git/commits/e09f1feb51a5b4b275501e0414478d6e567cc7bc,e09f1feb51a5b4b275501e0414478d6e567cc7bc,"Update auth libraries, separate ""set"" operations

The oauth2client library is deprecated. This update changes the sample to use the google-auth and google-auth-oauthlib libraries instead.

In addition, the code for setting video localizations has been updated so that if the default language is set, the code checks to see whether the video has a title and description in that language. If so, the script sets the video's title and description to the current title and description in the default language. (Without that step, the title and description for the new default language are changed to match the title and description of the old default language.)"
AndyDiamondstein,2017-10-20 18:50:38,https://api.github.com/repos/youtube/api-samples/git/commits/b38c3d22a2c8ce935e8b65f5ea86087e810cea97,b38c3d22a2c8ce935e8b65f5ea86087e810cea97,"Update auth libraries, fix script

The oauth2client library is deprecated. This update changes the sample to use the google-auth and google-auth-oauthlib libraries instead.

This update also fixes this script so that it executes properly."
AndyDiamondstein,2017-10-20 17:42:00,https://api.github.com/repos/youtube/api-samples/git/commits/37022382ee87ac6cb9a1efa747042d33b2b489de,37022382ee87ac6cb9a1efa747042d33b2b489de,"Update auth libraries, fix brandingSettings update

The oauth2client library is deprecated. This update changes the sample to use the google-auth and google-auth-oauthlib libraries instead. Update code sample to update brandingSettings (defaultLanguage) and localizations separately. Support localized channel title and localized channel description."
AndyDiamondstein,2017-10-20 16:41:40,https://api.github.com/repos/youtube/api-samples/git/commits/f058c43383fbfc640c162ca5bdb72bbaeaaf26ce,f058c43383fbfc640c162ca5bdb72bbaeaaf26ce,"Update auth libraries used in example

The oauth2client library is deprecated. This update changes the sample to use the google-auth and google-auth-oauthlib libraries instead."
AndyDiamondstein,2017-10-20 16:40:39,https://api.github.com/repos/youtube/api-samples/git/commits/b0a876292289d818b9c01e22325d9accf1a3cd46,b0a876292289d818b9c01e22325d9accf1a3cd46,"Update auth libraries used in example

The oauth2client library is deprecated. This update changes the sample to use the google-auth and google-auth-oauthlib libraries instead."
AndyDiamondstein,2017-10-20 16:37:12,https://api.github.com/repos/youtube/api-samples/git/commits/4dc5d936d545f53ad71890750df889d0053b294a,4dc5d936d545f53ad71890750df889d0053b294a,Fix instructional comment
AndyDiamondstein,2017-10-20 16:36:47,https://api.github.com/repos/youtube/api-samples/git/commits/38651dec50dcc425196f7708ca0206dffea51bae,38651dec50dcc425196f7708ca0206dffea51bae,"Remove oauth2client usages

Remove usage of oauth2client library, which is now deprecated."
AndyDiamondstein,2017-10-20 16:32:24,https://api.github.com/repos/youtube/api-samples/git/commits/175641601483e7e2812062fc6e31650940806961,175641601483e7e2812062fc6e31650940806961,"Update auth libraries, add rating argument

The oauth2client library is deprecated. This update changes the sample to use the google-auth and google-auth-oauthlib libraries instead. Also add a rating argument that can be passed on the command line."
AndyDiamondstein,2017-10-20 16:22:34,https://api.github.com/repos/youtube/api-samples/git/commits/27f1205805439aff26ccf6d1c9b98c0f8d228c04,27f1205805439aff26ccf6d1c9b98c0f8d228c04,"Remove oauth2client usages.

Update search.py to remove usage of deprecated oauth2client library."
AndyDiamondstein,2017-10-20 16:10:25,https://api.github.com/repos/youtube/api-samples/git/commits/8235ff8d3f1757a0b4b6b5e9d8f583e70d9a1f29,8235ff8d3f1757a0b4b6b5e9d8f583e70d9a1f29,"Update auth libraries used in example

The oauth2client library is deprecated. This update changes the sample to use the google-auth and google-auth-oauthlib libraries instead."
AndyDiamondstein,2017-10-19 22:19:00,https://api.github.com/repos/youtube/api-samples/git/commits/c03017d41a1184dc469486acdb2e8d3b121ccdbf,c03017d41a1184dc469486acdb2e8d3b121ccdbf,"Update auth libraries used in example

The oauth2client library is deprecated. This update changes the sample to use the google-auth and google-auth-oauthlib libraries instead."
AndyDiamondstein,2017-09-29 16:05:04,https://api.github.com/repos/youtube/api-samples/git/commits/fe3b13a5e9f574d472119f933982f21c4550c547,fe3b13a5e9f574d472119f933982f21c4550c547,Minor formatting fixes
AndyDiamondstein,2017-09-29 16:03:33,https://api.github.com/repos/youtube/api-samples/git/commits/b32b9f6ef1291c8e129132f9a09bbea37db02de9,b32b9f6ef1291c8e129132f9a09bbea37db02de9,Additional simplifications to quickstart
AndyDiamondstein,2017-09-29 15:57:32,https://api.github.com/repos/youtube/api-samples/git/commits/62cfdb9d4c3b00340520acb3f756181c5314d166,62cfdb9d4c3b00340520acb3f756181c5314d166,Remove functions not needed in quickstart app
AndyDiamondstein,2017-09-29 15:54:08,https://api.github.com/repos/youtube/api-samples/git/commits/aa7b057c5757f3109e7235b4a8b99499c2d4e909,aa7b057c5757f3109e7235b4a8b99499c2d4e909,Remove commented out statement
AndyDiamondstein,2017-09-29 15:52:45,https://api.github.com/repos/youtube/api-samples/git/commits/d788e74a9b1a51046ec6de7eafac980c39d124ad,d788e74a9b1a51046ec6de7eafac980c39d124ad,"Update quickstart.py auth libraries

Update auth library from oauth2client to google-auth."
AndyDiamondstein,2017-09-29 15:01:36,https://api.github.com/repos/youtube/api-samples/git/commits/5b036f3e798db6b3432773b1d361631c5d0de318,5b036f3e798db6b3432773b1d361631c5d0de318,"Create quickstart_web.py file

Add sample for quickstart guide that shows how to create a simple Python app that uses the Flask web application framework."
AndyDiamondstein,2017-08-16 16:44:27,https://api.github.com/repos/youtube/api-samples/git/commits/5193a5a4decc848bad8fa09c72e5aa46c7d260d2,5193a5a4decc848bad8fa09c72e5aa46c7d260d2,"Update retrieve_reports.php

Support command-line parameters to set content owner, job ID, download URL. Support option to include system-managed reports. Update auth flow."
AndyDiamondstein,2017-08-16 16:26:53,https://api.github.com/repos/youtube/api-samples/git/commits/170530f14c5713d52d9f985643de9e06f1df7ad8,170530f14c5713d52d9f985643de9e06f1df7ad8,"Merge pull request #131 from daniel-zahariev/master

Fix report downloading in PHP example #70"
AndyDiamondstein,2017-08-15 15:07:30,https://api.github.com/repos/youtube/api-samples/git/commits/720dc5c43f014d23168d697edcfc1e1d458e4864,720dc5c43f014d23168d697edcfc1e1d458e4864,Update README.md
AndyDiamondstein,2017-08-15 15:05:22,https://api.github.com/repos/youtube/api-samples/git/commits/e869e9526600916e5c398b623e009d84e3dd5450,e869e9526600916e5c398b623e009d84e3dd5450,"Add sample for playlists.list method

This sample shows how to use the playlists.list method. Use command-line flags to specify the query you want to run."
AndyDiamondstein,2017-08-11 18:42:59,https://api.github.com/repos/youtube/api-samples/git/commits/788ebac9979ebdab558ee7d0373a07ec1aeb0f56,788ebac9979ebdab558ee7d0373a07ec1aeb0f56,Add example for upload_video.go to README
AndyDiamondstein,2017-08-11 18:40:59,https://api.github.com/repos/youtube/api-samples/git/commits/8f1af187d39691de8b22daccfcbb26fc253d4fcc,8f1af187d39691de8b22daccfcbb26fc253d4fcc,Update code to use newer oauth2.go file
AndyDiamondstein,2017-08-11 18:29:06,https://api.github.com/repos/youtube/api-samples/git/commits/d4c68cb488e6b4aa6d454a618af0c62d1f185e72,d4c68cb488e6b4aa6d454a618af0c62d1f185e72,Use standard error handler for API response
AndyDiamondstein,2017-08-11 17:12:51,https://api.github.com/repos/youtube/api-samples/git/commits/cdd3985b4e3128f768202ccc288977e7e98dd95c,cdd3985b4e3128f768202ccc288977e7e98dd95c,Remove example using obsolete OAuth code
AndyDiamondstein,2017-08-11 17:12:01,https://api.github.com/repos/youtube/api-samples/git/commits/df2ae7ca63534669f0e5259bb56812ea7ef40dd6,df2ae7ca63534669f0e5259bb56812ea7ef40dd6,"Delete obsolete version of oauth code

Please refer to oauth2.go instead."
AndyDiamondstein,2017-08-11 17:10:15,https://api.github.com/repos/youtube/api-samples/git/commits/4968ec0dae5dfcb5fdff4a575e702d7bf047306e,4968ec0dae5dfcb5fdff4a575e702d7bf047306e,Retrieve my uploads also calls channels.list
AndyDiamondstein,2017-08-11 17:09:11,https://api.github.com/repos/youtube/api-samples/git/commits/d42037722324803930737c609d8a26f81e37e24f,d42037722324803930737c609d8a26f81e37e24f,Recommend latest Go version
AndyDiamondstein,2017-08-11 17:08:24,https://api.github.com/repos/youtube/api-samples/git/commits/4ed97339dd0b47aed88f8d5a7f99d8e80b517a83,4ed97339dd0b47aed88f8d5a7f99d8e80b517a83,"Explain how to authorize requests and run samples

Fix explanation of how to authorize requests and run samples."
AndyDiamondstein,2017-08-11 16:57:47,https://api.github.com/repos/youtube/api-samples/git/commits/c8a19d23443882b5d05b629b803f158abc358f9c,c8a19d23443882b5d05b629b803f158abc358f9c,Add simple error handler
AndyDiamondstein,2017-08-11 16:56:07,https://api.github.com/repos/youtube/api-samples/git/commits/fd21cdebf823878ca83d2e5f0a7df0d940852074,fd21cdebf823878ca83d2e5f0a7df0d940852074,Update code to simplify auth flow
AndyDiamondstein,2017-08-11 16:14:42,https://api.github.com/repos/youtube/api-samples/git/commits/08bd397ff23d9b136bb67a0bba71eaa0097f8b57,08bd397ff23d9b136bb67a0bba71eaa0097f8b57,"Move more auth logic to oauth2.go

Move read of client_secret.json to oauth2.go and set RedirectURL there as well."
AndyDiamondstein,2017-08-11 15:45:46,https://api.github.com/repos/youtube/api-samples/git/commits/0edd15a44a82fdfbb64c0c4ab7348c94d8c7f1c8,0edd15a44a82fdfbb64c0c4ab7348c94d8c7f1c8,"Remove old references to code.google.com

Update README to remove obsolete references."
AndyDiamondstein,2017-08-11 15:34:57,https://api.github.com/repos/youtube/api-samples/git/commits/8045ac23b73edfe9f9bed2924c8d5452801006ac,8045ac23b73edfe9f9bed2924c8d5452801006ac,"Create oauth2.go file

Update authorization example to show how to obtain code via web server or via command-line prompt."
AndyDiamondstein,2017-07-17 16:06:25,https://api.github.com/repos/youtube/api-samples/git/commits/1b73a4cba6dca5f2e01fa30145166a2b367de06e,1b73a4cba6dca5f2e01fa30145166a2b367de06e,"Merge pull request #135 from njuettner/master

replace old package paths"
njuettner,2017-07-16 10:23:22,https://api.github.com/repos/youtube/api-samples/git/commits/84b332b42b2002bc51fa58d485a9b89692b5a8c9,84b332b42b2002bc51fa58d485a9b89692b5a8c9,replace old package paths
AndyDiamondstein,2017-06-20 14:38:29,https://api.github.com/repos/youtube/api-samples/git/commits/6a4c3b283ce9e59e64e803173ddb5c35936b6e19,6a4c3b283ce9e59e64e803173ddb5c35936b6e19,Fix name of client_secret.json file.
AndyDiamondstein,2017-06-20 14:33:23,https://api.github.com/repos/youtube/api-samples/git/commits/c086040967207efb7efd4b109edfc97f25a7fe89,c086040967207efb7efd4b109edfc97f25a7fe89,Fix require autoload.php statement.
AndyDiamondstein,2017-04-25 17:58:36,https://api.github.com/repos/youtube/api-samples/git/commits/875d380396ba5771322f7d1bf678bbf42b63ecc6,875d380396ba5771322f7d1bf678bbf42b63ecc6,Add file for coming-soon Apps Script quickstart guide.
AndyDiamondstein,2017-04-25 16:02:34,https://api.github.com/repos/youtube/api-samples/git/commits/954f7e0cc35b03b03adca7557128e083df76a9c0,954f7e0cc35b03b03adca7557128e083df76a9c0,Add file for coming-soon node.js quickstart guide.
AndyDiamondstein,2017-04-25 15:33:47,https://api.github.com/repos/youtube/api-samples/git/commits/47c49fed14859957ed74fd2706259935937eb885,47c49fed14859957ed74fd2706259935937eb885,Add file for coming-soon JS quickstart guide.
AndyDiamondstein,2017-04-25 14:47:29,https://api.github.com/repos/youtube/api-samples/git/commits/b9e6a9aea0a97d8300271a3c8c0668ac88d6a246,b9e6a9aea0a97d8300271a3c8c0668ac88d6a246,Add file for coming-soon Java quickstart guide.
AndyDiamondstein,2017-04-24 22:11:39,https://api.github.com/repos/youtube/api-samples/git/commits/f66c00abdf854da3dccc7c0ec17f1a34a9cdae47,f66c00abdf854da3dccc7c0ec17f1a34a9cdae47,Fix name of client_secret.json file in example.
AndyDiamondstein,2017-04-24 22:07:25,https://api.github.com/repos/youtube/api-samples/git/commits/d810b927c243db04ffcf6eff0d58ab1b79f13222,d810b927c243db04ffcf6eff0d58ab1b79f13222,Add file for coming-soon Go quickstart guide.
AndyDiamondstein,2017-04-24 21:29:34,https://api.github.com/repos/youtube/api-samples/git/commits/53c6d50a1872c71b49c6c6104572aa8db5585f3f,53c6d50a1872c71b49c6c6104572aa8db5585f3f,Add file for coming-soon Ruby quickstart guide.
AndyDiamondstein,2017-04-24 20:50:49,https://api.github.com/repos/youtube/api-samples/git/commits/55bf40114f1cd9e1c4d1da246fe1d55707695c8d,55bf40114f1cd9e1c4d1da246fe1d55707695c8d,Add file for coming-soon Python quickstart guide.
AndyDiamondstein,2017-04-24 18:35:19,https://api.github.com/repos/youtube/api-samples/git/commits/f37fb9f4288a780b90860f8c81bb75da672a01f8,f37fb9f4288a780b90860f8c81bb75da672a01f8,Add file for coming-soon PHP quickstart guide.
mchambers,2017-03-28 21:22:37,https://api.github.com/repos/youtube/api-samples/git/commits/48b423053d57411ac27be9a3d3bfb230bb41aba7,48b423053d57411ac27be9a3d3bfb230bb41aba7,"Merge pull request #110 from jimrogerz/live_chat

Add samples for live chat"
mchambers,2017-03-27 22:50:59,https://api.github.com/repos/youtube/api-samples/git/commits/0b62f83621a0d6707a218ea05c24b0ad82e59386,0b62f83621a0d6707a218ea05c24b0ad82e59386,"Merge pull request #109 from jimrogerz/fix_broadcast_list

Set broadcast type when listing broadcasts, otherwise nothing is returned"
AndyDiamondstein,2017-01-13 15:37:46,https://api.github.com/repos/youtube/api-samples/git/commits/47727f97d74d3c72537e6b5a93e662b4c1052e7c,47727f97d74d3c72537e6b5a93e662b4c1052e7c,"Merge pull request #94 from jen-obyrne/master

Fix sample urls on all the language projects Read Me's"
AndyDiamondstein,2016-12-20 18:24:48,https://api.github.com/repos/youtube/api-samples/git/commits/d2347677abe9ac74f863ff0acafa9d48bff3d9cb,d2347677abe9ac74f863ff0acafa9d48bff3d9cb,"Merge pull request #90 from rasa/patch-1

Workaround github's formatter bug"
rasa,2016-12-20 18:19:19,https://api.github.com/repos/youtube/api-samples/git/commits/7d75b788da505ec67ee8b2cb56600dbe6eea76df,7d75b788da505ec67ee8b2cb56600dbe6eea76df,Workaround github's formatter bug
matthewayne,2016-12-09 18:54:33,https://api.github.com/repos/youtube/api-samples/git/commits/fe307fd1d2029fc5dc563cef4f315c7f5ad2e78c,fe307fd1d2029fc5dc563cef4f315c7f5ad2e78c,Fix typo in developer key detection
AndyDiamondstein,2016-12-05 21:19:02,https://api.github.com/repos/youtube/api-samples/git/commits/6f5d67b56580cb61e79a18dd900c5253e720d428,6f5d67b56580cb61e79a18dd900c5253e720d428,Add README.md for Apps Script snippets
AndyDiamondstein,2016-12-05 21:01:43,https://api.github.com/repos/youtube/api-samples/git/commits/a394a3a720e1f049882d1bc9e2bd67ed5b1ec82c,a394a3a720e1f049882d1bc9e2bd67ed5b1ec82c,"Create file with snippets for all API read methods

This file contains snippets generated using default parameter values in the API code snippet tool at https://devsite.googleplex.com/youtube/v3/code_samples/code_snippets. The file contains the boilerplate code for Apps Script, which is a basic function that prints some output from each API response to the logging console as well as all of the snippets for the API methods. Currently, the functions cover all of the API's read-only methods."
AndyDiamondstein,2016-11-29 19:13:48,https://api.github.com/repos/youtube/api-samples/git/commits/4d20a4306a6b24a99148fbec5d40699b4c0e918b,4d20a4306a6b24a99148fbec5d40699b4c0e918b,Formatting
AndyDiamondstein,2016-11-29 19:11:09,https://api.github.com/repos/youtube/api-samples/git/commits/c288f5548bd59e57091c2dcd3d5d3441767d7e53,c288f5548bd59e57091c2dcd3d5d3441767d7e53,Update description of YT Analytics sample
AndyDiamondstein,2016-11-29 16:39:02,https://api.github.com/repos/youtube/api-samples/git/commits/85d43c74f83a3eb5793a9d6a2782207407e696f3,85d43c74f83a3eb5793a9d6a2782207407e696f3,Fix typo
AndyDiamondstein,2016-11-29 16:38:42,https://api.github.com/repos/youtube/api-samples/git/commits/2da27de120809ef23bf61f46219aaf9cfefecf19,2da27de120809ef23bf61f46219aaf9cfefecf19,Fix typo
